username;date;retweets;favorites;text;geo;mentions;hashtags;id;permalink;retweetornot
Pnw4Wheeler;2018-06-30 15:25;75;194;"I’m not a right wing or left wing, I go with what I believe is best. Served almost 24 Years for this country! I drive around and see more hate then I have seen in Afghanistan and Pakistan. It’s really becoming just unreal what people believe these days. #WalkAway";;;#WalkAway;"1013141438010232832";https://twitter.com/Pnw4Wheeler/status/1013141438010232832;0
TroyMGood1;2018-06-30 15:22;198;273;"No more!! #WalkAway We are awake and paying attention thanks to @realDonaldTrump and we are taking our country back from the crooked politicians who've almost destroyed it! #MAGA #DrainTheSwamp & #KAG pic.twitter.com/dVSdDK7SN8";;@realDonaldTrump;#WalkAway #MAGA #DrainTheSwamp #KAG;"1013140704816783360";https://twitter.com/TroyMGood1/status/1013140704816783360;0
unscriptedmike;2018-06-30 15:20;63;113;"#walkaway #FamiliesBelongTogetherMarch Today, thousands of Democrats likely walked away. More probably walked away than marched today. And, after today, they’ll quit marching, but they won’t quit walking.";;;#walkaway #FamiliesBelongTogetherMarch;"1013140341682262016";https://twitter.com/unscriptedmike/status/1013140341682262016;0
BradMoo08282326;2018-06-30 15:20;6;98;"#WalkAway";;;#WalkAway;"1013140248191209473";https://twitter.com/BradMoo08282326/status/1013140248191209473;0
UpstateMichael;2018-06-30 15:15;0;0;"More Feinstein Fake Sensationalism!! #WalkAway #FakeNews #FakeNewsCNN #Democrats #SCOTUS #scotus #TermLimits";;;#WalkAway #FakeNews #FakeNewsCNN #Democrats #SCOTUS #scotus #TermLimits;"1013138879350820864";https://twitter.com/UpstateMichael/status/1013138879350820864;0
hfinch61;2018-06-30 15:14;207;335;"Trotting toddlers out in 100+ degree heat wearing agit propaganda to further Leftwing political agendas. This, is the Left. #WalkAway This, is @CNN #FakeNews https:// twitter.com/CNN/status/101 3133839064031232 …";;@CNN;#WalkAway #FakeNews;"1013138795573719040";https://twitter.com/hfinch61/status/1013138795573719040;1
unscriptedmike;2018-06-30 15:12;136;234;"#walkaway A friend of mine, a former moderate Democrat, recently left his party. I asked him why. “Well, they were gradually becoming un-American,” he said. “But I hung in there, thinking it was a phase. It’s when they turned anti-American, that I said this is crazy. And left.”";;;#walkaway;"1013138311370674177";https://twitter.com/unscriptedmike/status/1013138311370674177;0
Pismo_B;2018-06-30 15:08;21;42;"DemocRATS want to shut down @ICEgov , because they have lost African Americans & Hispanic Americans to #MAGA / #WalkAway movement. DemocRats support Open Borders, because they need "New Recruits"";;@ICEgov;#MAGA #WalkAway;"1013137100911153153";https://twitter.com/Pismo_B/status/1013137100911153153;0
lateresajones;2018-06-30 15:07;43;110;"Life is a journey, God is my guide; we travel safely together, side by side. #WalkAway from hate. Embrace";;;#WalkAway;"1013136884581748742";https://twitter.com/lateresajones/status/1013136884581748742;0
grykon;2018-06-30 15:06;82;230;"Judging by the amount of former liberals tweeting #WalkAway on my feed, the movement is real and will be reflected in November! #KAG";;;#WalkAway #KAG;"1013136790767710219";https://twitter.com/grykon/status/1013136790767710219;0
HeshmatAlavi;2018-06-30 15:06;421;542;"This is something to hear from Sen. Robert Torricelli, a Democrat talking about standing alongside his Democratic allies AND Republicans, all behind US President Donald Trump for the destruction of the mullahs in #Iran . #IranRegimeChange #FreeIran2018 #QAnon #WalkAway pic.twitter.com/UUPcUq3X2J";;;#Iran #IranRegimeChange #FreeIran2018 #QAnon #WalkAway;"1013136676099579905";https://twitter.com/HeshmatAlavi/status/1013136676099579905;0
Hart30158;2018-06-30 15:01;27;137;"Oh we will get out and vote no doubt #MAGA #WalkAway #BuildTheWall 63,000 killed by illegal immigrants since 9/11 #AngelFamilies";;;#MAGA #WalkAway #BuildTheWall #AngelFamilies;"1013135431041474562";https://twitter.com/Hart30158/status/1013135431041474562;0
crickafer00;2018-06-30 14:50;456;693;"It is no longer Republican VS. Democrat. It is now those that love this country & the freedom she offers (Republicans, Libertarians & Democrats) VS. the Leftist’s that want to see a Marxist/Socialist nation. I encourage all that have not yet done so to please #WalkAway";;;#WalkAway;"1013132564289212417";https://twitter.com/crickafer00/status/1013132564289212417;0
gotspeed2burn;2018-06-30 14:48;230;278;"Make America Great Again!!! #WalkAway #RedWaveRising2018 #AmericaFirst #MAGA #WWG1WGA @lonestarmango @popstherock33 @MAGAcomeuppance pic.twitter.com/T0DxtrOD0d";;@lonestarmango @popstherock33 @MAGAcomeuppance;#WalkAway #RedWaveRising2018 #AmericaFirst #MAGA #WWG1WGA;"1013132277717569536";https://twitter.com/gotspeed2burn/status/1013132277717569536;0
plramirez;2018-06-30 14:38;216;460;"#WalkAway is genuine. It's peaceful. It's powerful. There are no broken windows. There are no burning cars.. The #WalkAwayCampaign got it right!";;;#WalkAway #WalkAwayCampaign;"1013129692528799749";https://twitter.com/plramirez/status/1013129692528799749;0
hrtablaze;2018-06-30 14:35;22;39;"Liberals: We want better gun laws, stop the senseless killings Also Liberals: Kill Trump and Pence #WalkAway #MAGA https:// twitter.com/carrieksada/st atus/1013121438428028928 …";;;#WalkAway #MAGA;"1013128815302725632";https://twitter.com/hrtablaze/status/1013128815302725632;1
plramirez;2018-06-30 14:31;196;371;"I voted for #JerryBrown in the belief #Liberals would improve #California - #EpicFail . As a #Latino , #gay , married man, I now recognize that #Democrats use us as political capital and shame #LBGT for independent thought. 2016 I voted #Trump . Life is grand! #WalkAway #MAGA";;;#JerryBrown #Liberals #California #EpicFail #Latino #gay #Democrats #LBGT #Trump #WalkAway #MAGA;"1013128004975845377";https://twitter.com/plramirez/status/1013128004975845377;0
TopInfoBlogs;2018-06-30 14:23;103;277;"#WalkAwayMovement #WalkAway http:// is.gd/B5dxx5 pic.twitter.com/gy61HapZhB";;;#WalkAwayMovement #WalkAway;"1013125964417495040";https://twitter.com/TopInfoBlogs/status/1013125964417495040;0
Carrie_Kelly17;2018-06-30 13:41;43;35;"Dems want Recession, Impeachment, Anarchy, Abortion, and now NUCLEAR WAR.. #WalkAway Dems want to #KeepFamiliesTogether while they kill everybody. Steyer: Maybe We Can Have a ‘Nuclear War’ to Provide a ‘Real Course Correction’ to Trump via @freebeacon http:// freebeacon.com/politics/steye r-maybe-can-nuclear-war-provide-real-course-correction-trump/ …";;@freebeacon;#WalkAway #KeepFamiliesTogether;"1013115246603657221";https://twitter.com/Carrie_Kelly17/status/1013115246603657221;0
KamVTV;2018-06-30 13:40;169;371;"The ones with knowledge are feared. The ones without knowledge.... controlled. #FreeThinker #WalkAway";;;#FreeThinker #WalkAway;"1013115034824683520";https://twitter.com/KamVTV/status/1013115034824683520;0
LadyThriller69;2018-06-30 13:38;125;316;"It's ok to #WalkAway pic.twitter.com/ZazO5sZiYp";;;#WalkAway;"1013114634406989825";https://twitter.com/LadyThriller69/status/1013114634406989825;0
TheBlackDemexit;2018-06-30 13:37;186;352;"As a registered Independent who's a Black American, Im calling on more of Black society to #walkaway from the @DNC . Since they care more for #IllegalAliens than the economic interests of Black voters who were BORN here, time for a #DemExit #HYON";;@DNC;#walkaway #IllegalAliens #DemExit #HYON;"1013114293632557062";https://twitter.com/TheBlackDemexit/status/1013114293632557062;0
SafeLibraries;2018-06-30 13:36;64;147;"Retweeted Abue Odogbo, MBA ( @AbueOdogbo ): I am a legal immigrant who has endured persecution & deep suffering, stood in-line for 5yrs & a registered democrat, but I have decided to #WalkAway";;@AbueOdogbo;#WalkAway;"1013114147280736261";https://twitter.com/SafeLibraries/status/1013114147280736261;0
RedPillBlackMan;2018-06-30 13:33;70;149;"I have seen democrats protesting for arbotion rights, illegal immigration rights, and against the police yet I haven't seen them protest against high rate of black incarceration or high rate of blacks on food stamps #NeverAgain #WalkAway";;;#NeverAgain #WalkAway;"1013113325159235584";https://twitter.com/RedPillBlackMan/status/1013113325159235584;0
SBradstrea;2018-06-30 13:32;47;48;"HOAH!!!!! ICE keeping BUSY! Democrats/Liberals.... #walkaway #TruthMatters #MAGA #DontBeThatPerson #NotOnMyWatch https:// twitter.com/Scavino45/stat us/1012778232813322241 …";;;#walkaway #TruthMatters #MAGA #DontBeThatPerson #NotOnMyWatch;"1013113121131646977";https://twitter.com/SBradstrea/status/1013113121131646977;1
CAgirlsforTrump;2018-06-30 13:29;24;57;"Yes it is! But of course in the liberal progressive Democratic mind, there is no self responsibility. It is always someone else’s fault. Everyone is a victim in their world! Pathetic teachings and frankly, sad! #WalkAway https:// twitter.com/mikebwonder/st atus/1013084312017756163 …";;;#WalkAway;"1013112417805426688";https://twitter.com/CAgirlsforTrump/status/1013112417805426688;1
Lmchristi1;2018-06-30 13:25;107;139;"This is a big NO. LA Stop them at the border, together, and turn them right around, together, thank you. Stop the hostile take over of America. #WalkAway July 21st #IStandWithIce #IStandWithTrump #AmericaFirst #LegalAmericansFirst https:// twitter.com/marchonice/sta tus/1013085890279714818 …";;;#WalkAway #IStandWithIce #IStandWithTrump #AmericaFirst #LegalAmericansFirst;"1013111292972883968";https://twitter.com/Lmchristi1/status/1013111292972883968;1
BreakingNLive;2018-06-30 13:21;3114;6674;"JUST IN: The #WalkAway , who is being used by Twitter users to let people know that they are leaving their ‘original’ political agenda, most of them from democrats to republicans, was actually second on trending on Twitter, but Twitter didn’t say it was.";;;#WalkAway;"1013110382708297729";https://twitter.com/BreakingNLive/status/1013110382708297729;0
JackPosobiec;2018-06-30 13:19;63;103;"Follow Brandon Straka @usminority ! #WalkAway";;@usminority;#WalkAway;"1013109671333330945";https://twitter.com/JackPosobiec/status/1013109671333330945;0
JackPosobiec;2018-06-30 13:17;121;315;"Just got off the phone with Brandon High energy incoming... #WalkAway https:// twitter.com/rockrapunzel/s tatus/1013101315466125313 …";;;#WalkAway;"1013109406656094208";https://twitter.com/JackPosobiec/status/1013109406656094208;1
ExDemLatina;2018-06-30 13:09;68;133;"#FamiliesBelongTogetherMarch Even this Mexican National agrees Stop being hypocrites and respect US laws & Viva Trump Mexico would be lucky to have their version of Trump #WalkAway #DemExit pic.twitter.com/WIulfVy8Jl";;;#FamiliesBelongTogetherMarch #WalkAway #DemExit;"1013107260208214016";https://twitter.com/ExDemLatina/status/1013107260208214016;0
LegendaryEnergy;2018-06-30 13:09;146;319;"Twitter’s strategy to stop the #WalkAway movement is similar to how all liberal media treats dissenters. Censor & rewrite history. They think hating, stomping on, silencing, ignoring & mistreating in a wildly irrational manner will make it go away. Wrong. It makes it bigger.";;;#WalkAway;"1013107222589534208";https://twitter.com/LegendaryEnergy/status/1013107222589534208;0
beth2_k3;2018-06-30 13:08;69;84;"This is WHY people are #WalkAway from the Democrat evil Party; They no longer have the values and morals we expect of American citizens: They have changed to the Party of hate: http://www. realtimetrump.com/watch-gop-rele ases-video-of-unhinged-liberals-pushing-for-violence-and-harassment/?utm_source=email&utm_medium=rtt&utm_campaign=n63018 …";;;#WalkAway;"1013106942682783746";https://twitter.com/beth2_k3/status/1013106942682783746;0
Static_Waste;2018-06-30 13:04;71;241;"Once on US soil it becomes a tax payers burden. the burden by #BuildingTheDamnWall Becoming a Legal US Citizen starts at their home, filling out paperwork, not climbing fences or across rivers #MAGA #KAG #NRA #NoAmnesty #2A #AmericaFirst #SupportOurTroops #WalkAway";;;#BuildingTheDamnWall #MAGA #KAG #NRA #NoAmnesty #2A #AmericaFirst #SupportOurTroops #WalkAway;"1013106076458344449";https://twitter.com/Static_Waste/status/1013106076458344449;0
RodStryker;2018-06-30 12:58;64;62;"Democrats calling to abolish ICE & open our borders to these drug traffickers are all domestic terrorists. They should be ashamed of themselves. American citizens are dying of heroin/fentanyl overdoses every day, yet Democrats could care less about us. Looney Left #WalkAway pic.twitter.com/vh7y9WZaHW";;;#WalkAway;"1013104569952464896";https://twitter.com/RodStryker/status/1013104569952464896;0
MarciaMsmush4;2018-06-30 12:56;154;255;"#WalkAway Was a Democrat my whole life and raised my children as democrats. I walked away since Trump -- my friends & family are shocked. Watch this video and ask "Who is Q?" #QAnon https:// youtu.be/6cYZ8dUgPuU";;;#WalkAway #QAnon;"1013104088496537600";https://twitter.com/MarciaMsmush4/status/1013104088496537600;0
LoeschHeather1;2018-06-30 12:52;87;72;"Is this what #America has become? Really?! This aggressive sick BS needs to Stop! @JacksMailbox @twittersecurity @POTUS @SecretService Do something before this rabid hater causes the loss of life! #WalkAway #MAGA #FamiliesBelongTogetherMarch #ThisIsNotUs pic.twitter.com/18BbsgTQ9b";;@JacksMailbox @twittersecurity @POTUS @SecretService;#America #WalkAway #MAGA #FamiliesBelongTogetherMarch #ThisIsNotUs;"1013103062012047360";https://twitter.com/LoeschHeather1/status/1013103062012047360;0
SandraBaron10;2018-06-30 12:33;125;373;"I was so hopeful that Obama would help heal our wounds & bring us together. But by his 2nd year I saw quite the opposite. His admin & Reid in the Senate poisoned the water. #walkaway";;;#walkaway;"1013098322523901954";https://twitter.com/SandraBaron10/status/1013098322523901954;0
ExDemLatina;2018-06-30 12:32;62;115;"#FamiliesBelongTogetherMarch #WalkAway #DemExit pic.twitter.com/xiDZfTDghz";;;#FamiliesBelongTogetherMarch #WalkAway #DemExit;"1013098062502219777";https://twitter.com/ExDemLatina/status/1013098062502219777;0
mesosean;2018-06-30 12:32;252;683;"The #WalkAway movement is pretty incredible, and of course Twitter is hiding it from the trending topics.";;;#WalkAway;"1013097851738607616";https://twitter.com/mesosean/status/1013097851738607616;0
TimmyTanPants;2018-06-30 12:31;531;1296;"I used to say I was fiscally conservative but socially liberal. That all changed when I realized one side used facts, a moral backbone, and compassion... While the other would shut down anyone who disagreed with them by calling them racist, Nazi, or homophobic. #WalkAway";;;#WalkAway;"1013097825461309440";https://twitter.com/TimmyTanPants/status/1013097825461309440;0
ExDemLatina;2018-06-30 12:29;64;128;"#FamiliesBelongTogetherMarch To my brown Americans too #WalkAway #DemExit pic.twitter.com/pEzL1xkyBD";;;#FamiliesBelongTogetherMarch #WalkAway #DemExit;"1013097176103178240";https://twitter.com/ExDemLatina/status/1013097176103178240;0
MelvinKLewis;2018-06-30 12:27;124;641;"I used to be a Democrat. Then I converted to Roman Catholicism. #WalkAway";;;#WalkAway;"1013096711668031489";https://twitter.com/MelvinKLewis/status/1013096711668031489;0
shawnsteel1;2018-06-30 12:24;61;186;"#WalkAway https:// twitter.com/jackposobiec/s tatus/1013092198634672128 …";;;#WalkAway;"1013095972874809345";https://twitter.com/shawnsteel1/status/1013095972874809345;1
JN31621;2018-06-30 12:14;663;1221;"You need to #WalkAway from the Democratic Party. Do you see this #FamiliesBelongTogetherMarch today? Do you know its purpose? It has none! President Trump already issued an EO to keep families together. It is designed to do nothing but promote propaganda & hate. Don't fall for it";;;#WalkAway #FamiliesBelongTogetherMarch;"1013093502224355329";https://twitter.com/JN31621/status/1013093502224355329;0
Elizajett2016;2018-06-30 12:11;241;820;"I did my own #WalkAway after I saw an awful lot of hate coming out of the "Love Trumps Hate" community.";;;#WalkAway;"1013092696058138625";https://twitter.com/Elizajett2016/status/1013092696058138625;0
DontMockMyTypos;2018-06-30 12:05;77;106;"How can we uphold our laws when 1/2 the country is in full meltdown protecting ppl who break our laws? #WalkAway #DeportAllIllegals Sarandon Arrested At Trump Protest Rally — Begs Women To Disobey! https://www. waynedupree.com/actress-sarand on-arrested-at-trump-protest/ … via @WayneDupreeShow";;@WayneDupreeShow;#WalkAway #DeportAllIllegals;"1013091054067777537";https://twitter.com/DontMockMyTypos/status/1013091054067777537;0
JimmyMaxKC;2018-06-30 12:03;242;604;"The Democrats agenda is now clear. Abolish ICE, open the borders and raise taxes. The next election should be a landslide. Love seeing people #WalkAway .";;;#WalkAway;"1013090758428188674";https://twitter.com/JimmyMaxKC/status/1013090758428188674;0
JuckFavi;2018-06-30 11:58;289;972;"As a Mexican immigrant that has been a democratic supporter I’m glad I found reality of what the Democratic Party is. #WalkAway";;;#WalkAway;"1013089476179038211";https://twitter.com/JuckFavi/status/1013089476179038211;0
TomInColumbus;2018-06-30 11:57;94;261;"The #WalkAway movement might end up being one of the greatest things ever to happen to this country #LeaveTheDemocraticPlantation";;;#WalkAway #LeaveTheDemocraticPlantation;"1013089170980470784";https://twitter.com/TomInColumbus/status/1013089170980470784;0
ProudArkgirl;2018-06-30 11:52;105;154;"If the illegal invasion was stopped along with Child Trafficking we wouldn't have this problem. But you see we have these "parents" putting their children in harm's way to illegally invade our Country. They are using their own children as pawns to get here. #WalkAway";;;#WalkAway;"1013087937007968257";https://twitter.com/ProudArkgirl/status/1013087937007968257;0
ThomasDelMonac4;2018-06-30 11:52;77;164;"So, #WalkAway isn't trending? Hmmm, running a tweet count on the what is trending vs #WalkAway . Anything against the #Dems isn't allowed to trend. #WalkAwayCampaign";;;#WalkAway #WalkAway #Dems #WalkAwayCampaign;"1013087802022645761";https://twitter.com/ThomasDelMonac4/status/1013087802022645761;0
TheRealMaddog58;2018-06-30 11:47;82;127;"@GovMikeHuckabee WHAT IS HE HIDING FROM US? I CAN'T HELP BUT TO THINK OF 2 CORINTHIANS 4:4 #MAGA #WalkAway #SaturdayMorning #Trump pic.twitter.com/RpntPkvwz5";;@GovMikeHuckabee;#MAGA #WalkAway #SaturdayMorning #Trump;"1013086665106247681";https://twitter.com/TheRealMaddog58/status/1013086665106247681;0
stuparker1;2018-06-30 11:47;186;530;"Grew up in a liberal Jewish family. Realized Left's policies haven't/couldn't work. Hated victimization/polarization push by Dems. Discovered fouding documents. Learned that conservatism provides most opportuinty and freedom for all and they are wonderful people. #WalkAway";;;#WalkAway;"1013086522667499520";https://twitter.com/stuparker1/status/1013086522667499520;0
phil200269;2018-06-30 11:45;97;163;"Walk away from the Democratic party while you still can. Before long they will deem it acceptable to kill apostates. #MAGA #walkaway";;;#MAGA #walkaway;"1013086176864096256";https://twitter.com/phil200269/status/1013086176864096256;0
JoanaOfscott;2018-06-30 11:39;74;206;"I volunteered on a BOD to help build an art district. Once the liberals saw they could tax business to further their agenda, they corrupted the vote and grabbed the cash. In the name of art. Pathetic. #WalkAway";;;#WalkAway;"1013084524719165440";https://twitter.com/JoanaOfscott/status/1013084524719165440;0
TommieGowdy1;2018-06-30 11:34;229;597;"Just another black man for President Trump off the plantation #WalkAway";;;#WalkAway;"1013083329246220289";https://twitter.com/TommieGowdy1/status/1013083329246220289;0
Lmchristi1;2018-06-30 11:32;144;153;"Send them all back TOGETHER! Zero tolerance for LAW BREAKING CRIMINALS. Period, end of story. #IStandWithICE #IStandWithTrump Your SELECTIVE OUTRAGE & marches are pointless. Tired & worn out. #WalkAway https:// twitter.com/repjayapal/sta tus/1013060667044220928 …";;;#IStandWithICE #IStandWithTrump #WalkAway;"1013082843054895106";https://twitter.com/Lmchristi1/status/1013082843054895106;1
EvanSayet;2018-06-30 11:27;484;1308;"I grew up a NY City-born Liberal Jew. I became a tv writer working in Hollywood & writing 4 Maher's TV show I chose to #walkaway after 9/11 & the Libs response 2 the attacks. The idea that we DESERVED it (and the way to prevent more attacks was 2B NICER to the terrorists?";;;#walkaway;"1013081705014390784";https://twitter.com/EvanSayet/status/1013081705014390784;0
JoeyTM3;2018-06-30 11:21;85;130;"Legal immigrants of all races and persuasions will be turning away from the Democrats. They went through our very sacred process and put their hearts and souls into it to get to this beautiful country. Now they see Dems trying to give free rides to law breakers! #WalkAway";;;#WalkAway;"1013079994107682819";https://twitter.com/JoeyTM3/status/1013079994107682819;0
LadyRedWave;2018-06-30 11:20;212;247;"I've seen so many tweets like THIS The #WalkAway MOVEMENT is growing BUT #Twitter won't allow it to TREND! So again you know who's side THEY'RE on! #IllegalAliens , #Dems anything ANTI-American! BE A #FreeThinker JUST #WalkAway #TrumpTrain will welcome you with OPEN ARMS! https:// twitter.com/chefnolimits/s tatus/1012878330171969536 …";;;#WalkAway #Twitter #IllegalAliens #Dems #FreeThinker #WalkAway #TrumpTrain;"1013079775039012864";https://twitter.com/LadyRedWave/status/1013079775039012864;1
Tombx7M;2018-06-30 11:18;57;70;"Illegal means something #FamiliesBelongTogetherMarch #AmericaIn3Words #Saturdaymorning #FoxAndFriends #WWG1WGA #WalkAway #Tcot #ccot #QAnon #KAG #MAGA #Trump #WakeupAmerica pic.twitter.com/6WSShb2tzw";;;#FamiliesBelongTogetherMarch #AmericaIn3Words #Saturdaymorning #FoxAndFriends #WWG1WGA #WalkAway #Tcot #ccot #QAnon #KAG #MAGA #Trump #WakeupAmerica;"1013079335811547136";https://twitter.com/Tombx7M/status/1013079335811547136;0
inflammateomnia;2018-06-30 11:18;127;393;"In 2016, I decided to #walkaway from @TheDemocrats , because they decided to walk away from the truth– there is nothing "progressive" about killing the unborn, assisting another's suicide, or attacking the institution of the family.";;@TheDemocrats;#walkaway;"1013079232623398919";https://twitter.com/inflammateomnia/status/1013079232623398919;0
Charley_Carroll;2018-06-30 11:15;74;233;"I left San Francisco and returned to Dallas. I literally walked away. #walkaway #walkawaycampaign #leavetheleft #demexit";;;#walkaway #walkawaycampaign #leavetheleft #demexit;"1013078459583815680";https://twitter.com/Charley_Carroll/status/1013078459583815680;0
CaliDeplorable;2018-06-30 11:13;315;484;"For the love of god, this whole #Russia #MuellerWitchHunt is really getting old #WeThePeople know it’s a scam set up by @TheDemocrats & @Comey SHUT IT DOWN #America wants to clean up the corruption in our government #DOJ #FBI #SundayMorning #WalkAway https:// twitter.com/foxnews/status /1013069686530076678 …";;@TheDemocrats @Comey;#Russia #MuellerWitchHunt #WeThePeople #America #DOJ #FBI #SundayMorning #WalkAway;"1013078004027670528";https://twitter.com/CaliDeplorable/status/1013078004027670528;1
NomDeVoyage1;2018-06-30 11:13;236;302;"We are the MAGA Patriots! A miracle from God gave us this last chance to take our country back from the forces of decomposition bent on destroying it, and US! But it's not done. We need you to see the truth and #WalkAway from the hateful and Godless #leftists , join us, and WIN! https:// twitter.com/Sequencer16/st atus/1012687256291889152 …";;;#WalkAway #leftists;"1013077970574069760";https://twitter.com/NomDeVoyage1/status/1013077970574069760;1
JDugudichi;2018-06-30 11:12;38;69;"Only a douchebag would think a baby attracts abuse. Only an a$$hole would think their own mother attracts domestic abuse. Only a brainwasher or the brainwashed would co-sign abusive behavior as self-inflicted. #walkaway from liberal system conditioning or forever be victimized";;;#walkaway;"1013077711718354944";https://twitter.com/JDugudichi/status/1013077711718354944;0
Lmchristi1;2018-06-30 11:06;138;222;"READ MY LIPS IT WILL NEVER HAPPEN Don’t forget your vagina hats for your march today, fruit loops. #IStandWithTrump now, always @ICEgov STRONG #SJW #Democrats #TheResistance #BlueWave #LiberalismIsAMentalDisorder #Communists #WalkAway https:// twitter.com/realdonaldtrum p/status/1013019990340046849 …";;@ICEgov;#IStandWithTrump #SJW #Democrats #TheResistance #BlueWave #LiberalismIsAMentalDisorder #Communists #WalkAway;"1013076377543761920";https://twitter.com/Lmchristi1/status/1013076377543761920;1
TheReady1775;2018-06-30 11:06;347;744;"When the black community decides to #WalkAway , The Democratic Party is dead. This terrifies Democrats like Pelosi & Waters whose personal fortunes come from mental economic slavery. #RiseUp #WalkAwayMovement #WalkAwayFromDemocrats #SaturdayMorning #MAGA @The_Trump_Train";;@The_Trump_Train;#WalkAway #RiseUp #WalkAwayMovement #WalkAwayFromDemocrats #SaturdayMorning #MAGA;"1013076247746932737";https://twitter.com/TheReady1775/status/1013076247746932737;0
wlb2003;2018-06-30 11:03;49;156;"So I just read an article that said people were making #WalkAway videos. So I went to youtube and typed #.....it was the 4th thing in the list....on youtube.";;;#WalkAway #;"1013075593435500545";https://twitter.com/wlb2003/status/1013075593435500545;0
ar15m4mid;2018-06-30 11:03;84;137;"Jake you misspelled FAKE. You've forfeited you privilege to use the word "fair" back when Obama was in the WH. Keep spinning, because we're winning! Thanks for helping though. #FakeNews #VoteRed2018 #WalkAway https:// twitter.com/jaketapper/sta tus/1012801547057750017 …";;;#FakeNews #VoteRed2018 #WalkAway;"1013075492210126850";https://twitter.com/ar15m4mid/status/1013075492210126850;1
