username;date;retweets;favorites;text;geo;mentions;hashtags;id;permalink;retweetornot
LAMBA_Q;2018-06-26 05:43;358;729;"Canadians and everyone, I encourage you to check out the #WalkAway Hashtag! It's the most wonderful thing I've seen happen in a long time. Democrat supporters are waking up and walking away from the party of hate, division & corruption. This is something we need";;;#WalkAway;"1011545384865366016";https://twitter.com/LAMBA_Q/status/1011545384865366016;0
toxic_awesome;2018-06-26 05:01;243;702;"I've honestly got nothing against anyone who is left of center (I once was), but when you really start to see how the DNC pits groups against each other and continues to pass legislation that makes impossible for those in lower socio-economic situations to succeed... #WalkAway";;;#WalkAway;"1011534985549889537";https://twitter.com/toxic_awesome/status/1011534985549889537;0
Wotanstrasse;2018-06-26 04:20;74;179;"#walkaway - The Dens are not a political Party. They are a criminal organisation wanting to gain power at all cost for humanity in order to steal our money to enrich themself so they can hurt and enslave us even more !! RUN AWAY !!";;;#walkaway;"1011524504768696321";https://twitter.com/Wotanstrasse/status/1011524504768696321;0
rcjhawk86;2018-06-26 03:43;209;238;"#LeftistHate #LeftistSedition #LeftistHypocrisy #Civility #WalkAway Where was the emergency hearing when Obama ripped kids away from their parents? @tedlieu ............. ...........chirp .....chirp......chirp... https:// twitter.com/tedlieu/status /1011461173521342464 …";;@tedlieu;#LeftistHate #LeftistSedition #LeftistHypocrisy #Civility #WalkAway;"1011515399035375616";https://twitter.com/rcjhawk86/status/1011515399035375616;1
rcjhawk86;2018-06-26 03:27;201;260;"#LeftistHate #LeftistTerrorism #Civility #WalkAway That doesn’t sound like a deal....That sounds like a threat @johnlegend https:// twitter.com/johnlegend/sta tus/1011376970511183872 …";;@johnlegend;#LeftistHate #LeftistTerrorism #Civility #WalkAway;"1011511229880455169";https://twitter.com/rcjhawk86/status/1011511229880455169;1
Feisty_FL;2018-06-26 03:15;240;282;"Hi @MrAulnutt Would you like for us to drink from separate water fountains, send our kids to separate schools and ride on the back of the bus too? It wouldn’t be the first time that Democrats demanded segregation. (Coward blocked me, but I got a screen shot) #WalkAway pic.twitter.com/aAw47SPy5b";;@MrAulnutt;#WalkAway;"1011508342580219905";https://twitter.com/Feisty_FL/status/1011508342580219905;0
valuedjewels;2018-06-26 03:01;92;325;"I believe in America, Americans, and that we can be better than political parties, politicians, and anyone else that wants to divide us. We can #WalkAway from the forces that try to divide us, and unite as proud Americans who love our country.";;;#WalkAway;"1011504697503559681";https://twitter.com/valuedjewels/status/1011504697503559681;0
Kayluvsredwings;2018-06-26 02:55;239;866;"I just realized something. So many liberals always call Maga & conservative supporters Nazi’s right? Or compare The Border issue to ‘Nazi Germany’. Yet it’s conservatives/Maga supporters that are outspoken supporters of Israel...not them. #WalkAway now haha";;;#WalkAway;"1011503136454922241";https://twitter.com/Kayluvsredwings/status/1011503136454922241;0
__Ryan_22;2018-06-26 02:54;104;309;"Droves of people are leaving the left daily. #WalkAway";;;#WalkAway;"1011503025641308160";https://twitter.com/__Ryan_22/status/1011503025641308160;0
zonum_ettevy;2018-06-26 02:37;28;156;"Guys, there's this new taco joint by my house that I really really REEEEEALLY wanna try, but I'm worried they might confuse me with @PressSec Sarah Sanders and kick me out their restaurant. #cutegirlproblems #walkaway pic.twitter.com/6dCimZ24sm";;@PressSec;#cutegirlproblems #walkaway;"1011498724017758208";https://twitter.com/zonum_ettevy/status/1011498724017758208;0
Kayluvsredwings;2018-06-26 02:34;33;101;"This #WalkAway movement is truly outstanding to witness and so many stories are heartbreaking, sad, yet also very brave and honest.";;;#WalkAway;"1011497837841010695";https://twitter.com/Kayluvsredwings/status/1011497837841010695;0
mariong82195656;2018-06-26 02:17;64;123;"I decided to #WalkAway from the Democratic Party because I realize during the 2015, 2016 election that they are cheaters, Hypocrites. The Democratic Party doesn’t care about us middle and southern Americans";;;#WalkAway;"1011493721437822976";https://twitter.com/mariong82195656/status/1011493721437822976;0
djbunting;2018-06-26 02:10;3084;7789;"I was a registered Democrat until I opened my eyes to actual policies that the Democrats back...I decided that if I remained on this course of blindly following people who put on a fake persona in order to remain in control I was part of the problem #walkaway";;;#walkaway;"1011491806218018816";https://twitter.com/djbunting/status/1011491806218018816;0
SquirrelJersey;2018-06-26 01:10;66;198;"Shoutout to everyone in #WalkAway because your decision is so right that you will never walk back!";;;#WalkAway;"1011476697047289856";https://twitter.com/SquirrelJersey/status/1011476697047289856;0
LisaSmith4680;2018-06-26 01:09;480;559;"One of the BEST videos I've ever watched on being #Redpilled ! EVERY single Liberal who can still THINK needs to watch it! It's time to #Walkaway Every single Trumpster needs to follow Brandon @usminority . Thanks @WayneDupreeShow for ANOTHER GREAT article! https://www. waynedupree.com/hes-leaving-th e-democratic-party/ …";;@usminority @WayneDupreeShow;#Redpilled #Walkaway;"1011476480151482368";https://twitter.com/LisaSmith4680/status/1011476480151482368;0
BlessThe_US;2018-06-26 00:58;60;165;"Under Obama they nearly succeeded in making that nationwide. The violence and desperation is one of the tells. Happily America chose to #WalkAway from the Dem Political Machine in 2016. https:// twitter.com/rrhaley59/stat us/1011404466002767873 …";;;#WalkAway;"1011473742545981440";https://twitter.com/BlessThe_US/status/1011473742545981440;1
BetsieGray;2018-06-26 00:46;184;288;"Please understand that #WalkAway is not trending on #Twitter because they use the #SPLC to identify & filter content they don’t like. They will do all they can to hide/deny/prevent more of it. Tweet firmly & politely until they hear us. #WalkAwayCampaign #IntellectualDarkWeb";;;#WalkAway #Twitter #SPLC #WalkAwayCampaign #IntellectualDarkWeb;"1011470699720998912";https://twitter.com/BetsieGray/status/1011470699720998912;0
Wynarris2;2018-06-26 00:25;49;78;"#WalkAway ! I am proud of the generations of hardworking,union & Democratic heritage, my family has provided. I reject the 2K Democratic Party, which must be a flock of freaks, encouraging harm & harassment! The Democratic Party flipped. They support anyone, who isn’t American.";;;#WalkAway;"1011465543189188608";https://twitter.com/Wynarris2/status/1011465543189188608;0
keramirez;2018-06-26 00:18;113;112;"@tedcruz #MadMaxine 's Rant About Stalking & Attacking "Conservatives" Is Much Like Hitler'sNazism! "In 1933, NewGermanLawsForced JewsOutOfTheirCivil SvcJobs, University&LawCrt Positions,& OthrAreasOfPublicLife." #walkaway #VoteRed2018 #LiberalHypocrisy https://www. myjewishlearning.com/article/1933-1 939-early-stages-of-persecution/ …";;@tedcruz;#MadMaxine #walkaway #VoteRed2018 #LiberalHypocrisy;"1011463615587774464";https://twitter.com/keramirez/status/1011463615587774464;0
suinual;2018-06-26 00:15;6132;15055;"I’m a registered Democrat who is gonna #walkaway the violence and hate toward Americans is just too much. @MaxineWaters @peterfonda";;@MaxineWaters @peterfonda;#walkaway;"1011462976061231104";https://twitter.com/suinual/status/1011462976061231104;0
Iseetomorrow;2018-06-26 00:14;39;74;"#WalkAway I walked away after voting 2x for Obama because I waa young and people told me Republicans were Racist . When @BarackObama shoved health insurance of penaltys and pushed racial divisions I #walkaway The left comparisons of DHS employees to Nazi's made me glad I did.";;@BarackObama;#WalkAway #walkaway;"1011462615137177601";https://twitter.com/Iseetomorrow/status/1011462615137177601;0
whizkids;2018-06-25 23:57;257;241;"Jeff Sessions explains MS-13 gang members are using migrant children to smuggle drugs into the USA. #QAnon #civility #WalkAway #MAGA #KAG #WWG1WGA #GreatAwakening @realDonaldTrump @therealroseanne https:// nypost.com/2018/06/25/ses sions-ms-13-is-using-migrant-kids-to-smuggle-drugs-into-us/?utm_campaign=SocialFlow&utm_medium=SocialFlow&utm_source=NYPFacebook&sr_share=facebook …";;@realDonaldTrump @therealroseanne;#QAnon #civility #WalkAway #MAGA #KAG #WWG1WGA #GreatAwakening;"1011458463283798018";https://twitter.com/whizkids/status/1011458463283798018;0
JoshReportsLive;2018-06-25 23:55;251;779;"Y'all in the #WalkAwayCampaign are so inspiring... In a time where our political leaders are telling us to divide, I see so many choosing peace to #WalkAway from a left v right mentality. No we're choosing to be We the people. Americans who want to work together for all of us. <3";;;#WalkAwayCampaign #WalkAway;"1011457838286188544";https://twitter.com/JoshReportsLive/status/1011457838286188544;0
myjsarefresh;2018-06-25 23:53;153;397;"#WalkAway moment for me was when Obama said adding 4 trillion in debt was unpatriotic, but then wasted 21 trillion in 8 years";;;#WalkAway;"1011457336278384640";https://twitter.com/myjsarefresh/status/1011457336278384640;0
AmericanG1RL776;2018-06-25 23:36;174;386;"Wow. This says it ALL! #WalkAway pic.twitter.com/rkZpNP6hwJ";;;#WalkAway;"1011453110232014850";https://twitter.com/AmericanG1RL776/status/1011453110232014850;0
BoogsRN;2018-06-25 23:32;348;609;"Hitler promoted a collectivist ideology, and he was an advocate for government provided healthcare, free education, and a slew of social programs. It seems to me the Left is more like Hitler than the Rebublicans. Get it straight. #walkaway #redpill pic.twitter.com/T8vdQZuGgD";;;#walkaway #redpill;"1011452179859812353";https://twitter.com/BoogsRN/status/1011452179859812353;0
karensutton_;2018-06-25 23:16;139;307;"I was a lifelong Democrat also, I thought they were for the working man, the blacks , the poor etc... But I have found they are only for their self interest! I have left #TheLeft #WalkAway";;;#TheLeft #WalkAway;"1011447959597264896";https://twitter.com/karensutton_/status/1011447959597264896;0
AmericanVoterUS;2018-06-25 23:14;64;96;"America is realizing the Democratic Party cares more about themselves than our country #WalkAway #WalkAwayMovement";;;#WalkAway #WalkAwayMovement;"1011447625860579328";https://twitter.com/AmericanVoterUS/status/1011447625860579328;0
Golfinggary5222;2018-06-25 22:46;771;1162;". @PressSec : "The calls for harassment and push for any Trump supporter to avoid the public is unacceptable." So WRONG to incite harassment & violence against Trump supporters! We all must be able to eat dinner, watch movies together. #EndHate #WalkAway pic.twitter.com/ofRbMdPk0e";;@PressSec;#EndHate #WalkAway;"1011440601580101632";https://twitter.com/Golfinggary5222/status/1011440601580101632;0
MAGAMark18;2018-06-25 22:40;268;399;"I WAS a #Democrat before I could vote! I campaigned for many candidates and was President of College Dems! Then one day I #wokeup and did not recognize my party! They support many failed #BigGov policies, incite violence/hatred, and are not for #workingclass ! #WalkAway Join @GOP pic.twitter.com/SI7ZOUzR4z";;@GOP;#Democrat #wokeup #BigGov #workingclass #WalkAway;"1011439019488677889";https://twitter.com/MAGAMark18/status/1011439019488677889;0
BetsieGray;2018-06-25 22:33;42;145;"Haha! Thank you! I just started this whole thing a few days ago. I’m not a part of #WalkAway , but I am a #QuietConservativeNoLonger . SOOOOO many people unfriending me on FB right now I haven’t called anyone any names. Just cited facts. It scares & overwhelms them.";;;#WalkAway #QuietConservativeNoLonger;"1011437211965968384";https://twitter.com/BetsieGray/status/1011437211965968384;0
Golfinggary5222;2018-06-25 22:30;799;944;"Democrats, Are you tired of the hate, intolerance and violence? Are you disappointed that the party you grew up with that prided itself on patriotism, peace and tolerance, now violates all the principles you believe in? You can #WalkAway like so many others have! pic.twitter.com/fCnr78XbbX";;;#WalkAway;"1011436386614902785";https://twitter.com/Golfinggary5222/status/1011436386614902785;0
Jillibean557;2018-06-25 22:28;420;719;"If you are still a registered democrat dealing with the mental illness commonly referred to as liberalism ..I strongly urge you to wake up and get a fuking clue. #WalkAway https:// twitter.com/realjameswoods /status/1011334378218139648 …";;;#WalkAway;"1011436015108714498";https://twitter.com/Jillibean557/status/1011436015108714498;1
albybrava;2018-06-25 21:49;0;1;"#WALKAWAY dammit https:// twitter.com/charliekirk11/ status/1011390944799674371 …";;;#WALKAWAY;"1011426136377712640";https://twitter.com/albybrava/status/1011426136377712640;1
SybilLuddington;2018-06-25 21:35;68;143;"Hmmm. Can't quite figure out why you would be In favor of thousands of unaccompanied migrant children(and 90% of the children ARE w/out parents) running around. Not safe for the kids. Most get trafficked. U aren't for child trafficking r u? @POTUS #QAnon #WalkAway";;@POTUS;#QAnon #WalkAway;"1011422693952978945";https://twitter.com/SybilLuddington/status/1011422693952978945;0
magamastodon;2018-06-25 21:27;244;747;"#walkaway #democrats you are losing badly. Come to the side where men are men and women are woman. #MAGA #WalkAwayCampaign #LiberalismIsAMentalDisorder #AmericaFirst #BuildingTheWall pic.twitter.com/oYcRHiwn1I";;;#walkaway #democrats #MAGA #WalkAwayCampaign #LiberalismIsAMentalDisorder #AmericaFirst #BuildingTheWall;"1011420560310431745";https://twitter.com/magamastodon/status/1011420560310431745;0
JaniceTXBlessed;2018-06-25 21:26;174;344;"And we are so glad that you decided to #WalkAway It's wonderful to have you in our corner! #WalkAway https:// twitter.com/RealJamesWoods /status/1011334378218139648 …";;;#WalkAway #WalkAway;"1011420420195672065";https://twitter.com/JaniceTXBlessed/status/1011420420195672065;1
akevinmccarthy;2018-06-25 21:25;170;422;"In '08 I voted Obama. Got suckered by "hope & change." Jumped ship 1-2 years in due to a stack of failed promises & seeing more of the same establishment BS. Now I'm a Trump Republican. He's the best we've ever had. Also, The Left's antics mean I'll never vote D again. #WalkAway pic.twitter.com/JywdNinF66";;;#WalkAway;"1011420059816906752";https://twitter.com/akevinmccarthy/status/1011420059816906752;0
cheryl_hannigan;2018-06-25 21:16;284;886;"I voted for Obama the 1st time. I then moved out of Massachusetts and started to learn so much more. #WalkAway and you will see a much more open minded country.";;;#WalkAway;"1011417879072378881";https://twitter.com/cheryl_hannigan/status/1011417879072378881;0
MakeEarthGreat3;2018-06-25 21:12;354;479;"Take a moment to let that sink in. #WWG1WGA #WalkAway #ImpeachMaxine pic.twitter.com/LvSDtyeAYQ";;;#WWG1WGA #WalkAway #ImpeachMaxine;"1011416811064250373";https://twitter.com/MakeEarthGreat3/status/1011416811064250373;0
MidwestnExile;2018-06-25 21:07;459;1129;"I had no choice but to #WalkAway from Dems after 20+ years Free markets not socialism Responsibility not entitlement America first over globalism Pro-life 1A over bullying God over government 2A to protect all of the above";;;#WalkAway;"1011415595865296899";https://twitter.com/MidwestnExile/status/1011415595865296899;0
ExDemLatina;2018-06-25 21:00;161;386;"I was a lifelong Democrat - why? I couldn’t tell you. Thanks to Trump I realized what Reagan knew- Hispanics are conservatives , they just don’t know it yet. I will never vote Democrat again. They are unrecognizable #WalkAway pic.twitter.com/Ze6uzTr3JU";;;#WalkAway;"1011413810865790976";https://twitter.com/ExDemLatina/status/1011413810865790976;0
shellbell742;2018-06-25 20:48;505;1397;"I grew up in a Democrat, Union, hard working family, it was in 2012 that my eyes were opened. I started to do my research and became a conservative. I America, even with all its problems. My flag flies proudly #WalkAway";;;#WalkAway;"1011410810277593088";https://twitter.com/shellbell742/status/1011410810277593088;0
zoobug;2018-06-25 20:47;333;761;"The party that I once thought to espouse and exemplify peace, love, and tolerance, has proven itself to be the opposite. It is the party of violence, hatred, and bigotry. I had to #WalkAway";;;#WalkAway;"1011410543188594694";https://twitter.com/zoobug/status/1011410543188594694;0
Ofcrdeonjoseph;2018-06-25 20:46;855;3247;"#walkaway . Liberals. Hey Conservatives. Hey Maxine. Hey Pelosi. Hey Mr. President... can we do this? #MACA . pic.twitter.com/mJaXZWpopG";;;#walkaway #MACA;"1011410361713455105";https://twitter.com/Ofcrdeonjoseph/status/1011410361713455105;0
JoshNoneYaBiz;2018-06-25 20:35;64;195;"My mom and my 74 year old grandma are both life-long Democrats that voted for Trump and are switching their parties so they can vote Republican in the primaries. #MAGA #WalkAway";;;#MAGA #WalkAway;"1011407472861511681";https://twitter.com/JoshNoneYaBiz/status/1011407472861511681;0
teezgramma;2018-06-25 20:28;70;254;"I’m a registered republican who voted for obama in ‘08. I’ve voted democrat when I thought the candidate was the best choice. Because if the way I was treated by so-called friends in 2016, I’ll never vote democrat ever again. #walkaway";;;#walkaway;"1011405884088516608";https://twitter.com/teezgramma/status/1011405884088516608;0
awaken_to_maga;2018-06-25 20:28;383;630;"In 2007, I stumbled upon the truth of Obama. However, I noticed the Left & MSM were not reporting it. They were reporting the opposite, whitewashing his history. I knew this to be propaganda. This is when I decided to #WalkAway . #GreatAwakening #MondayMotivation #AwakenToMAGA";;;#WalkAway #GreatAwakening #MondayMotivation #AwakenToMAGA;"1011405797711106055";https://twitter.com/awaken_to_maga/status/1011405797711106055;0
LegendaryEnergy;2018-06-25 20:24;131;382;"I’m never voting for a Democrat again. Liberals in 2018 absolutely disgust me. Any politician that is going to use rationality & work with Trump will get my votes from now on. The left is the most extreme mass group of the decade. I’ll #WalkAway forever.";;;#WalkAway;"1011404783876370432";https://twitter.com/LegendaryEnergy/status/1011404783876370432;0
DoleHettie;2018-06-25 20:20;117;313;"The difference between the people posting about #WalkAway and #Civility are staggeringly different. I'm proud to have #WalkedAway from the democratic party in 2017, especially seeing their response to being asked to be civil. The vocal minority have 100% ruined the party.";;;#WalkAway #Civility #WalkedAway;"1011403761334538240";https://twitter.com/DoleHettie/status/1011403761334538240;0
zachhaller;2018-06-25 20:17;355;975;"Halfway through Obama’s term I realized @TheDemocrats party is one big con Like anyone in their right mind, I saw what they did to Bernie Sanders and had to #WalkAway Still identify as an independent, but one thing is clear: I won’t ever be voting for another Democrat";;@TheDemocrats;#WalkAway;"1011402963452026880";https://twitter.com/zachhaller/status/1011402963452026880;0
kimusastrong;2018-06-25 20:12;426;582;"#walkaway it will feel liberating! While you are at it, turn off the #MainstreamMedia , it’s poison for the brain! #MAGA #AmericaFirst #AmericanCitizens pic.twitter.com/g8tYzVKNGC";;;#walkaway #MainstreamMedia #MAGA #AmericaFirst #AmericanCitizens;"1011401854322991104";https://twitter.com/kimusastrong/status/1011401854322991104;0
Feisty_FL;2018-06-25 20:05;131;207;"I’ll never forget when Joe Wilson called Obama a liar and the left went nuts. But they call President a Nazi and stalk and harass people in his administration. #WalkAway #TrumpRally";;;#WalkAway #TrumpRally;"1011400092245479424";https://twitter.com/Feisty_FL/status/1011400092245479424;0
Standinganthem;2018-06-25 20:04;1188;3802;"I decided to #WalkAway when I realized that my conservative friends were reasonable and open to political discussions. It didn’t matter what my position was, they were willing to hear me out and talk about it...";;;#WalkAway;"1011399680582868992";https://twitter.com/Standinganthem/status/1011399680582868992;0
pgkdan;2018-06-25 20:02;169;521;"Welcome to all #walkaway . You’re probably not going to become a conservative overnight. That’s ok by me as long as we can both respect each other. Listen and pay attention to each other and most of all respect that we’re all Americans. Wish you all the best.";;;#walkaway;"1011399176461185026";https://twitter.com/pgkdan/status/1011399176461185026;0
texanfor45;2018-06-25 20:02;0;1;"The signs say who support this one. Just #WalkAway https:// twitter.com/merc20171/stat us/1011396353287651329 …";;;#WalkAway;"1011399151396052994";https://twitter.com/texanfor45/status/1011399151396052994;1
Joecamoe;2018-06-25 20:02;0;0;"They are being deceived by greedy people, and the greedy people are deceived by terrible people. And we're gonna #MAGA anyway! #QAnon #WalkAway from the creeps";;;#MAGA #QAnon #WalkAway;"1011399149873332224";https://twitter.com/Joecamoe/status/1011399149873332224;0
LethalSandra37;2018-06-25 20:01;5;8;"That’s right. It doesn’t matter what party you belong to. This movement is for anybody who wants to get the hell away from the lies, manipulations from the stronghold of the mainstream media and corrupt liberals. #bestthingIeverdid #walkaway";;;#bestthingIeverdid #walkaway;"1011399105606815744";https://twitter.com/LethalSandra37/status/1011399105606815744;0
robin_ked;2018-06-25 20:01;0;0;"cuz we #TrumpSupporters were Born with Brains, Common Sense & we Don't need to be Told WHAT to Think, or How To Think it, #TryItSometime ! btw I Am #WalkAway !!!";;;#TrumpSupporters #TryItSometime #WalkAway;"1011399105548029953";https://twitter.com/robin_ked/status/1011399105548029953;0
KAGtime;2018-06-25 20:01;0;0;"Some crazy person Left a dead mutilated and burned animal carcass on a Homeland security employees porch. Don't just #WalkAway you need to runaway. http://www. foxnews.com/politics/2018/ 06/25/burned-and-decapitated-animal-left-on-homeland-security-staffers-porch-report-says.amp.html …";;;#WalkAway;"1011399097700384768";https://twitter.com/KAGtime/status/1011399097700384768;0
notmyresistance;2018-06-25 20:01;0;1;"@maddow is a progressive liberal. Don't be like @maddow #WalkAway";;@maddow @maddow;#WalkAway;"1011399072664772610";https://twitter.com/notmyresistance/status/1011399072664772610;0
MommysBigMouth;2018-06-25 20:01;0;0;"#WalkAway https:// twitter.com/lawyer4laws/st atus/1007448610492047360 …";;;#WalkAway;"1011399071452393472";https://twitter.com/MommysBigMouth/status/1011399071452393472;1
gary_causer;2018-06-25 20:01;0;3;"We call them RINOS. They support the globalist selling our jobs overseas and bringing in slave labor take our jobs! And they want to kill Social Security! #WALKAWAY";;;#WALKAWAY;"1011399004037439488";https://twitter.com/gary_causer/status/1011399004037439488;0
TurntNTexas;2018-06-25 20:01;1;4;"Bottom line is that the party thrives on keeping everything in a state of chaos. Even if it means one of them starting a false narrative just so another can stomp it out. Its ridiculous - they have zero platform for governance other than obstruction. #WalkAway #MAGA";;;#WalkAway #MAGA;"1011398970629869569";https://twitter.com/TurntNTexas/status/1011398970629869569;0
HaleyTessIsis;2018-06-25 20:01;1;1;"What a crock. You are only trying to step back because your direct vulgar, nasty attacks are counter productive. In response, I would encourage all decent people to #WalkAway .";;;#WalkAway;"1011398952862691330";https://twitter.com/HaleyTessIsis/status/1011398952862691330;0
Tommando33;2018-06-25 20:01;0;2;"Nothing better than a #TrumpRally #MAGA #Walkaway";;;#TrumpRally #MAGA #Walkaway;"1011398941869518848";https://twitter.com/Tommando33/status/1011398941869518848;0
domnliz;2018-06-25 20:01;0;1;"You must have forgotten to take your meds dear #LiberalismIsAMentalDisorder #WalkAway";;;#LiberalismIsAMentalDisorder #WalkAway;"1011398901092450306";https://twitter.com/domnliz/status/1011398901092450306;0
ThunderB;2018-06-25 20:00;0;1;"#WalkAway from book burners https:// twitter.com/bethanyshondar k/status/1011396691977629698 …";;;#WalkAway;"1011398861972221952";https://twitter.com/ThunderB/status/1011398861972221952;0
325BURN;2018-06-25 20:00;6;7;"#walkaway #walkaway #walkaway #walkaway #walkaway #walkaway #walkaway #walkaway #walkaway #walkaway #walkaway #walkaway #walkaway #walkaway #walkaway";;;#walkaway #walkaway #walkaway #walkaway #walkaway #walkaway #walkaway #walkaway #walkaway #walkaway #walkaway #walkaway #walkaway #walkaway #walkaway;"1011398828962955264";https://twitter.com/325BURN/status/1011398828962955264;0
rickswift;2018-06-25 20:00;0;1;"You are mentally deficient. Seek help, for fuck’s sake. #WalkAway is all on people like you. https:// twitter.com/juddapatow/sta tus/1011311626388230144 …";;;#WalkAway;"1011398798059458561";https://twitter.com/rickswift/status/1011398798059458561;1
PatrickArnold77;2018-06-25 20:00;6;33;"Danny you are such a shining example of why people should just #WalkAway";;;#WalkAway;"1011398793466646530";https://twitter.com/PatrickArnold77/status/1011398793466646530;0
FreedomNowRings;2018-06-25 20:00;1;1;"#WalkAway Campaign: WHY I LEFT LIBERALISM & THE DEMOCRATIC PARTY https:// youtu.be/4Pjs7uoOkag @RealCandaceO @w_terrence @DiamondandSilk I walked away 29 yrs ago. WILL U #WalkAway ? Lets show the"Tolerant" Liberal Leftist Progressive Democrats that WE don't like their type of tolerance.";;@RealCandaceO @w_terrence @DiamondandSilk;#WalkAway #WalkAway;"1011398792975912965";https://twitter.com/FreedomNowRings/status/1011398792975912965;0
