username;date;retweets;favorites;text;geo;mentions;hashtags;id;permalink;retweetornot
063_lisa;2018-06-30 05:08;156;638;"As of today, I am a #walkaway .";;;#walkaway;"1012986158689738752";https://twitter.com/063_lisa/status/1012986158689738752;0
Midnightbird66;2018-06-30 05:00;544;1348;"I was a left leaning liberal for a long time until I was started being called a racist, a nazi, a fascist for just disagreeing with other leftists. The left has become the enemy of free speech. That's why I left the left. #WalkAway";;;#WalkAway;"1012984111970029569";https://twitter.com/Midnightbird66/status/1012984111970029569;0
RodStryker;2018-06-30 04:22;3340;3584;"Remember that time when Trump supporters were beaten within an inch of their lives right after the 2016 election & Obama never condemned the violence? Actually, not one Democrat condemned violence inflicted upon us, but they cheered it on! #WalkAway pic.twitter.com/8OGws82GvF";;;#WalkAway;"1012974526458662912";https://twitter.com/RodStryker/status/1012974526458662912;0
therealcornett;2018-06-30 04:09;140;162;"#WalkAway is the #3 trending hashtag but Twitter won’t show it. Why not @Twitter ???? pic.twitter.com/YUslj1wuMW";;@Twitter;#WalkAway #3;"1012971430647095296";https://twitter.com/therealcornett/status/1012971430647095296;0
muhlibertas;2018-06-30 03:47;441;1439;"Good night folks! I can actually sleep without my mind buzzing tonight, knowing that there are millions of other African Americans like me who are deciding to #WalkAway .";;;#WalkAway;"1012965933843746816";https://twitter.com/muhlibertas/status/1012965933843746816;0
Hysterikles;2018-06-30 03:47;293;731;"I started to #WalkAway when the left decided they didn’t give a shit about free speech or freedom of religion. The left of my youth cared about the working class and strived for a world where race wasn’t an issue. Liberals of today can’t go two sentences without bringing up race";;;#WalkAway;"1012965741765656576";https://twitter.com/Hysterikles/status/1012965741765656576;0
NightSKY4409;2018-06-30 03:44;91;136;"Nominating this one for the dumbest tweet award According to her, the @POTUS is not a successful businessman Has she never stayed at or heard of one the wonderful @TrumpResorts ?! #LiberalismIsAMentalDisorder #TDS #HeIsYourPresident #WalkAway #KAG2020 https:// twitter.com/vivivacca/stat us/1012957690086256640 …";;@POTUS @TrumpResorts;#LiberalismIsAMentalDisorder #TDS #HeIsYourPresident #WalkAway #KAG2020;"1012965105921736704";https://twitter.com/NightSKY4409/status/1012965105921736704;1
GodsRighteous;2018-06-30 03:34;103;374;"#walkaway I went right when the left told me worshipping Christ was wrong and I was a “Bible thumper.”";;;#walkaway;"1012962645400436736";https://twitter.com/GodsRighteous/status/1012962645400436736;0
Presh1881;2018-06-30 03:33;284;743;"I chose to #WalkAway when Feminists attacked me for being a rape victim who questioned the rape culture narrative, claiming I “don’t care” about other victims and that I want others to suffer the same trauma I had experienced.";;;#WalkAway;"1012962205501939712";https://twitter.com/Presh1881/status/1012962205501939712;0
hrtablaze;2018-06-30 03:28;110;114;"What have I been saying for months? That the day was coming that the left would start calling for Trump supporters to get executed. It's starting. Btw , this dude still has his acct but I can't say people have a low IQ? #WalkAway this is the Democratic party in 2018 pic.twitter.com/zmbUwCl8ra";;;#WalkAway;"1012961159278809093";https://twitter.com/hrtablaze/status/1012961159278809093;0
PaisaInTheUSA;2018-06-30 03:28;369;878;"I stumbled upon the #WalkAway and honestly is uplifting. My husband had #WalkAway 2 years ago when he realized he identified with nothing in the Dem party. I'm Latina, woman, mother and wife, none of those make me a racist, misogynist or brainless person. #democratspartyofhate";;;#WalkAway #WalkAway #democratspartyofhate;"1012960982065401856";https://twitter.com/PaisaInTheUSA/status/1012960982065401856;0
mitchellvii;2018-06-30 03:21;172;367;"These #DNC protests to abolish #ICE should end well. #WalkAway";;;#DNC #ICE #WalkAway;"1012959227269312512";https://twitter.com/mitchellvii/status/1012959227269312512;0
mitchellvii;2018-06-30 03:19;1774;3060;"84% of Americans now say they want newly arrived illegals detained and deported. In response, the #DNC decides to run on abolishing #ICE which detains and deports newly arrived illegals. #WalkAway";;;#DNC #ICE #WalkAway;"1012958846950756353";https://twitter.com/mitchellvii/status/1012958846950756353;0
HandofGOD7;2018-06-30 02:36;107;179;"Time for #WalkAway to take hold in Britain Walk away from: Deceit Hypocrisy Hatred Virtue-signalling Self-righteousness Sanctimony Identity politics Bigotry ...of @UKLabour No need to suffer from abject, humiliating Leftism anymore Just walk away pic.twitter.com/yUnvjoo3PH";;@UKLabour;#WalkAway;"1012947932415430656";https://twitter.com/HandofGOD7/status/1012947932415430656;0
keramirez;2018-06-30 02:30;194;191;"Hey @SenKamalaHarris InsteadOfJoining CA's 60's ProtestParty, U Should've CheckedOn Your MASSIVE HomelessProblem "CA Has The HIGHEST % of UnshelteredHomelessIndividuals In The Country, At SlightlyUnder70%" #homelessness #LiberalHypocrisy #WalkAway https:// calmatters.org/articles/homel ess-in-california-what-the-data-reveals/ …";;@SenKamalaHarris;#homelessness #LiberalHypocrisy #WalkAway;"1012946418112323584";https://twitter.com/keramirez/status/1012946418112323584;0
TheDaily_Flo;2018-06-30 01:43;121;403;"#WalkAway I grew up in El Paso TX. My family is Democrat so I grew up Democrat, I fell for the "Republicans are rich" B/S. Then one day I ask myself "Why not learn from them(rich) to get out of this hell hole" My life has never been the same.";;;#WalkAway;"1012934616431415296";https://twitter.com/TheDaily_Flo/status/1012934616431415296;0
TAB2CEL;2018-06-30 01:30;1042;2212;"Democrats are running on empty. They have no agenda, no ideas and soon, no voters. The #WalkAway movement is gathering steam as traditional Democrat voters abandon their radical message.";;;#WalkAway;"1012931263299313666";https://twitter.com/TAB2CEL/status/1012931263299313666;0
Lolita_At_Large;2018-06-30 01:14;158;332;"Was a JFK #Democrat . Voted D until I started fact-checking what I was being told. Embarrassed that I didn't know which party supported slavery and the KKK and opposed the civil rights act. Now I know Dems are just using minorities, not helping. #walkaway";;;#Democrat #walkaway;"1012927230673129478";https://twitter.com/Lolita_At_Large/status/1012927230673129478;0
MargoLogan;2018-06-30 01:03;37;165;"My mom & 2 aunties were immigrants, the legal way, no taxpayer money, dad sponsored mom's youngest sister. I was six. I helped her learn English. Within a month she had a job & was loving America. @realDonaldTrump @jeffsessions @FLOTUS @VickieBlum #WalkAway";;@realDonaldTrump @jeffsessions @FLOTUS @VickieBlum;#WalkAway;"1012924541662687233";https://twitter.com/MargoLogan/status/1012924541662687233;0
TiffanyPoggers;2018-06-30 00:39;201;705;"So after years of having friends of many races and race being irrelevant to how I treat people, I'm suddenly a nazi for not voting for the corrupted Dem party? Time to #WalkAway";;;#WalkAway;"1012918435595018246";https://twitter.com/TiffanyPoggers/status/1012918435595018246;0
owenfoster2K18;2018-06-30 00:28;153;510;"Alright, so I actually did #WalkAway a week before it was cool. The Left preaches tolerance and acceptance but does a very poor job of practicing it.";;;#WalkAway;"1012915878093115393";https://twitter.com/owenfoster2K18/status/1012915878093115393;0
MellyP121;2018-06-30 00:27;95;249;"Wow, being latina, conservative, and from the sf bay area, I just want to say thank you for all the encouragement and love from my fellow free thinkers! your stories! You all really are a breath of fresh air!!! Thank you! #walkaway #freethinker #MAGA #KAG";;;#walkaway #freethinker #MAGA #KAG;"1012915572307156997";https://twitter.com/MellyP121/status/1012915572307156997;0
DeepTweetedOne;2018-06-30 00:26;347;855;"I used to vote for the left but have had to #walkaway The second you disagree with them on just about any issue you are labelled a mysogynist a racist you name it. They have turned into the party of hate.";;;#walkaway;"1012915174544510976";https://twitter.com/DeepTweetedOne/status/1012915174544510976;0
Carolin17951107;2018-06-30 00:25;416;603;"http:// dailycaller.com/2018/06/29/whe n-you-hear-what-obama-just-said-about-healthcare-you-will-know-irony-is-officially-dead/ … Obama says his only regret after being head of the party for 8yrs was that people "loved and focused" on him too much He's responsible for ruining HC, dividing our nation, and ruining the DNC BUT he doesn't regret that! What an asshat! Don't #WalkAway RUN";;;#WalkAway;"1012914948077334528";https://twitter.com/Carolin17951107/status/1012914948077334528;0
juliodaboyscout;2018-06-30 00:25;411;1109;"I walked away because the Democrats want me to be an oppressed victim. No. I succeed on my own merit. Im not oppressed, I'm not a victim, and I dont see color #walkaway";;;#walkaway;"1012914889596157952";https://twitter.com/juliodaboyscout/status/1012914889596157952;0
TDoncaster1;2018-06-30 00:22;49;119;"Retweeted Sofia Vargoros ( @sofialimited ): Both my parents are Hispanic LEGAL immigrants, both were registered Democrats, and both this week told me they have decided to #WalkAway";;@sofialimited;#WalkAway;"1012914345301377024";https://twitter.com/TDoncaster1/status/1012914345301377024;0
therealscarnoob;2018-06-30 00:21;66;196;"I'm tired of all the violence and hate from the corrupt dem party. #democratspartyofhate #WalkAway";;;#democratspartyofhate #WalkAway;"1012914060071825414";https://twitter.com/therealscarnoob/status/1012914060071825414;0
DieABeetus;2018-06-30 00:20;40;122;"I decided to #WalkAway when I saw more racial divide with the democratic party in control. I shamefully voted for Obama twice and personally witnessed our economy suffering. I will be a Republican for life now. #MAGA";;;#WalkAway #MAGA;"1012913717313523712";https://twitter.com/DieABeetus/status/1012913717313523712;0
therealscarnoob;2018-06-30 00:19;459;1452;"I voted Obama twice. The Dems stole my right to vote for Bernie. Tired of feeling guilt over not voting for a corrupt party. Time to #WalkAway";;;#WalkAway;"1012913520751472640";https://twitter.com/therealscarnoob/status/1012913520751472640;0
Str8DonLemon;2018-06-30 00:19;74;125;"I realized Democrats stopped caring about me & more for illegal aliens. I was mad, but still a Democrat. But when black brothers & sisters started getting fired cuz they don't speak Spanish when English is our language, I knew had to #WalkAway #MAGA #Asimilación #SaturdayMorning pic.twitter.com/ySpL2WBPgm";;;#WalkAway #MAGA #Asimilaci #SaturdayMorning;"1012913391185399808";https://twitter.com/Str8DonLemon/status/1012913391185399808;0
QAnonPatriot;2018-06-30 00:14;81;202;"Everyone is asking who Q is. Q is about to become mainstream. Out of the darkness will come light. #WWG1WGA #QAnon #WalkAway";;;#WWG1WGA #QAnon #WalkAway;"1012912257397735424";https://twitter.com/QAnonPatriot/status/1012912257397735424;0
cmosley125;2018-06-30 00:14;72;160;"The Democrat Party is now the party of Antifa, Illegals and Communists #WalkAway";;;#WalkAway;"1012912220353658880";https://twitter.com/cmosley125/status/1012912220353658880;0
theplasticpope_;2018-06-30 00:00;27;108;"Look at the #walkaway hashtag and tell me trump ain’t winning in 2020";;;#walkaway;"1012908681137180677";https://twitter.com/theplasticpope_/status/1012908681137180677;0
PJeannieM;2018-06-29 23:59;98;230;"#WalkAway I was silent as well because I didn't want to trigger any irrational behavior from the left. Now I scream it loud and clear! #MAGA";;;#WalkAway #MAGA;"1012908561377083392";https://twitter.com/PJeannieM/status/1012908561377083392;0
AhhhsumPossum;2018-06-29 23:57;153;529;"I was a Democrat until I got my first real paycheck. #walkaway";;;#walkaway;"1012907944881610757";https://twitter.com/AhhhsumPossum/status/1012907944881610757;0
ISH_205;2018-06-29 23:52;109;313;"Man it’s kinda beautiful seeing this #walkaway movement take hold.. Can you feel it? That’s America’s heartbeat getting stronger.";;;#walkaway;"1012906621599707136";https://twitter.com/ISH_205/status/1012906621599707136;0
IndiaMaria2020;2018-06-29 23:41;48;130;"From the #walkaway 's, to hillbillies the Appelachies, to the rednecks here in N. Texas, to the Blue Collars in the Rust Belt -- folks are ready to crawl on their hands and knees over chards of broken glass to pull that lever for GOP! You bet!";;;#walkaway;"1012903894534557696";https://twitter.com/IndiaMaria2020/status/1012903894534557696;0
adamistheman76;2018-06-29 23:31;134;306;"I love how Twitter is censoring #WalkAway and #DemExit just proves how the left are actually the oppressors.";;;#WalkAway #DemExit;"1012901472806158337";https://twitter.com/adamistheman76/status/1012901472806158337;0
novalibertas;2018-06-29 23:25;410;641;"The media is pro-Democrat. They're also pro-pedophile. Maybe that's a sign you should #WalkAway . pic.twitter.com/d7sBYuIhw7";;;#WalkAway;"1012899911799537664";https://twitter.com/novalibertas/status/1012899911799537664;0
cherygirl0607;2018-06-29 23:21;376;1117;"After being a dem/liberal for 20+ yrs, I had finally had enough of the lies, broken promises and the intolerance the left perpetuates. I decided to #walkaway in 2016 and will never look back. #MAGA #WalkAwayCampaign #Trump2020";;;#walkaway #MAGA #WalkAwayCampaign #Trump2020;"1012898834798796808";https://twitter.com/cherygirl0607/status/1012898834798796808;0
muhlibertas;2018-06-29 23:15;1363;2259;"Damn, this is ACCURATE! #WalkAway pic.twitter.com/Gpv1qqQpnT";;;#WalkAway;"1012897482127208448";https://twitter.com/muhlibertas/status/1012897482127208448;0
eduardo_austin;2018-06-29 23:11;268;593;"I just came across the #walkaway movement on Twitter. If you are not sure how to feel about your political party, read some of the posts by clicking on the hashtag. These are the real stories that nobody is reporting or acknowledging.";;;#walkaway;"1012896449737232384";https://twitter.com/eduardo_austin/status/1012896449737232384;0
muhlibertas;2018-06-29 23:11;550;874;"#Democrats have been on the side of slaveowners forever! #Republicans have been on the side of minorities since Abe Lincoln! That's why I #WalkAway ! Look at this #racist Democratic poster, they never cared about us... pic.twitter.com/nqApcrhI5J";;;#Democrats #Republicans #WalkAway #racist;"1012896269935697920";https://twitter.com/muhlibertas/status/1012896269935697920;0
pattiepatt;2018-06-29 23:05;388;806;"Why isn’t #WalkAway trending? pic.twitter.com/yTvis4qDgE";;;#WalkAway;"1012894968250339329";https://twitter.com/pattiepatt/status/1012894968250339329;0
Mike_L_Stanley;2018-06-29 23:04;57;168;"#WalkAway @PatriotsSoapbox @realDonaldTrump Q wants a brave reporter to ask the ultimate question: "Mr. President, when will you declassify [and unredact] ALL the related documents in the OIG?" @marthamaccallum @LauraLoomer @SaraCarterDC @RealCandaceO @seanhannity pic.twitter.com/BSeJ941top";;@PatriotsSoapbox @realDonaldTrump @marthamaccallum @LauraLoomer @SaraCarterDC @RealCandaceO @seanhannity;#WalkAway;"1012894569040670720";https://twitter.com/Mike_L_Stanley/status/1012894569040670720;0
JacobZurawski;2018-06-29 23:02;218;534;"Part of my choice to #walkaway was made possible when I realized that the victim mentality that I held (due to misfortunes in my childhood) was solely a detriment to my well-being and preventing me from achieving my potential. A mentality encouraged by Dems/Progressives.";;;#walkaway;"1012894074372870144";https://twitter.com/JacobZurawski/status/1012894074372870144;0
ShalahCollins;2018-06-29 22:58;132;231;"Breaking #Walkaway movement is trending. Just not on @twitter @LegendaryEnergy is on it, sharing testimonials. There’s got to be more where that came from. Watch his latest video. https:// twitter.com/legendaryenerg y/status/1012821976191078401 …";;@twitter @LegendaryEnergy;#Walkaway;"1012893210644017153";https://twitter.com/ShalahCollins/status/1012893210644017153;1
novalibertas;2018-06-29 22:55;196;419;"There's plenty of reasons why people #WalkAway . Democrats are the party of hate. pic.twitter.com/VSPa7ja9tE";;;#WalkAway;"1012892287645487105";https://twitter.com/novalibertas/status/1012892287645487105;0
taco_designs;2018-06-29 22:48;459;775;"I went to Berkeley to hear a talk by Milo. When I got there I saw a student beat a classmate for wearing a MAGA hat - while a fat girl yelled “rape him with the stick” as he laid unconscious. I voted for Obama twice but the modern Left has shown its real colors. #WalkAway pic.twitter.com/828IX9oMk7";;;#WalkAway;"1012890548720398337";https://twitter.com/taco_designs/status/1012890548720398337;0
TroyMGood1;2018-06-29 22:43;178;234;"I do not believe in luck.... I do believe in America, God, & my family and am willing to fight for all of it!!! So who is with me????? #MAGA #WalkAway #DrainTheSwamp #KAG pic.twitter.com/cTHDWtbllg";;;#MAGA #WalkAway #DrainTheSwamp #KAG;"1012889399011545088";https://twitter.com/TroyMGood1/status/1012889399011545088;0
OldManStoneZone;2018-06-29 22:38;82;128;""The Blazing Brave" Sunrise at #JekyllIsland The Brave is walking and pointing at America, showing us we need to come together to #MAGA . Rise above the hate and division. Join @Potus in his quest to #KAG #WalkAway #SaturdayMorning #OldManStoneZone pic.twitter.com/CJ7HI0GyZH";;@Potus;#JekyllIsland #MAGA #KAG #WalkAway #SaturdayMorning #OldManStoneZone;"1012888148576219136";https://twitter.com/OldManStoneZone/status/1012888148576219136;0
Freedom_Force_N;2018-06-29 22:35;0;0;"Q CIR FFN RPTW http:// freedomforcenews.com/forum/viewtopi c.php?p=2196#p2196 … #RedTide #WhoIsQ #WalkAway #Qanon";;;#p2196 #RedTide #WhoIsQ #WalkAway #Qanon;"1012887281105956864";https://twitter.com/Freedom_Force_N/status/1012887281105956864;0
Jaye_inUSA;2018-06-29 22:32;555;1005;"TRULY something to CELEBRATE First abortion clinic in Ohio- CLOSES its doors. #TinyLivesAtStake #ProLife #ChooseLife #WalkAway #WalkAwayMovement https://www. liveaction.org/news/ohio-abor tion-facility-closing-45-years/ …";;;#TinyLivesAtStake #ProLife #ChooseLife #WalkAway #WalkAwayMovement;"1012886607928668160";https://twitter.com/Jaye_inUSA/status/1012886607928668160;0
CaCindy3;2018-06-29 22:32;112;126;"So sad to see what San Francisco has become. Many wonderful memories of spending time with my hubby in this city. The voters of San Fran need to look within themselves and examine their liberal beliefs. Fix your city. #WalkAway before it's too late. Face reality vote Dems out. https:// twitter.com/bbusa617/statu s/1012841462030065664 …";;;#WalkAway;"1012886512994668544";https://twitter.com/CaCindy3/status/1012886512994668544;1
TroyMGood1;2018-06-29 22:30;122;177;"#MAGA #WalkAway #FridayFeeling What a great time to be alive!! We are awake and talking our country back from the crooked politicians who've almost destroyed it... #DrainTheSwamp and #KAG";;;#MAGA #WalkAway #FridayFeeling #DrainTheSwamp #KAG;"1012886055773712384";https://twitter.com/TroyMGood1/status/1012886055773712384;0
death69k;2018-06-29 22:21;2955;8424;"I did my own #walkaway this year. Voted D all my life since I was 18. I'm 42 now and just voted straight R ticket in the CA primary. Never felt better.";;;#walkaway;"1012883848244256769";https://twitter.com/death69k/status/1012883848244256769;0
JustinMRigsby_;2018-06-29 22:17;618;2105;"I was a Democrat for all my life until the last 2-3 years. Had to #WalkAway . They've gone too radical.";;;#WalkAway;"1012882861123362816";https://twitter.com/JustinMRigsby_/status/1012882861123362816;0
chefnolimits;2018-06-29 21:59;12233;30904;"My husband and I are both black. I am an immigrant and we’ve always voted Democrat. By the end of Obama term we became very disappointed in the Democrat party. The party has become intolerance, free speech oppressors, racist, lawless, and hypocritical. #WalkAway";;;#WalkAway;"1012878330171969536";https://twitter.com/chefnolimits/status/1012878330171969536;0
denvernight;2018-06-29 21:57;59;128;"It takes 1 million Venezuelan bolivars to buy the equivalent of ONE CUP OF COFFEE!!!! Leftists are STILL trying to sell the FAILED economic experiment we know as #Socialism . How the hell can anyone take them seriously? #WalkAway #AmericaFirst";;;#Socialism #WalkAway #AmericaFirst;"1012877654419263488";https://twitter.com/denvernight/status/1012877654419263488;0
Ellysa_Maye;2018-06-29 21:56;1212;1909;"Share if you support the people leaving the Democrat Party! #WalkAway @usminority Tweets featured: @RogueRepub1981 @ShalahCollins @EricSacco @CharlesLarryJr2 @w3bclone @ann_teafa pic.twitter.com/TPmfNhx6W6";;@usminority @RogueRepub1981 @ShalahCollins @EricSacco @CharlesLarryJr2 @w3bclone @ann_teafa;#WalkAway;"1012877503839571968";https://twitter.com/Ellysa_Maye/status/1012877503839571968;0
jimlibertarian;2018-06-29 21:50;524;1005;"Remember 1 thing Susan and that is the Rule Of Law,& if you protest peacefully that's fine,but if you step out of line the man will come take you away,and 1 more thing getting arrested is nothing to be proud of & encouraging others to get arrested is just plain dumb #WalkAway https:// twitter.com/susansarandon/ status/1012827314319708160 …";;;#WalkAway;"1012876115327647745";https://twitter.com/jimlibertarian/status/1012876115327647745;1
youngjesus40oz;2018-06-29 21:49;327;1230;"Being that I'm a young African American, I would put my trust into democrats such as Maxine Waters and what she says. But I can't after looking into #QAnon . that's why the fuck I am finna #walkaway";;;#QAnon #walkaway;"1012875632651456512";https://twitter.com/youngjesus40oz/status/1012875632651456512;0
goatse419;2018-06-29 21:48;678;2150;"#walkaway voted obama in 2012 & trump in 2016. Promptly called a racist by so called liberal friends. This party is all about hate & the irony is they can’t see it.";;;#walkaway;"1012875471388749824";https://twitter.com/goatse419/status/1012875471388749824;0
mjp631;2018-06-29 21:47;52;424;"Just #WalkAway and and join the winning side pic.twitter.com/Z3WJGbxsjU";;;#WalkAway;"1012875352933363712";https://twitter.com/mjp631/status/1012875352933363712;0
redactedanon;2018-06-29 21:39;170;336;"Super #MAGA #walkaway #AmericaIn3Words pic.twitter.com/avlr4jHt8F";;;#MAGA #walkaway #AmericaIn3Words;"1012873311364186112";https://twitter.com/redactedanon/status/1012873311364186112;0
bigleaguepol;2018-06-29 21:39;272;464;"In a Blow to Democrat Hopes, #WalkAway Movement Gaining Steam https:// buff.ly/2KnIvJZ";;;#WalkAway;"1012873104220188672";https://twitter.com/bigleaguepol/status/1012873104220188672;0
KatTheHammer1;2018-06-29 21:38;506;1059;"Democrats be like..... #walkaway pic.twitter.com/1XGPAAehAq";;;#walkaway;"1012873029129400321";https://twitter.com/KatTheHammer1/status/1012873029129400321;0
MyHappieHome;2018-06-29 21:38;304;850;"Teacher who can no longer support a party that advocates violence, the demise of our government & Constitution #WalkAway";;;#WalkAway;"1012872899399684097";https://twitter.com/MyHappieHome/status/1012872899399684097;0
AIpatriotIZ;2018-06-29 21:37;113;140;"We need to #AbolishFBI & #AbolishCIA Overstaffed Overpaid No return on investment for Americans Playing politics over Protecting Americans Socialism #FridayFeeling #WalkAway #4thofJulyWeekend pic.twitter.com/ZNbOhW8y6H";;;#AbolishFBI #AbolishCIA #FridayFeeling #WalkAway #4thofJulyWeekend;"1012872746542325760";https://twitter.com/AIpatriotIZ/status/1012872746542325760;0
AKMoMo907;2018-06-29 21:37;178;451;"When you can’t tell the difference between Democrats and Socialists....time to #WalkAway";;;#WalkAway;"1012872682759774208";https://twitter.com/AKMoMo907/status/1012872682759774208;0
amez_jesus;2018-06-29 21:33;74;173;"#WalkAway I walked away from the left when society deemed it proper to put @POTUS44 in office just because of the color of his skin and their wanting to make history. Well @POTUS44 made history alright, the worst thing to happen to our American values. Thank God for @POTUS";;@POTUS44 @POTUS44 @POTUS;#WalkAway;"1012871807773261824";https://twitter.com/amez_jesus/status/1012871807773261824;0
r_little_finger;2018-06-29 21:28;1349;1313;"Dems want to abolish ICE, Dems want to abolish right to bear arms, Dems want to abolish political opposition, Dems want to abolish our borders, Dems want to abolish free thinking Blacks, Dems want to abolish America. RETWEET IF YOU ARE AGAINST DEMOCRATS. #WalkAway";;;#WalkAway;"1012870416103362560";https://twitter.com/r_little_finger/status/1012870416103362560;0
Andybuji1;2018-06-29 21:27;107;422;"This NY Jew chose to #WalkAway after watching, in horror and disbelief, the Dems try to steal the 2000 election. Serious redpilled.";;;#WalkAway;"1012870198079057920";https://twitter.com/Andybuji1/status/1012870198079057920;0
jarret210;2018-06-29 21:23;93;224;"To all of those who have decided to #WalkAway ... Welcome and all aboard! May our movement continue to grow! #Trump2020";;;#WalkAway #Trump2020;"1012869294106038272";https://twitter.com/jarret210/status/1012869294106038272;0
LynwoodTalks;2018-06-29 21:10;104;251;"~ Donald Trump is Changing the Paradigm ~ (In science and philosophy, a paradigm is a distinct set of concepts or thought patterns) "NOW do you understand the hate? They hate Trump because he's freeing people from slavery." #WalkAway @ThomasWictor https:// twitter.com/ThomasWictor/s tatus/1012861008547725312 …";;@ThomasWictor;#WalkAway;"1012865847763726337";https://twitter.com/LynwoodTalks/status/1012865847763726337;1
