username;date;retweets;favorites;text;geo;mentions;hashtags;id;permalink;retweetornot
edesignerz2;2018-06-26 15:07;125;371;"If you are a Democrat and don't like how far left the party has gone check out #WalkAway on Facebook";;;#WalkAway;"1011687321232523264";https://twitter.com/edesignerz2/status/1011687321232523264;0
jspofford;2018-06-26 15:01;116;515;"Stay positive. I believe enough people will #WalkAway so that there won't be enormous civil unrest.";;;#WalkAway;"1011685991529185280";https://twitter.com/jspofford/status/1011685991529185280;0
RobtHagedorn;2018-06-26 14:55;445;972;"#WalkAway I walked away. The Democratic Party has been taken over by the Left. And the Left is power crazy, mentally ill, violent, dangerous, sexually confused, and detests the United States. The Democrats offer nothing positive, just their own projected hatred and rage.";;;#WalkAway;"1011684392706535424";https://twitter.com/RobtHagedorn/status/1011684392706535424;0
AndrewSFrazure;2018-06-26 14:52;585;1434;"I was a proud Obama voter in 08. Now I can't stand by while the #DemocratParty promotes violence and the degradation of American citizens. I chose to #walkaway .";;;#DemocratParty #walkaway;"1011683577929449472";https://twitter.com/AndrewSFrazure/status/1011683577929449472;0
lesliemack;2018-06-26 14:46;855;2703;"When Obama condoned the killing of police that's when I #WalkAway";;;#WalkAway;"1011682180563636226";https://twitter.com/lesliemack/status/1011682180563636226;0
AlvinaHart;2018-06-26 14:46;174;652;"Loving the #WalkAway movement and the courageous stories being shared. USA! Thank you, fellow Americans - together we are better!";;;#WalkAway;"1011682003052359680";https://twitter.com/AlvinaHart/status/1011682003052359680;0
MTReserved;2018-06-26 14:29;162;162;"The Left wages the #WarOnWomen . First inciting violence against women. Now they promote sexual assault against women. So much for #MeToo #WalkAway pic.twitter.com/aipa0Wj9ZK";;;#WarOnWomen #MeToo #WalkAway;"1011677818651070465";https://twitter.com/MTReserved/status/1011677818651070465;0
The_Bible_Geek;2018-06-26 14:26;101;202;"I hope many realise and #WalkAway The Democrat party has changed Anti American Anti Christian Anti Black Anti White Anti Hispanic Anti Truth Anti Jobs Anti Coal Anti Energy Independent Pro Illegal immigration. Maxine Waters is the head and the face of it now";;;#WalkAway;"1011677192483426307";https://twitter.com/The_Bible_Geek/status/1011677192483426307;0
Steffs_tweets;2018-06-26 14:04;393;465;"Democrats want to take away Our Borders Our Guns Our Speech Our Money Our Jobs Our Religion Our President Our Happiness Our Flag Our History They want total control of every aspect of our lives & nothing less! #WalkAway #TakeOurCountryBack #VoteRed2018";;;#WalkAway #TakeOurCountryBack #VoteRed2018;"1011671521364992001";https://twitter.com/Steffs_tweets/status/1011671521364992001;0
DebAlwaystrump;2018-06-26 13:52;33;32;"#DemExit #WalkAway Dems DO NOT give a damn about the children THEY never stopped Obama who separated 72, 410 STOP VOTING Socialist DEMOCRAT Dems are colluding with Marxist Mexican Presidential Candidate to flood America with illegals to INVADE America VOTE REPUBLICAN pic.twitter.com/KqWottLZNv";;;#DemExit #WalkAway;"1011668466519216130";https://twitter.com/DebAlwaystrump/status/1011668466519216130;0
tracybeanz;2018-06-26 13:51;415;898;"Do a search for this hashtag. #WalkAway https:// twitter.com/lamba_q/status /1011343991898562560 …";;;#WalkAway;"1011668197072953344";https://twitter.com/tracybeanz/status/1011668197072953344;1
kasuwell;2018-06-26 13:47;104;360;"#walkaway i'm a hard worker who is pro life , believes marriage is between a man and a woman , Democrat policies and ideology just don't speak to me";;;#walkaway;"1011667279640236032";https://twitter.com/kasuwell/status/1011667279640236032;0
SweetFreedom29;2018-06-26 13:42;87;60;"Lock your doors: DHS secretary warns that employees are getting ‘specific,’ ‘credible’ threats https:// bit.ly/2tHgjqt #tcot #LunaticLiberals #WalkAway";;;#tcot #LunaticLiberals #WalkAway;"1011666064810414085";https://twitter.com/SweetFreedom29/status/1011666064810414085;0
MomDeplorable;2018-06-26 13:36;25;53;"This is just laughable- as a woman living in America and one that has traveled extensively. America is one of the best and safest places in the world for women. But Democrats want to change that with Open Borders & Sanctuary Cities! #WalkAway #MaxWarriors #AmericaFirst";;;#WalkAway #MaxWarriors #AmericaFirst;"1011664445808902144";https://twitter.com/MomDeplorable/status/1011664445808902144;0
CaptSchark;2018-06-26 13:29;52;157;"#WalkAway is gaining traction at an amazing pace. Keep up the great work and godspeed on spreading the message.";;;#WalkAway;"1011662708637339648";https://twitter.com/CaptSchark/status/1011662708637339648;0
MAGANinaJo;2018-06-26 13:29;47;37;"Dems, you are better than your party in power. #WalkAway , stash the hate & move over to the Republican Party! We stand for all Americans first & we are getting our country rocking economically so everyone has jobs & more $$. #WalkAway from the party of hate! We welcome U! pic.twitter.com/c4qv6cazUN";;;#WalkAway #WalkAway;"1011662695026905088";https://twitter.com/MAGANinaJo/status/1011662695026905088;0
four20girl;2018-06-26 13:23;36;58;"Waters: "If you see anybody from that cabinet in a restaurant, in a department store, at a gasoline station, you get out and you create a crowd. And you push back on them. And you tell them they're not welcome anymore, anywhere." is classic #gaslighting #WalkAway #QAnon https:// twitter.com/LionelMedia/st atus/1011623281248690176 …";;;#gaslighting #WalkAway #QAnon;"1011661293948768256";https://twitter.com/four20girl/status/1011661293948768256;1
CHIZMAGA;2018-06-26 13:23;237;495;"I can proudly say, I’ve never spent one day of my life as a Democrat... For those that have, it’s not too late. Come on over to the other side... We forgive you, we will fight for you, we will protect you and we will welcome you! #WalkAway !";;;#WalkAway;"1011661240194588673";https://twitter.com/CHIZMAGA/status/1011661240194588673;0
clayfeathers;2018-06-26 13:22;522;940;"This is how I feel anyway.... #TuesdayThoughts #WalkAway #MAGA pic.twitter.com/wsTMttz1zG";;;#TuesdayThoughts #WalkAway #MAGA;"1011661055519526912";https://twitter.com/clayfeathers/status/1011661055519526912;0
jojoh888;2018-06-26 13:22;462;700;"I just love how these words come bite them in the A$$ Are you crying Chucky? I think so... #travelban #WINNING #MAGA #WalkAway #LiberalismIsAMentalDisorder #LiberalismIsAMentalDisease pic.twitter.com/BytoAS0XaE";;;#travelban #WINNING #MAGA #WalkAway #LiberalismIsAMentalDisorder #LiberalismIsAMentalDisease;"1011660995243200512";https://twitter.com/jojoh888/status/1011660995243200512;0
cazam_c;2018-06-26 13:14;18;104;"All #Democrats that are tired of the hate and #Resist & #Obstruct movement are so welcome to #WalkAway and we will accept you with open arms";;;#Democrats #Resist #Obstruct #WalkAway;"1011658968098332672";https://twitter.com/cazam_c/status/1011658968098332672;0
usminority;2018-06-26 13:13;198;356;"Awesome, @TheNoahRing !!!! Would you please join the #WalkAway Campaign group and post your video there? https:// m.facebook.com/groups/1945356 878817544 … https:// twitter.com/thenoahring/st atus/1011605449475584001 …";;@TheNoahRing;#WalkAway;"1011658836359380993";https://twitter.com/usminority/status/1011658836359380993;0
rorrimsegami;2018-06-26 13:06;421;1310;"I had my democrat artist friends treat me intolerantly for years & years because of my faith, my patriotism, my military service, and then for being a first amendment advocate. When they ostracized me for defending people’s constitutional rights, that’s when i #WalkAway";;;#WalkAway;"1011656838281154562";https://twitter.com/rorrimsegami/status/1011656838281154562;0
born_summer62;2018-06-26 12:56;78;555;"@johnlegend is part of the PROBLEM not the SOLUTION Mr. Legend Learn from @kanyewest Embrace LOVE NOT HATE And buy a red #MAGA hat And join the team to Make the World a better place #WalkAway";;@johnlegend @kanyewest;#MAGA #WalkAway;"1011654552850841600";https://twitter.com/born_summer62/status/1011654552850841600;0
ar15m4mid;2018-06-26 12:52;83;127;"#WalkAway #Liberals Look at your party of #Hate and divison and tell me you actually endorse that despicable behavior. #WalkAwayMovement #VoteRed2018 #VoteThemOut2018 #RedWaveRising2018 https:// twitter.com/k_ovfefe/statu s/1011608060693970949 …";;;#WalkAway #Liberals #Hate #WalkAwayMovement #VoteRed2018 #VoteThemOut2018 #RedWaveRising2018;"1011653487200034816";https://twitter.com/ar15m4mid/status/1011653487200034816;1
Toni_Price;2018-06-26 12:16;28;60;"Dems have started an organic movement called #WalkAway If you're a Democrat who wants to leave the party of broken promises, find other Dems who are leaving too and jumping on the #TrumpTrain Watch the Video! https:// twitter.com/usminority/sta tus/1007191747355729920?s=19 …";;;#WalkAway #TrumpTrain;"1011644461019873280";https://twitter.com/Toni_Price/status/1011644461019873280;1
SouthernLady___;2018-06-26 12:15;52;95;"Because many have chosen to #WalkAway it's a movement! https:// twitter.com/usminority/sta tus/1007191747355729920?s=19 …";;;#WalkAway;"1011644224935211008";https://twitter.com/SouthernLady___/status/1011644224935211008;1
ChadSmith1971;2018-06-26 12:14;693;1432;"I decided to #WalkAway when I recognized that the DNC stopped supporting working folks in favor of the non-working. They turned their backs on their base. Look at what they have now #MaxineWaters and #NancyPelosi who wants to be part of that?";;;#WalkAway #MaxineWaters #NancyPelosi;"1011643983209132034";https://twitter.com/ChadSmith1971/status/1011643983209132034;0
AmericanVoterUS;2018-06-26 12:14;58;72;"Walk away from 30 years of CORRUPTION #WalkAway #WalkAwayCampaign #WalkAwayMovement #MaxineWaters https:// twitter.com/AmericanVoterU S/status/1011295858967474176 …";;;#WalkAway #WalkAwayCampaign #WalkAwayMovement #MaxineWaters;"1011643897787793408";https://twitter.com/AmericanVoterUS/status/1011643897787793408;1
SBradstrea;2018-06-26 12:14;96;100;"Patriots! Are U ready 2 march on this #PrimaryDay & #GoVote for the good of our Nation! H-O-A-H! Ask ur Dem-friend 2 #Walkaway & #TakeTheRedPill becuz YOU KNOW you want 2 be a part of #RedTsunamiRising ! Don't forget 2 go 2 #TrumpWorldGroups http:// red-pilled.com and register!! pic.twitter.com/syQNRgIck7";;;#PrimaryDay #GoVote #Walkaway #TakeTheRedPill #RedTsunamiRising #TrumpWorldGroups;"1011643803290226688";https://twitter.com/SBradstrea/status/1011643803290226688;0
mommagaston;2018-06-26 12:08;25;75;"#WalkAway is gaining momentum. Good job Dems! Keep em comin! We’ll take every one of them and show them the light! https:// twitter.com/ofcrdeonjoseph /status/1011096363566694400 …";;;#WalkAway;"1011642419807473664";https://twitter.com/mommagaston/status/1011642419807473664;1
jharper1024;2018-06-26 12:06;1117;3212;"I was an angry young person firmly believing that I was a victim of American institutions. I listened to progressive voices, hung out with progressive “intellectuals,” and even voted for Obama in 2008. But then, I grew up and chose to #WalkAway";;;#WalkAway;"1011641881195933701";https://twitter.com/jharper1024/status/1011641881195933701;0
cosmo_bebe;2018-06-26 12:05;25;59;"My very first vote went to Obama in 2012 but then college history happened and decided to #WalkAway forever. Fooled me once but not twice! #MAGA #NeverLookingBack #DemocratsHateAmerica";;;#WalkAway #MAGA #NeverLookingBack #DemocratsHateAmerica;"1011641515788161024";https://twitter.com/cosmo_bebe/status/1011641515788161024;0
CHIZMAGA;2018-06-26 12:00;87;190;"The Democrat Party is like Alcohol Addiction, once you decide to #walkaway , your quality of life instantly improves!";;;#walkaway;"1011640226970624001";https://twitter.com/CHIZMAGA/status/1011640226970624001;0
SickOfTheSwamp;2018-06-26 11:53;27;43;"I couldn't agree more. I just don’t understand the far left. Dems don’t want to protect our nation from border invasion, and they want to persecute people for their political beliefs. THEY want to create the divide. #WalkAway from this Democratic Party #SOTSwamp pic.twitter.com/8B2thYrB80";;;#WalkAway #SOTSwamp;"1011638577678180352";https://twitter.com/SickOfTheSwamp/status/1011638577678180352;0
AmericanVoterUS;2018-06-26 11:46;99;117;"Walk away from political operatives pretending to be journalists #WalkAway #WalkAwayMovement #WalkAwayCampaign https:// twitter.com/AmericanVoterU S/status/900732909782409217 …";;;#WalkAway #WalkAwayMovement #WalkAwayCampaign;"1011636860060254208";https://twitter.com/AmericanVoterUS/status/1011636860060254208;1
Iseetomorrow;2018-06-26 11:46;316;2197;"Your so very lost @TheDemocrats Soon nobody will be listening... More and more are #walkaway #MAGA";;@TheDemocrats;#walkaway #MAGA;"1011636750874234881";https://twitter.com/Iseetomorrow/status/1011636750874234881;0
RagerJohnny;2018-06-26 11:39;0;0;"#walkaway Ginsburg";;;#walkaway;"1011635144329965568";https://twitter.com/RagerJohnny/status/1011635144329965568;0
TheChuckerJones;2018-06-26 11:34;143;248;"When the DNC lied, cheated, spied, hacked, intimidated, stole, bribed, and bullied anyone who opposed @HillaryClinton to be the nominee... that is when I decided to #WalkAway";;@HillaryClinton;#WalkAway;"1011633797966725122";https://twitter.com/TheChuckerJones/status/1011633797966725122;0
RodStryker;2018-06-26 11:32;1095;1242;"Liberals, Drop the "Rules for Radicals" & #WalkAway quickly. Democrats are brainwashing their base to accept Open Borders. Look how that turned out for Europe. Illegal migrants are destroying their nations. @ICEgov are doing their jobs & must continue. pic.twitter.com/m47TyJhGop";;@ICEgov;#WalkAway;"1011633265269248000";https://twitter.com/RodStryker/status/1011633265269248000;0
JoshNoneYaBiz;2018-06-26 11:19;66;206;"I was once a liberal who loved the "COEXIST" bumper stickers. Until I realized you can't coexist with people who want to kill you. #SCOTUS #walkaway";;;#SCOTUS #walkaway;"1011630040818171904";https://twitter.com/JoshNoneYaBiz/status/1011630040818171904;0
iDefendFreedom;2018-06-26 11:02;120;328;"#WalkAway My dad was a coal miner, factory worker, mechanic and lifelong union member back in Scranton, PA. He was a lifelong Democrat who got to vote for @realDonaldTrump before he passed away. He walked away from the Democrat party when they walked away from God. #RIP pic.twitter.com/HkrCvJ87rT";;@realDonaldTrump;#WalkAway #RIP;"1011625747205812225";https://twitter.com/iDefendFreedom/status/1011625747205812225;0
cuppycoco;2018-06-26 10:59;42;71;". @DHSgov : “It is the duty of the government to ensure that those seeking to enter our country will not harm the American people [...] Today’s ruling confirms the legality of these critically important executive actions." #Winning #WalkAway #Trump2020Landslide pic.twitter.com/xJV8IksSH4";;@DHSgov;#Winning #WalkAway #Trump2020Landslide;"1011624967019130880";https://twitter.com/cuppycoco/status/1011624967019130880;0
BigBrant75;2018-06-26 10:47;56;115;"Growing up Democrat, I believed what I was told about the Democratic Party. Once I decided to seek the truth to back my Democratic Beliefs, I found out what I was told were lies. The TRUTH lead me to #WalkAway";;;#WalkAway;"1011621858653949953";https://twitter.com/BigBrant75/status/1011621858653949953;0
gopoundsand1234;2018-06-26 10:36;40;54;"#Allelujah #AMEN #TRAVELBAN #NOREFUGEES #WalkAway From the left Supreme Court upholds Trump travel ban https:// wapo.st/2yGqO36?tid=ss _tw-amp …";;;#Allelujah #AMEN #TRAVELBAN #NOREFUGEES #WalkAway;"1011619251566850048";https://twitter.com/gopoundsand1234/status/1011619251566850048;0
bonniemurphy;2018-06-26 10:32;404;699;"Obama was a dud for a President!! Actions Speak Louder Than Words Make Korea Great Again #PeaceThroughStrength #WalkAway pic.twitter.com/fLoguUkHlY";;;#PeaceThroughStrength #WalkAway;"1011618221039013890";https://twitter.com/bonniemurphy/status/1011618221039013890;0
barmore27;2018-06-26 10:26;85;147;"Supreme Court upholds Trump travel ban. A big win for the WH. #stillwinning #WalkAway #KAG2018 pic.twitter.com/slSugbvd5c";;;#stillwinning #WalkAway #KAG2018;"1011616805532491777";https://twitter.com/barmore27/status/1011616805532491777;0
DutyOfAPatriot;2018-06-26 10:21;231;211;"Democrats & MSM Drive Us Ever Closer April 12, 1861– Democrats Pushed To The Last One And Are Again Pushing Toward This One DEMOCRATS = HATE DEMOCRATS = DIVISION DEMOCRATS = SUBVERSION #WalkAway pic.twitter.com/25QevMKzSd";;;#WalkAway;"1011615482821017601";https://twitter.com/DutyOfAPatriot/status/1011615482821017601;0
NotSoFastBlog;2018-06-26 10:17;7358;20407;"Canadian. Can’t vote, but I supported Obama twice, looked down on the US, fell for the anti-Trump hype, and truly believed the right was a group of sexist, racist homophobes. I apologize. Couldn’t have been more wrong. Will never vote left again. #WalkAway";;;#WalkAway;"1011614454256160770";https://twitter.com/NotSoFastBlog/status/1011614454256160770;0
dagrindonmymind;2018-06-26 10:15;247;484;"#WalkAway if you don’t stand for political intimidation. #WalkAway if you don’t stand for misinformation. #WalkAway if you’re tired of being told what to think. #WalkAway if you don’t stand for bullying. #WalkAway from the mob mentality. #WalkAway from political discrimination.";;;#WalkAway #WalkAway #WalkAway #WalkAway #WalkAway #WalkAway;"1011613908342267904";https://twitter.com/dagrindonmymind/status/1011613908342267904;0
LeeLeeKonks;2018-06-26 10:10;149;385;"It's a beautiful day to #WalkAway , my friends. Darkness to light. Truth to power. We know most of you care, we know you're smart. The time is now. Welcome to the Patriot Movement. It's a great time to be alive. You're part of history.";;;#WalkAway;"1011612691809624065";https://twitter.com/LeeLeeKonks/status/1011612691809624065;0
dagrindonmymind;2018-06-26 10:07;513;1321;"Why did I #WalkAway ? Liberals are intolerant. The moment you disagree with their views you’re a Nazi, misogynist, sexist, racist. If you’re black they call you Coon or Uncle Tom. Liberals hate Free Speech, 2nd Amendment, Capitalism, Military... They hate everything American";;;#WalkAway;"1011612017474433024";https://twitter.com/dagrindonmymind/status/1011612017474433024;0
tzbauknight;2018-06-26 10:02;139;375;"My #WalkAway moment came when @BernieSanders told me to vote for #CrookedHillary . Ain’t nobody got time for that. I wonder what mayhem Bernie would have been subjected to as president... #QAnon";;@BernieSanders;#WalkAway #CrookedHillary #QAnon;"1011610751432261632";https://twitter.com/tzbauknight/status/1011610751432261632;0
Truthseeker126;2018-06-26 10:00;211;312;"There is hope for #TrumpDerangementSyndrome still! Just #WalkAway folks. You will better off. It's time to take the red pill. #MAGA #TuesdayThoughts pic.twitter.com/3nyfOYahtO";;;#TrumpDerangementSyndrome #WalkAway #MAGA #TuesdayThoughts;"1011610215366750208";https://twitter.com/Truthseeker126/status/1011610215366750208;0
DRottiemom;2018-06-26 09:55;90;120;"#MadMaxine Should be IMPEACHED For Inciting Violence on @POTUS , White House Staff & #WeThePeople . And Blatant Stupidity #WalkAway #WeThePeopleDemandJustice #UPP #UnitedPatriotsParty #RainmakersUnite #RedPassion #TrumpWorld pic.twitter.com/Tewrw1qRAG";;@POTUS;#MadMaxine #WeThePeople #WalkAway #WeThePeopleDemandJustice #UPP #UnitedPatriotsParty #RainmakersUnite #RedPassion #TrumpWorld;"1011608921944084481";https://twitter.com/DRottiemom/status/1011608921944084481;0
k_ovfefe;2018-06-26 09:52;1122;2267;"My dad's Mexican father voted for Trump My mom's JFK Democrat mother voted for Trump My sister's Ghanian immigrant father-in-law voted for Trump My millennial siblings all voted for Trump The Trump train isn't white, old, Republican, or racist It's American. #WalkAway";;;#WalkAway;"1011608060693970949";https://twitter.com/k_ovfefe/status/1011608060693970949;0
barmore27;2018-06-26 09:45;79;114;"If your a democrat and decide to #WalkAway from all the hate a lunacy of that party, I welcome you to #PatriotsUnited 󾓦󾓦󾓦 If you decide to stay in the same gutter with the rest I don't have time nor do I choose to socialize with you! #justsaying #MAGA #WalkAwayMovement pic.twitter.com/YuQ0oBCJt1";;;#WalkAway #PatriotsUnited #justsaying #MAGA #WalkAwayMovement;"1011606278345560065";https://twitter.com/barmore27/status/1011606278345560065;0
JohnCooper0610;2018-06-26 09:36;93;164;"The nastier the Democrats get toward @realDonaldTrump the bigger the #WalkAway #WalkAwayMovement is getting. Hopefully Democrats never figure it out.";;@realDonaldTrump;#WalkAway #WalkAwayMovement;"1011604169436823554";https://twitter.com/JohnCooper0610/status/1011604169436823554;0
LVNancy;2018-06-26 09:34;155;141;"@RepGoodlatte , we have ZERO confidence and want Transparency of Trump-Russia "Investigation" #FBICorruption acted for the purpose of affecting the presidential election to favor #Hillary #Strzok #Comey #WalkAway #TuesdayThoughts #MAGA #DoYourJob https://www. wsj.com/articles/muell ers-fruit-of-the-poisonous-tree-15297070 … pic.twitter.com/bOYhIjKj4h";;@RepGoodlatte;#FBICorruption #Hillary #Strzok #Comey #WalkAway #TuesdayThoughts #MAGA #DoYourJob;"1011603718536654855";https://twitter.com/LVNancy/status/1011603718536654855;0
usminority;2018-06-26 09:30;543;788;"Great article about the #WalkAway Campaign!! https://www. google.com/amp/s/pjmedia. com/trending/walkaway-campaign-urges-fed-up-democrats-to-leave-the-party/amp/ …";;;#WalkAway;"1011602594203160577";https://twitter.com/usminority/status/1011602594203160577;0
LAMBA_Q;2018-06-26 09:22;97;317;"Shoutout to everyone in #WalkAway because your decision is so right that you will never walk back!";;;#WalkAway;"1011600632489435136";https://twitter.com/LAMBA_Q/status/1011600632489435136;0
fit4aqueen3;2018-06-26 09:10;83;84;"Remember if its RED its RIGHT! If its too good to be TRUE, its blue! #TrumpWorldGroups #PrimaryDay #RedTsunamiRising #Walkaway http:// Red-Pilled.com #TakeTheRedPill #GoVote pic.twitter.com/7Ux1dZ8Q2a";;;#TrumpWorldGroups #PrimaryDay #RedTsunamiRising #Walkaway #TakeTheRedPill #GoVote;"1011597687702122497";https://twitter.com/fit4aqueen3/status/1011597687702122497;0
UrCapeGrl;2018-06-26 09:03;64;196;"It's ok to n9t get out of your cars. It's ok to not form a crowd. It's ok not to harass folks. It's ok not to push them back. It's ok not to listen to anyone of any party & or belief that incites violence & harassment! IT'S OK, #WalkAway #WalkAwayMovement #WalkAwayCampaign";;;#WalkAway #WalkAwayMovement #WalkAwayCampaign;"1011595769747591169";https://twitter.com/UrCapeGrl/status/1011595769747591169;0
IWillRedPillU;2018-06-26 08:49;604;786;"Nine Republicans Demand Deputy AG Rosenstein Give Up Names of Mueller Team #Mueller #MAGA #KAG #IGReport #FireThemAll #Trump2020 #Trump #WalkAway #LockThemAllUp #TuesdayThoughts #WeThePeople #TurnUpTuesday #FBI #DOJ #news #PatriotsFight #RedPill #REALNews https:// thegoldwater.com/news/29756-Nin e-Republicans-Demand-Deputy-AG-Rosenstein-Give-Up-Names-of-Mueller-Team …";;;#Mueller #MAGA #KAG #IGReport #FireThemAll #Trump2020 #Trump #WalkAway #LockThemAllUp #TuesdayThoughts #WeThePeople #TurnUpTuesday #FBI #DOJ #news #PatriotsFight #RedPill #REALNews;"1011592379697172480";https://twitter.com/IWillRedPillU/status/1011592379697172480;0
jakylera;2018-06-26 08:46;68;207;"It’s okay to not even become a Republican & still #walkaway from what the Democrat Party has become. More & more people are realizing conservatives are not what the Left says they are. The Left rules with fear & propaganda, not truth. It’s as if another party has formed.";;;#walkaway;"1011591491565834240";https://twitter.com/jakylera/status/1011591491565834240;0
RealBasedBlonde;2018-06-26 08:45;134;180;"The DemocRats Are the Party of #SaulAlinsky #RulesforRadicals . @RepMaxineWaters Sounds like she’s Advocating Separate Water Fountains! #WalkAway #WalkAwayMovement #WalkAwayCampaign pic.twitter.com/fyoIuOw9Xj";;@RepMaxineWaters;#SaulAlinsky #RulesforRadicals #WalkAway #WalkAwayMovement #WalkAwayCampaign;"1011591351748657153";https://twitter.com/RealBasedBlonde/status/1011591351748657153;0
GreatAwakening6;2018-06-26 06:54;1;6;"Denkt ihr so könnt ihr noch die Kurve kriegen ...? #FreeGermany von #DeepStateCabal #DasGrosseErwachen #walkaway von #EU pic.twitter.com/VNkXNIy1Xv";;;#FreeGermany #DeepStateCabal #DasGrosseErwachen #walkaway #EU;"1011563361144856576";https://twitter.com/GreatAwakening6/status/1011563361144856576;0
therealMetzgerM;2018-06-26 06:48;0;4;"So schauts aus #Antifa #linke #grüne ! Wenn man mal aufhört morgens mit dem "Ich hasse Deutschland" Wecker aufzustehen, merkt man, dass man nicht 24/7 hassen muss! Die Mitte ist cool, da findet man Freunde, die einem helfen! Kennt ihr nicht? Traurig traurig... #WalkAway schnell!!! https:// twitter.com/Dunkeldenk/sta tus/1011559586720083968 …";;;#Antifa #linke #gr #WalkAway;"1011561788377362432";https://twitter.com/therealMetzgerM/status/1011561788377362432;1
kimmylemke;2018-06-26 06:23;38;175;"Looks like this movements growing. #WalkAway";;;#WalkAway;"1011555446652657664";https://twitter.com/kimmylemke/status/1011555446652657664;0
_CDUB13_;2018-06-26 06:06;2551;7209;"The IG report coming out and the sudden fake outrage of an immigration policy set forth by previous administrations was the tipping point for me. #WalkAway";;;#WalkAway;"1011551274146385921";https://twitter.com/_CDUB13_/status/1011551274146385921;0
ebboyer;2018-06-26 05:44;81;186;"Wanna see something encouraging? Search hashtag #WalkAway on twitter. <3 I love humans.";;;#WalkAway;"1011545844338786304";https://twitter.com/ebboyer/status/1011545844338786304;0
