username;date;retweets;favorites;text;geo;mentions;hashtags;id;permalink;retweetornot
dab_doub_c;2018-06-17 18:25;1;10;"@usminority RT above tweet to get more followers seeing your video https:// youtu.be/4Pjs7uoOkag Follow @usminority #WalkAway Campaign";;@usminority @usminority;#WalkAway;"1008475765736816640";https://twitter.com/dab_doub_c/status/1008475765736816640;0
DeplorablAnnJoy;2018-06-17 17:59;16;19;"Liberal DemocRATs are all about taking away our Constitutional rights, breaking up the family unit & entitlements. It's all geared towards making the population DEPENDENT on the government. Because if you are DEPENDENT on them They can CONTROL YOU #WalkAway #RedWaveRising https:// twitter.com/usminority/sta tus/1007191747355729920 …";;;#WalkAway #RedWaveRising;"1008469231086678016";https://twitter.com/DeplorablAnnJoy/status/1008469231086678016;1
beth2_k3;2018-06-17 17:07;75;75;"THe progress of having a Democrat in charge. Very helpful in keeping you poor. If you want to change that, #Walkaway and Vote Republican in the future. https:// twitter.com/USATrump45/sta tus/989636229477085185 …";;;#Walkaway;"1008456075559960576";https://twitter.com/beth2_k3/status/1008456075559960576;1
LC_Drinnen;2018-06-17 16:28;3;5;"#WalkAway Others have opened their eyes and have seen the truth. Please watch, research and then decide. https:// m.youtube.com/watch?v=4Pjs7u oOkag&feature=youtu.be …";;;#WalkAway;"1008446403209777152";https://twitter.com/LC_Drinnen/status/1008446403209777152;0
actlightning;2018-06-17 16:16;4;3;"#DeathByDemocrats - creating sh*tholes is their singular accomplishment. Are YOU a Democrat? #WalkAway pic.twitter.com/iq3jT7pQT3";;;#DeathByDemocrats #WalkAway;"1008443244412203008";https://twitter.com/actlightning/status/1008443244412203008;0
beth2_k3;2018-06-17 15:13;20;26;"#NY It's time to #Walkaway and help America restore our Constitution. Get the vote out and vote RED RED RED. https:// twitter.com/Redhead4645/st atus/1008399157189644288 …";;;#NY #Walkaway;"1008427519429808132";https://twitter.com/beth2_k3/status/1008427519429808132;1
1stAirDel_USMCR;2018-06-17 14:55;3;4;"Dirty Cop @Comey is running for president? http:// bit.ly/Dirty_Corrupt_ Cop-2JJq7uS … #MAGA #MAGA2018 #TCOT #KAG #GOP #BlueWave2018 #WinBlue #UniteBlue #DrainTheSwamp #Resistance Democrat? #WalkAway ! pic.twitter.com/pshhUiAfl5";;@Comey;#MAGA #MAGA2018 #TCOT #KAG #GOP #BlueWave2018 #WinBlue #UniteBlue #DrainTheSwamp #Resistance #WalkAway;"1008422986762711040";https://twitter.com/1stAirDel_USMCR/status/1008422986762711040;0
ChrissyMAGAOne;2018-06-17 14:34;8;6;"#MAGA #QAnon #WeThePeople #JESUSLIVES #GodIsInCharge #WWG1WGA #RedWaveRising #FreeTommyRobinson #WalkAway #OffThePlantation **NEW Q POSTS w/ANON 6/17/18** 2/3 pic.twitter.com/IpbDumMPDT";;;#MAGA #QAnon #WeThePeople #JESUSLIVES #GodIsInCharge #WWG1WGA #RedWaveRising #FreeTommyRobinson #WalkAway #OffThePlantation;"1008417589544943616";https://twitter.com/ChrissyMAGAOne/status/1008417589544943616;0
NightSKY4409;2018-06-17 13:40;130;199;"Team . @BarackObama v. Team . @realDonaldTrump . @GregGutfeldShow . @greggutfeld #walkaway #KAG2020 #VoteRed There is no #BlueWave pic.twitter.com/56sDQhDz2t";;@BarackObama @realDonaldTrump @GregGutfeldShow @greggutfeld;#walkaway #KAG2020 #VoteRed #BlueWave;"1008404018991902720";https://twitter.com/NightSKY4409/status/1008404018991902720;0
IAmSuperTrump;2018-06-17 11:01;14;21;"You are SO right, Candace! The feckless Dems only NOW feign concern for children of ILLEGALS... ignoring all LEGAL Americans who are homeless or living in abject poverty. #ChildrenInCages #ChildrensConcentrationCamps #WalkAway pic.twitter.com/qdTEKjBaVj";;;#ChildrenInCages #ChildrensConcentrationCamps #WalkAway;"1008363913556254722";https://twitter.com/IAmSuperTrump/status/1008363913556254722;0
usminority;2018-06-17 10:57;57;167;"I think it may be time for us to go on a FoxNews tagging and emailing blitz. They don’t seem to have gotten the message yet!!! #WalkAway";;;#WalkAway;"1008363130815164418";https://twitter.com/usminority/status/1008363130815164418;0
deanbc1;2018-06-17 10:34;6;13;"They can strike but we will win by not having the propaganda instead of them. It is more aptly named the Washington Compost in 2018. It wasn't always this abusively biased. #KAG #WalkAway #VoteEveryDemOut #Trump2020Landslide pic.twitter.com/fWIxddaegZ";;;#KAG #WalkAway #VoteEveryDemOut #Trump2020Landslide;"1008357139079925766";https://twitter.com/deanbc1/status/1008357139079925766;0
Trishmiller777;2018-06-17 09:48;2;5;"Followed all. If I missed you follow me....I will follow all Patriots back #WalkAway #MAGA #1A . #2A . #KAG2020 #RedWave";;;#WalkAway #MAGA #1A #2A #KAG2020 #RedWave;"1008345710356516865";https://twitter.com/Trishmiller777/status/1008345710356516865;0
Trishmiller777;2018-06-17 07:21;1;5;"Followed all here too!! #WalkAway #MAGA";;;#WalkAway #MAGA;"1008308717572456448";https://twitter.com/Trishmiller777/status/1008308717572456448;0
TimWSternberg;2018-06-17 06:25;763;1611;"I am a newly awakened former lifelong Democrat now Independent for many of the same reasons as Brandon. #WalkAway https:// twitter.com/waynedupreesho w/status/1008076558798610432 …";;;#WalkAway;"1008294553596715008";https://twitter.com/TimWSternberg/status/1008294553596715008;1
FrauZora;2018-06-17 02:23;0;0;"Wow #WalkAway Der linke Opferkult .... Spiegelrassismus klar benannt Beeindruckende klare Worte Once upon a time I was a Liberal, ... https:// twitter.com/schneeridara/s tatus/1008133063640076288 …";;;#WalkAway;"1008233650721345537";https://twitter.com/FrauZora/status/1008233650721345537;1
adarn70;2018-06-17 01:15;7;13;"America is BACK Baby!! Remember that in Nov. All frustrated Dems welcome. #walkaway . Help us keep the Red Wave Rising!!";;;#walkaway;"1008216515152433152";https://twitter.com/adarn70/status/1008216515152433152;0
usminority;2018-06-17 00:08;191;346;"Every time I think they can’t go lower. THIS is why this movement must happen. In Scientology, the members are told lies about their non-member friends and families. They are encouraged to “disconnect”. Liberalism has become a cult. #WalkAway . https://www. salon.com/2018/06/14/cut -trump-supporters-off-the-horror-of-kids-taken-from-immigrant-parents-demands-personal-action/ …";;;#WalkAway;"1008199637361143809";https://twitter.com/usminority/status/1008199637361143809;0
FrankLo37366831;2018-06-16 22:51;9;12;"I love our President.. I wish I had millions to fight the lies of the left. #WalkAway";;;#WalkAway;"1008180178525118464";https://twitter.com/FrankLo37366831/status/1008180178525118464;0
deanbc1;2018-06-16 20:21;61;77;"2/2 Sounds too evil to be true. Sadly, this is actually their attitude. Rooting for America to fail for political gain. Democrats are now a worse enemy than ISIS to America Listen to the clip. #WalkAway #BattleGroudGroups #LiberalLogic #RedWave2018 https:// youtu.be/MvcmMlppEs4";;;#WalkAway #BattleGroudGroups #LiberalLogic #RedWave2018;"1008142583141425152";https://twitter.com/deanbc1/status/1008142583141425152;0
mozisme32843;2018-06-17 18:02;2;5;"#MAGA #LockThemAllUp #WalkAway #Trump #FireRosenstein #FireSessions #Corruption #RedWaveRising @TheJusticeDept @jeffsessions @drawandstrike @JamesDoss50 @RealJamesWoods @ThomasWictor please RT https:// twitter.com/PlaysTrumpCard /status/1007613925318373376 …";;@TheJusticeDept @jeffsessions @drawandstrike @JamesDoss50 @RealJamesWoods @ThomasWictor;#MAGA #LockThemAllUp #WalkAway #Trump #FireRosenstein #FireSessions #Corruption #RedWaveRising;"1008469980604583936";https://twitter.com/mozisme32843/status/1008469980604583936;1
katcooney;2018-06-17 17:30;2;2;"#WalkAway https:// twitter.com/kamvtv/status/ 1005155890058571776 …";;;#WalkAway;"1008461787098841088";https://twitter.com/katcooney/status/1008461787098841088;1
LC_Drinnen;2018-06-17 16:31;2;4;"#WalkAway Others have opened their eyes and have seen the truth. Please watch, research and then decide. https:// m.youtube.com/watch?v=4Pjs7u oOkag&feature=youtu.be …";;;#WalkAway;"1008447070691319809";https://twitter.com/LC_Drinnen/status/1008447070691319809;0
Rig_Wife;2018-06-17 15:20;6;13;"Peer pressure and fear of being chastised, removed from your social/family circles keeps people in lock step on the left. The Scientology analogy was spot on. That is why celebs and athletes stay so toxic....it is to keep their jobs. #WalkAway";;;#WalkAway;"1008429292236234757";https://twitter.com/Rig_Wife/status/1008429292236234757;0
countrydav;2018-06-17 15:12;0;2;"https:// twitter.com/usminority/sta tus/1007191747355729920?s=19 … help spread this young man's message on how he left the Democrat plantation. Powerful and moving video. #walkaway";;;#walkaway;"1008427279360413696";https://twitter.com/countrydav/status/1008427279360413696;1
countrydav;2018-06-17 15:08;0;4;"These grassroot messages take time to get going. I will start posting the #walkaway on my comments to help. If you're one of the first to comment on someone else's tweet, it really helps to spread the word. Also it helps if the person has a massive amount of followers. To see it.";;;#walkaway;"1008426291853430788";https://twitter.com/countrydav/status/1008426291853430788;0
alvalyn;2018-06-17 14:59;1;3;"A former client referred a prospective project to me. They’re looking for a technician, not a designer. It’s not a good fit for me. I didn’t accept. #creativebiz #wisdom #designer #freelancing #walkaway";;;#creativebiz #wisdom #designer #freelancing #walkaway;"1008423995971010560";https://twitter.com/alvalyn/status/1008423995971010560;0
108RSGUITARS;2018-06-17 14:36;35;109;"Right on... I also had to #walkaway after 50 years Liberal I’m now an Independant who will vote for the party whose policies I align with... and thankfully we have @realDonaldTrump at the helm creating the CHANGE we have been voting for (Obama) and never got it TILL NOW! #MAGA";;@realDonaldTrump;#walkaway #MAGA;"1008418234016546817";https://twitter.com/108RSGUITARS/status/1008418234016546817;0
ChrissyUSA1;2018-06-17 14:33;4;4;"#MAGA #QAnon #WeThePeople #JESUSLIVES #GodIsInCharge #WWG1WGA #RedWaveRising #FreeTommyRobinson #WalkAway #OffThePlantation **NEW Q POSTS w/ANON 6/17/18** 2/3 pic.twitter.com/C3JUhymj4t";;;#MAGA #QAnon #WeThePeople #JESUSLIVES #GodIsInCharge #WWG1WGA #RedWaveRising #FreeTommyRobinson #WalkAway #OffThePlantation;"1008417328311123968";https://twitter.com/ChrissyUSA1/status/1008417328311123968;0
BeeBeeBeeLeaves;2018-06-17 14:09;3;3;"Murderers always say ahead of the act that they will kill. Always. This one said he was out to fundamentally change America. They have all been very out in the open, those #evilhypocrites This #Bilderberg footage confirms a lot though. Wow. #WalkAway #FreeThinkers Walk. Away.";;;#evilhypocrites #Bilderberg #WalkAway #FreeThinkers;"1008411422684995584";https://twitter.com/BeeBeeBeeLeaves/status/1008411422684995584;0
LTGlobal_trap;2018-06-17 11:52;3;8;"Fell in love with what @ParkerHits did in a first sec. #repeat all the way! https:// youtu.be/pCc_fsXp-Q4 Glad to support such talent #newmusic #3lau #walkaway #parker #globaltrap #youtubemusic";;@ParkerHits;#repeat #newmusic #3lau #walkaway #parker #globaltrap #youtubemusic;"1008376958407888902";https://twitter.com/LTGlobal_trap/status/1008376958407888902;0
AndrewGoetz1;2018-06-17 11:48;1;3;"@foxandfriends @LouDobbs @seanhannity @brithume @kilmeade @IngrahamAngle @SteveDoocy Have you seen @usminority #WalkAway video? As a @foxandfriends fan since before Steve, Brian & E.D. days, please have this man on and get some exposure for the #WalkAway movement. It’s growing!";;@foxandfriends @LouDobbs @seanhannity @brithume @kilmeade @IngrahamAngle @SteveDoocy @usminority @foxandfriends;#WalkAway #WalkAway;"1008375961589514241";https://twitter.com/AndrewGoetz1/status/1008375961589514241;0
Trishmiller777;2018-06-17 08:49;1;3;"Following all #MAGA Patriots!! Have a Blessed Sunday/Fathers Day!! #WalkAway #KAG2020";;;#MAGA #WalkAway #KAG2020;"1008330675655790594";https://twitter.com/Trishmiller777/status/1008330675655790594;0
Shar_n_Shar;2018-06-17 00:35;0;2;"The left is escalating things by making things appear as they are. Desperation has reached immeasurable levels. My opinion of the parents has reached a new low, shame on ALL of those involved. #WalkAway";;;#WalkAway;"1008206510273548288";https://twitter.com/Shar_n_Shar/status/1008206510273548288;0
TopDUSMC;2018-06-17 00:32;68;181;"Best hashtag to save America #WalkAway";;;#WalkAway;"1008205719257190401";https://twitter.com/TopDUSMC/status/1008205719257190401;0
JoniePEI;2018-06-16 23:27;2;3;"Same here Massachusetts and I #WalkAway now living in the belly of the beast LA - out of the frying pan into the fire";;;#WalkAway;"1008189272975740928";https://twitter.com/JoniePEI/status/1008189272975740928;0
MiaCarla_NY;2018-06-16 21:11;0;4;"There are many more Protrump bronies. What is now being seen is the #WalkAway campaign is having more and more people come out as protrump bronies.";;;#WalkAway;"1008155164501520384";https://twitter.com/MiaCarla_NY/status/1008155164501520384;0
CupYours;2018-06-16 21:07;0;1;"Protective custody is not prison, just ask the millions of Americans across the country who are also in the system. #WalkAway";;;#WalkAway;"1008154216307752960";https://twitter.com/CupYours/status/1008154216307752960;0
nomadicpundit;2018-06-16 21:07;0;0;"People like me a liberal #Democrat of 20 years are walking away from this party because of relentless attacks and identity politics #WalkAway #MAGA https:// twitter.com/DRUDGE_REPORT/ status/1008093121027006464 …";;;#Democrat #WalkAway #MAGA;"1008154048422465537";https://twitter.com/nomadicpundit/status/1008154048422465537;1
Heeeellllooooo;2018-06-16 21:00;0;0;"Get informed... many are seeing through the smokescreens ( #fakenarratives and #fakenews ) and leaving in droves via movements: #DemExit #WalkAway";;;#fakenarratives #fakenews #DemExit #WalkAway;"1008152385519341568";https://twitter.com/Heeeellllooooo/status/1008152385519341568;0
Robinrealtor;2018-06-16 20:41;1;6;"#WalkAway";;;#WalkAway;"1008147622304067584";https://twitter.com/Robinrealtor/status/1008147622304067584;0
EMarieWrites;2018-06-16 20:40;0;0;"The moment when you feel like you're going to GO OFF... Head ache, and I don't get them... #WalkAway";;;#WalkAway;"1008147278442516480";https://twitter.com/EMarieWrites/status/1008147278442516480;0
sunnyherring1;2018-06-16 20:39;0;0;"Top 10 Reasons #IGReport Written By #DeepState #Horowitz (Appt By #Obama , Worked 4 #Comey ) https://www. thegatewaypundit.com/2018/06/here-i t-is-the-top-10-different-reasons-the-igs-report-on-the-clinton-email-matter-is-flawed-obamas-deep-state-runs-deep/ … #SocialMedia #tech #Internet #news #Students #GOP #Democrats #Independent #Millennials #women #family #business #Blacks #Hispanics #Latinos #Liberals #WalkAway";;;#IGReport #DeepState #Horowitz #Obama #Comey #SocialMedia #tech #Internet #news #Students #GOP #Democrats #Independent #Millennials #women #family #business #Blacks #Hispanics #Latinos #Liberals #WalkAway;"1008147191490334723";https://twitter.com/sunnyherring1/status/1008147191490334723;0
dduck025;2018-06-16 20:38;0;0;"https:// m.youtube.com/watch?v=4Pjs7u oOkag&feature=youtu.be … #walkaway";;;#walkaway;"1008146824266469376";https://twitter.com/dduck025/status/1008146824266469376;0
JulieAppletoft;2018-06-16 20:36;3;5;"Ignoring who? These people cease to exist tired me. We should all act like we don't hear or see them. Everyday they become more hysterical with bigger lies. #LiberalismIsAMentalDisorder #WalkAway #Trump2020 #MAGA https:// twitter.com/Trey_VonDinkis /status/1008126849975816192 …";;;#LiberalismIsAMentalDisorder #WalkAway #Trump2020 #MAGA;"1008146368219656192";https://twitter.com/JulieAppletoft/status/1008146368219656192;1
countrydav;2018-06-16 20:36;0;0;"@pattonoswalt more than 5,000 of the LA county's 58,000 homeless people are children and more than 4,000 are elderly.These people live in LA county and could use some help. #WalkAway from the Democrat plantation.";;@pattonoswalt;#WalkAway;"1008146310292176896";https://twitter.com/countrydav/status/1008146310292176896;0
ConservWarrior;2018-06-16 20:29;0;0;"Thank you Mr. President. We appreciate you and all you do. If you haven't heard of this, check it out #WalkAway https:// twitter.com/realDonaldTrum p/status/1007974129474121728 …";;;#WalkAway;"1008144595262337026";https://twitter.com/ConservWarrior/status/1008144595262337026;1
ConservWarrior;2018-06-16 20:27;0;0;"Come to the light.... vote Republican. #WalkAway https:// twitter.com/ForeverLogical /status/1008023273920069633 …";;;#WalkAway;"1008143987444715520";https://twitter.com/ConservWarrior/status/1008143987444715520;1
Cindi1Shorty;2018-06-16 20:13;2;2;"You got that right!! And it only takes a second to #WalkAway #VoteRed2018";;;#WalkAway #VoteRed2018;"1008140421871128576";https://twitter.com/Cindi1Shorty/status/1008140421871128576;0
DallasMadison;2018-06-16 20:07;0;0;"Here’s another great initiative. Ck it out. #WalkAway";;;#WalkAway;"1008138946461753350";https://twitter.com/DallasMadison/status/1008138946461753350;0