username;date;retweets;favorites;text;geo;mentions;hashtags;id;permalink;retweetornot
HalSparks;2018-07-03 00:33;36;44;"This is PRECISELY why the TROLLS are pushing this #WalkAway Horse Sh*t. This is why the NEED to depress the VOTE this Fall. This is What the #WalkAwayFromDemocrats movement is for. It's a contingency plan to Protect Trump and his Bankster buddies. https:// twitter.com/MrFilmkritik/s tatus/1013222576972288001 …";;;#WalkAway #WalkAwayFromDemocrats;"1014004203188977664";https://twitter.com/HalSparks/status/1014004203188977664;1
julie94526;2018-07-03 00:32;57;121;"I thought this couldn't possibly be true. Not only true, they have adult sizes. #WalkAway #boycottwalmart";;;#WalkAway #boycottwalmart;"1014003931033292800";https://twitter.com/julie94526/status/1014003931033292800;0
ladeebloo;2018-07-03 00:31;28;94;"Brandon, I tune in every day to see what’s new with #WalkAway . Renews my faith in Americans to see the optimism, and respect we still have for one another even if we may disagree on certain issues.";;;#WalkAway;"1014003710660210688";https://twitter.com/ladeebloo/status/1014003710660210688;0
CrayzieGirl65;2018-07-03 00:31;119;406;"I wanna take this time to welcome all the new Patriots from the #WalkAway movement! We all welcome u with open arms!!";;;#WalkAway;"1014003677588160514";https://twitter.com/CrayzieGirl65/status/1014003677588160514;0
AltUSPressSec;2018-07-03 00:31;306;335;"#Walkaway is a foreign disinformation campaign. If you’re spreading it, you’re unwittingly doing Putin’s bidding. pic.twitter.com/oF7rGOy4Jo";;;#Walkaway;"1014003571455614976";https://twitter.com/AltUSPressSec/status/1014003571455614976;0
Vdub_Lady;2018-07-03 00:29;18;84;"There are no coincidences... They NEVER thought she would LOSE. #WalkAway #WWG1WGA";;;#WalkAway #WWG1WGA;"1014003064322260992";https://twitter.com/Vdub_Lady/status/1014003064322260992;0
melissa5215;2018-07-03 00:24;154;233;"I encourage all Democrats and Liberals to just listen to #BrandonStraka #Walkaway movement. Folks who have been Dems for years, it’s not the same party. Please listen if you’re on the fence or not. You’re being lied to by the MSM. #TruthMatters #Maga";;;#BrandonStraka #Walkaway #TruthMatters #Maga;"1014001918832619520";https://twitter.com/melissa5215/status/1014001918832619520;0
SharonBelhamel;2018-07-03 00:18;16;73;"Love it! I walked away from the Democratic Party as well, so I support the #walkaway movement.";;;#walkaway;"1014000500449128448";https://twitter.com/SharonBelhamel/status/1014000500449128448;0
tpatter4;2018-07-03 00:13;27;85;"Thanks #BrandonStraka for the #walkaway movement. It is a movement that has a positive tone. Here is to it’s success in bringing us together. https:// twitter.com/tpatter4/statu s/1012785337150603264 …";;;#BrandonStraka #walkaway;"1013999064260730880";https://twitter.com/tpatter4/status/1013999064260730880;1
media_nc;2018-07-03 00:13;40;50;"ASK PRESIDENT TRUMP ABOUT Q @acosta I DARE YOU! #QAnon #WWG1WGA #WalkAway @POTUS pic.twitter.com/mlUpMpIb44";;@acosta @POTUS;#QAnon #WWG1WGA #WalkAway;"1013999062708903936";https://twitter.com/media_nc/status/1013999062708903936;0
NoRestrictions;2018-07-03 00:07;26;69;"When you speak truth... others will follow. Good for you Brandon Tatum. https:// youtu.be/ZbP33yl_kT4 #WalkAway #WalkAwayCampaign pic.twitter.com/2VeM8fw2PF";;;#WalkAway #WalkAwayCampaign;"1013997523839606784";https://twitter.com/NoRestrictions/status/1013997523839606784;0
STEVEN_JOSEPH_;2018-07-03 00:03;228;579;"My #WalkAway moment came only after I realized that, if they'll lie about something as fundamental and obvious as the profound natural differences between men & women, they will lie about anything. The left's only principal is power.";;;#WalkAway;"1013996583661129728";https://twitter.com/STEVEN_JOSEPH_/status/1013996583661129728;0
BlueWaterDays;2018-07-03 00:00;59;92;"Twitter will not allow #walkaway to trend.";;;#walkaway;"1013995992595779585";https://twitter.com/BlueWaterDays/status/1013995992595779585;0
Jeffmyers0011;2018-07-03 00:00;74;114;"Liberals #walkaway from the Democrat Plantation! I did 2 years ago! #MAGA #WWG1WGA pic.twitter.com/9wluvT0dOx";;;#walkaway #MAGA #WWG1WGA;"1013995892385484800";https://twitter.com/Jeffmyers0011/status/1013995892385484800;0
ea_803;2018-07-02 23:57;34;60;"Thank God for you, President Trump and ICE, for working to keep us safe everyday. The Democratic Party has gone mad and, yes, many are walking away to come aboard the #TrumpTrain #WalkAway #RedWaveRising2018 https:// twitter.com/realdonaldtrum p/status/1013976609290964997 …";;;#TrumpTrain #WalkAway #RedWaveRising2018;"1013995238891970561";https://twitter.com/ea_803/status/1013995238891970561;1
ummmno21;2018-07-02 23:56;15;64;"The only thing I would change about the #WalkAway movement would say #RunAway or #SpeedWalkAway";;;#WalkAway #RunAway #SpeedWalkAway;"1013994823739740160";https://twitter.com/ummmno21/status/1013994823739740160;0
lizzie_go;2018-07-02 23:56;41;108;"I chose to #WalkAway from the Democratic party in 2017. I voted for Obama twice. Now I realize I was duped. I'm now 110% supportive of our President @realDonaldTrump";;@realDonaldTrump;#WalkAway;"1013994742378622976";https://twitter.com/lizzie_go/status/1013994742378622976;0
fetosomagy;2018-07-02 23:55;78;472;"Gen Z doesn't have to #WalkAway because we were never brainwashed to begin with";;;#WalkAway;"1013994732979146755";https://twitter.com/fetosomagy/status/1013994732979146755;0
MyronSolis65;2018-07-02 23:52;399;1256;"Proud Latino who #WalkAway from the dems back in 2016. No one will use my ethnicity to control my vote ever again";;;#WalkAway;"1013993972832890886";https://twitter.com/MyronSolis65/status/1013993972832890886;0
PaulLee85;2018-07-02 23:51;64;110;"A lot of Asians are attracted to Liberal Big City garbage and get pressured into joining the Democrat mob Mentality. Asians need to #walkaway the Dems do not care for you and need to stop listening to Fake News. Asians are Convenient Minorities to abuse by Dems.";;;#walkaway;"1013993665251794945";https://twitter.com/PaulLee85/status/1013993665251794945;0
RepublicChic76;2018-07-02 23:50;6;93;"Welcome Jon!!! We welcome you with open arms and I am so glad you decided to #walkaway God is amazing!! God bless you pic.twitter.com/3sT2Qn5Bur";;;#walkaway;"1013993444275113984";https://twitter.com/RepublicChic76/status/1013993444275113984;0
DGA220;2018-07-02 23:50;471;1409;"Let me get onboard with this #WalkAway thing. I've been called all the insults you can think of, by my own people, because I had the nerve to think differently. I walked away a long time ago.";;;#WalkAway;"1013993435748032512";https://twitter.com/DGA220/status/1013993435748032512;0
rulybetylyj;2018-07-02 23:48;173;411;"The good news I'm young and never had to #WalkAway generation Z is woke from the JUMP. My generation is the most conservative generation in over 50 years. We will #MAGA and better America (I'm 18 and never voting dem in my life)";;;#WalkAway #MAGA;"1013992755499094018";https://twitter.com/rulybetylyj/status/1013992755499094018;0
dustingold;2018-07-02 23:45;53;33;"True #Liberals , #WalkAway from #Democrats . Help us #MAGA . #Obama supporter #NathanialBlaineLuffman arrested. Told #RandPaul , I’ll “gut you like a hog - leave your kids bowels splayed out across floor blood spattered on the door as you lay dead.” #Qanon https://www. thegatewaypundit.com/2018/07/exclus ive-berkeley-dem-nathanial-luffman-arrested-for-threatening-rand-paul-said-he-would-leave-his-childrens-bowels-splayed-out-across-floor/ … pic.twitter.com/oshmTFjjoF";;;#Liberals #WalkAway #Democrats #MAGA #Obama #NathanialBlaineLuffman #RandPaul #Qanon;"1013992129683689477";https://twitter.com/dustingold/status/1013992129683689477;0
LidiaMonroe;2018-07-02 23:38;55;136;"If you're tired of Democrats spending all their energy fighting for the rights of illegal immigrants while completely ignoring the Americans they are sworn to serve: #WalkAway #WalkAwayMovement";;;#WalkAway #WalkAwayMovement;"1013990266473025539";https://twitter.com/LidiaMonroe/status/1013990266473025539;0
IamThe3Percent;2018-07-02 23:34;91;145;"Democrats searching for Answers! #MAGA #WalkAway #DrainTheSwamp #DrainTheDeepStateSwamp pic.twitter.com/PLa87RuzOJ";;;#MAGA #WalkAway #DrainTheSwamp #DrainTheDeepStateSwamp;"1013989392854241281";https://twitter.com/IamThe3Percent/status/1013989392854241281;0
vietkieu;2018-07-02 23:20;113;401;"I was a liberal from 2005-2016. #WalkAway #qanon";;;#WalkAway #qanon;"1013985776000892929";https://twitter.com/vietkieu/status/1013985776000892929;0
RedPillBlackMan;2018-07-02 23:18;52;108;"Few years back black Hollywood elites protested none inclusion into grammies yet they continue to serve the same liberal racist franchise. When the hell will you #walkaway ?";;;#walkaway;"1013985335791906816";https://twitter.com/RedPillBlackMan/status/1013985335791906816;0
Don_Vito_08;2018-07-02 23:15;55;75;"There are 3.6 million black kids living in poverty in America Why do @TheDemocrats choose to put illegal aliens first? #WalkAway pic.twitter.com/REaR4mFE5E";;@TheDemocrats;#WalkAway;"1013984489272299520";https://twitter.com/Don_Vito_08/status/1013984489272299520;0
eugenegu;2018-07-02 23:12;91;564;"Alan Dershowitz was a Democrat. But because all his friends at Martha Vineyard shunned him at their cocktail parties, he will now #WalkAway .";;;#WalkAway;"1013983812441653248";https://twitter.com/eugenegu/status/1013983812441653248;0
TechQn;2018-07-02 23:12;15;23;"This is why people need to #WalkAway You dont bash an agency that is SAVING people from human traffickers. https:// twitter.com/Cam_El_Tow/sta tus/1013800031856586752 …";;;#WalkAway;"1013983808754860032";https://twitter.com/TechQn/status/1013983808754860032;1
Chairmnoomowmow;2018-07-02 23:11;60;67;"#DearDiary Today I watched the left try to get a little meme going about how crazy and dangerous Trump nation is. Then Rand Paul announced that some leftist was arrested for threatening to chop up his family. #WalkAway #Unhinged #FoxNews #NewYorkTimes #TrumpHateJunkies pic.twitter.com/gQ6fn5jc3m";;;#DearDiary #WalkAway #Unhinged #FoxNews #NewYorkTimes #TrumpHateJunkies;"1013983557373472768";https://twitter.com/Chairmnoomowmow/status/1013983557373472768;0
RejeanHebert1;2018-07-02 23:08;123;172;"Now let this one sink-in a bit WOW - awesome @REALDONALDTRUMP @POTUS #QAnon #ReleaseTheIGReport #WeThePeople #WalkAway #IGReport #Qanuck #TheGreatAwakening #TheStorm #MAGA #WWG1WGA (Where We Go One..We Go All) pic.twitter.com/r3USRLr9pn";;@REALDONALDTRUMP @POTUS;#QAnon #ReleaseTheIGReport #WeThePeople #WalkAway #IGReport #Qanuck #TheGreatAwakening #TheStorm #MAGA #WWG1WGA;"1013982889589997568";https://twitter.com/RejeanHebert1/status/1013982889589997568;0
4AllSoulKind;2018-07-02 23:07;35;42;"This is why we #WalkAway . Mocking a sitting US Senator who has been: -shot at by the left -had his ribs broken by the left -just had himself & his entire family threatened with dismemberment by the left. cc @RandPaul @realDonaldTrump #MAGA #WWG1WGA #QAnon https:// twitter.com/owillis/status /1013976067567124480 …";;@RandPaul @realDonaldTrump;#WalkAway #MAGA #WWG1WGA #QAnon;"1013982536840699906";https://twitter.com/4AllSoulKind/status/1013982536840699906;1
LisaMei62;2018-07-02 23:07;344;786;"#WalkAway https:// twitter.com/realDonaldTrum p/status/1013976609290964997 …";;;#WalkAway;"1013982413024833536";https://twitter.com/LisaMei62/status/1013982413024833536;1
OtherMarySpeaks;2018-07-02 23:06;16;41;"I've crossed out race/ethnicity and always written in "American" my entire adult life. My son's birth certificate even says that. They honored it. I'm 13th generation. This is now my motherland. I encourage everyone to do the same on gov. docs. #WalkAway";;;#WalkAway;"1013982207914831872";https://twitter.com/OtherMarySpeaks/status/1013982207914831872;0
MAGAMark18;2018-07-02 23:03;625;915;"Since I became #Conservative I have found it uneasy to talk about my views. In fact, my one old friend slapped me because I tweeted #DefundPP . This is not the #America I grew up in. #Dems have become violent against anyone with opposing views. #GreatAwakening #WalkAway #VoteRed pic.twitter.com/7HICF30P0g";;;#Conservative #DefundPP #America #Dems #GreatAwakening #WalkAway #VoteRed;"1013981441292726278";https://twitter.com/MAGAMark18/status/1013981441292726278;0
Conservative_VW;2018-07-02 23:02;25;67;"Being Democrat .... Just #WalkAway pic.twitter.com/IPGtWydamA";;;#WalkAway;"1013981379107827714";https://twitter.com/Conservative_VW/status/1013981379107827714;0
blunowich;2018-07-02 23:00;29;74;"Dear Millennials, As Dems heading to radical left, my advice as a FORMER millennial DEMOCRAT myself: just #WalkAway there is other options.";;;#WalkAway;"1013980771143434240";https://twitter.com/blunowich/status/1013980771143434240;0
rlr41771;2018-07-02 22:59;12;26;"The #WalkAway Movement Is Huge! The Real Walk Away Story Being Underrepo... https:// youtu.be/M_CEtAcJosg via @YouTube";;@YouTube;#WalkAway;"1013980627195056128";https://twitter.com/rlr41771/status/1013980627195056128;0
lindarutter;2018-07-02 22:59;15;31;"I'm late to the #WalkAway but here's my experience. My first Presidential vote. I then gave President Clinton his first term vote, not the second. I guess that's when I really walked. #WalkAwayFromDemocrats pic.twitter.com/GBrspk2hmI";;;#WalkAway #WalkAwayFromDemocrats;"1013980520215207936";https://twitter.com/lindarutter/status/1013980520215207936;0
casi_sue;2018-07-02 22:59;302;375;"Disgusting to watch @TheDemocrats @DNC @KamalaHarris DEFEND human sex traffickers & exploited children!! Thank GOD @ICEgov , border agents and our @POTUS are trying to put an END to it!! @realDonaldTrump LOVES us & wants to END the lawlessness at our borders! #WalkAway pic.twitter.com/q5CEooYLRz";;@TheDemocrats @DNC @KamalaHarris @ICEgov @POTUS @realDonaldTrump;#WalkAway;"1013980413776355329";https://twitter.com/casi_sue/status/1013980413776355329;0
seoma520_tara;2018-07-02 22:57;54;78;"People are perfectly fine putting babies in cages and sending them to court alone to sort out immigration but are unwilling to give up assault rifles to save our own children. #basra #ReuniteFamiliesNow #TrumpConcentrationCamps #walkaway Retweet please";;;#basra #ReuniteFamiliesNow #TrumpConcentrationCamps #walkaway;"1013979939299680256";https://twitter.com/seoma520_tara/status/1013979939299680256;0
chrisseanhayes;2018-07-02 22:56;14;19;"Doesn’t getting violently angry get tiring while the rest of the nation is winning? Just smile and #WalkAway There’s an entire nation welcoming you with open arms of love https:// twitter.com/realtt2020/sta tus/997342659478982656?s=21 …";;;#WalkAway;"1013979717236428800";https://twitter.com/chrisseanhayes/status/1013979717236428800;1
Digidiva2018;2018-07-02 22:53;12;22;"The Democratic Party is DYING As Mass Exodus Movement, #WalkAway , Gains SERIOUS MOMENTUM. #WWG1WGA https:// twitter.com/usminority/sta tus/1013211890611257349 …";;;#WalkAway #WWG1WGA;"1013978974580424704";https://twitter.com/Digidiva2018/status/1013978974580424704;1
peaceandjoy101;2018-07-02 22:52;22;76;"Just did. #WalkAway";;;#WalkAway;"1013978873027948545";https://twitter.com/peaceandjoy101/status/1013978873027948545;0
SCarpeto;2018-07-02 22:48;112;364;"When your political party says you need a government that sets policy based on listening to children. It’s time to #WalkAway";;;#WalkAway;"1013977726905176064";https://twitter.com/SCarpeto/status/1013977726905176064;0
Carrie_Kelly17;2018-07-02 22:46;28;27;"Liberals will literally defend a Klansman to the death.. because he was a democrat. #Sick #LiberalismIsAMentalDisorder #WalkAway https:// twitter.com/bluedem1/statu s/1013975896859037696 …";;;#Sick #LiberalismIsAMentalDisorder #WalkAway;"1013977280589303809";https://twitter.com/Carrie_Kelly17/status/1013977280589303809;1
Zimrico;2018-07-02 22:46;147;228;"#WalkAway I walked away from generations of family Democrats when I came home from Nam & saw what the Democrats did to my brothers in arms. My Dad, a WWll & Korean war vet, walked away as well. Glad to see you kids catch up. God Bless & Keep You & Yours.";;;#WalkAway;"1013977194081599490";https://twitter.com/Zimrico/status/1013977194081599490;0
wmmII88;2018-07-02 22:45;64;270;"#WalkAway .... Walk away FAST! pic.twitter.com/2eEo6rZbYV";;;#WalkAway;"1013976994546102272";https://twitter.com/wmmII88/status/1013976994546102272;0
HollawayIsHere;2018-07-02 22:42;34;111;"These dang #WalkAway Russian bots are taking over FB too! They have a group with over 37k people and counting in it. Y'all keep thinkin it's not real and those who are making the switch, welcome! pic.twitter.com/9hYeXKpWwr";;;#WalkAway;"1013976356118499328";https://twitter.com/HollawayIsHere/status/1013976356118499328;0
sweetweetertot2;2018-07-02 22:39;42;91;"U need to educate yourself miss. The Democratic Party has ravaged the black community starting with Democrat LBJ’s Great Society that was designed to make black people dependent & remove the fathers from black homes. That is the root of all black problems in America #WalkAway pic.twitter.com/SVcxTYncje";;;#WalkAway;"1013975592717422592";https://twitter.com/sweetweetertot2/status/1013975592717422592;0
TryingtoHalt;2018-07-02 22:37;119;438;"The Left no longer represents classical liberalism (if ever it did in the first place). When you #WalkAway , you aren't giving up being a liberal, you're punishing the Left for giving up on you.";;;#WalkAway;"1013975027660750849";https://twitter.com/TryingtoHalt/status/1013975027660750849;0
khalifallah;2018-07-02 22:37;35;54;"I'm an #ExDemocratBecause I no longer drink the Kool aid from the mainstream media! #CCOT #Walkaway pic.twitter.com/5wmiUGe1dp";;;#ExDemocratBecause #CCOT #Walkaway;"1013974947268579329";https://twitter.com/khalifallah/status/1013974947268579329;0
ExDemLatina;2018-07-02 22:36;30;67;"Another amazing video from #WalkAway movement! @robsmithonline https:// twitter.com/robsmithonline /status/1013767419909820417 …";;@robsmithonline;#WalkAway;"1013974696465846272";https://twitter.com/ExDemLatina/status/1013974696465846272;1
khalifallah;2018-07-02 22:35;22;49;"I'm an #ExDemocratBecause I refuse to play the race card for my own selfish ambitions! #CCOT #Walkaway pic.twitter.com/dD0ydG5H2U";;;#ExDemocratBecause #CCOT #Walkaway;"1013974413446995968";https://twitter.com/khalifallah/status/1013974413446995968;0
Blowmeapple;2018-07-02 22:33;12;149;"#WalkAway pic.twitter.com/JBNtyhO8zM";;;#WalkAway;"1013973960822624256";https://twitter.com/Blowmeapple/status/1013973960822624256;0
mutts4me_sherri;2018-07-02 22:28;55;47;"RayRay is amazing and his poem for #WalkAway is too! @POTUS @realDonaldTrump #MAGA #KAG #WWG1WGA https:// twitter.com/RayPoetry/stat us/1013849533141409792 …";;@POTUS @realDonaldTrump;#WalkAway #MAGA #KAG #WWG1WGA;"1013972673758560256";https://twitter.com/mutts4me_sherri/status/1013972673758560256;1
DutyOfAPatriot;2018-07-02 22:27;519;998;"Sorry To Burst Your Socialist Bubble But ICE Ain’t Going Nowhere!!! ICE, ICE BABY #Unhinged2018 #WalkAway https:// twitter.com/solmemes1/stat us/1013960317053923333 …";;;#Unhinged2018 #WalkAway;"1013972510272917504";https://twitter.com/DutyOfAPatriot/status/1013972510272917504;0
elguapo64;2018-07-02 22:27;624;707;"Carrot Top uh sorry I mean #MichelleWolf Tells People to Harass Ivanka, Compares Her to 'Herpes' and 'Vaginal Mesh' #LiberalismIsAMentalDisorder #ELG #WalkAwayFromDemocrats #WalkAway https:// ijr.com/2018/07/110707 9-michelle-wolf-harass-ivanka-life/?utm_source=twitter&utm_medium=social …";;;#MichelleWolf #LiberalismIsAMentalDisorder #ELG #WalkAwayFromDemocrats #WalkAway;"1013972407374135296";https://twitter.com/elguapo64/status/1013972407374135296;0
BuzzPatterson;2018-07-02 22:27;34;71;"You wreak of fear, Chuck. She’s not even the nominee, yet, but if she is you know that attacking a strong woman going into the midterms is a non-starter. Check. Mate. To other Dems interested in your future and this nation, quit listening to bozos like Chuck. Just #WalkAway https:// twitter.com/senschumer/sta tus/1013807869630836736 …";;;#WalkAway;"1013972389208547329";https://twitter.com/BuzzPatterson/status/1013972389208547329;1
gladdy_c;2018-07-02 22:25;158;343;"#WalkAway Intense intolerance. Double standards. Illegals over citizens. Incivlity. Black victimhood. Lack of morals. Dishonesty. Exaggeration. Inflammatory language. Just some of the reasons normal people are walking away.";;;#WalkAway;"1013972032437080064";https://twitter.com/gladdy_c/status/1013972032437080064;0
GW1stPOTUS;2018-07-02 22:25;51;119;"34 years ago I was a Democrat I decided to #WalkAway Being Pro-life, I wasn't welcome in the Democratic party I earned an MBA & could no longer support policies that over regulated & taxed our economy I couldn't defend welfare for life as it ruined families I wanted liberty MAGA pic.twitter.com/0JDZaNsF2U";;;#WalkAway;"1013971964682227713";https://twitter.com/GW1stPOTUS/status/1013971964682227713;0
AryaSjoberg;2018-07-02 22:21;68;180;"I am a 17 yrs old woman. I was a liberal. the mentality of a liberal is the one of a pathetic, overly sensitive loser. The youth is realizing the truth that the left has been trying to hide from us. all ppl that have a VICTOR mentality are turning RIGHT. #WalkAway #redpill #MAGA";;;#WalkAway #redpill #MAGA;"1013971074206269442";https://twitter.com/AryaSjoberg/status/1013971074206269442;0
scarlett_0hara;2018-07-02 22:20;21;71;"#LyingLiberals More and more are seeing your villainous propaganda for what it is and is why so many now #WalkAway from the #Democrats So stop the lies, babies are not being systematically ripped from their mother's arms at the borders. Case in point: https://www. nytimes.com/2018/06/22/us/ immigration-toddler-trump-media.html …";;;#LyingLiberals #WalkAway #Democrats;"1013970660413108224";https://twitter.com/scarlett_0hara/status/1013970660413108224;0
CatheeMcKennnna;2018-07-02 22:19;39;242;"I’ll most definitely #walkaway after the 2019 federal election.";;;#walkaway;"1013970507442544640";https://twitter.com/CatheeMcKennnna/status/1013970507442544640;0
casi_sue;2018-07-02 22:18;207;286;"@TheDemocrats do not care about American citizens. They only care about illegals because the @DNC members like @SenKamalaHarris @KamalaHarris get a CUT OF ALL THE DRUG AND CARTEL MONEY!!! Wake up!!! #WalkAway";;@TheDemocrats @DNC @SenKamalaHarris @KamalaHarris;#WalkAway;"1013970193595404288";https://twitter.com/casi_sue/status/1013970193595404288;0
RealBamaCowboy;2018-07-02 22:09;110;205;"It’s official! The left has lost their minds! Who would want to abolish ICE in the middle of summer? It’s 100 degrees out! No ICEd tea? No ICE cream? No ICE cold beer? No Immigration and Customs Enforcement? What’s next, abolish apple pie? #LiberalismIsAMentalDisease #WalkAway";;;#LiberalismIsAMentalDisease #WalkAway;"1013967824182759425";https://twitter.com/RealBamaCowboy/status/1013967824182759425;0
AlissaMartin200;2018-07-02 22:08;65;99;"There has never been a better time to #WalkAway from the Democrat party as they embrace Marxist socialism, while blatantly putting the welfare of illegal immigrants above law-abiding American citizens #WalkAwayMovement #WalkAwayCampaign #AbolishIce #IllegalsAboveCitizens #RedWave";;;#WalkAway #WalkAwayMovement #WalkAwayCampaign #AbolishIce #IllegalsAboveCitizens #RedWave;"1013967594024554496";https://twitter.com/AlissaMartin200/status/1013967594024554496;0
KyManInTheWoods;2018-07-02 22:07;28;39;"Now days they are, they hate America. They hate American citizens. Time to #WalkAway https:// youtu.be/4Pjs7uoOkag";;;#WalkAway;"1013967504891351051";https://twitter.com/KyManInTheWoods/status/1013967504891351051;0
michaelyagoda;2018-07-02 22:04;82;122;"WATCH: #WalkAway Movement to Abandon Liberalism Goes Viral https://www. breitbart.com/big-government /2018/07/01/watch-walkaway-movement-to-abandon-liberalism-goes-viral/ … via @BreitbartNews";;@BreitbartNews;#WalkAway;"1013966702160285701";https://twitter.com/michaelyagoda/status/1013966702160285701;0
elisgaga65;2018-07-02 22:04;25;47;"I say Welcome! To the #walkaway movement! With open arms and hearts! much respect for your courage! Where we go one, we go all! Fighting for the dignity, freedom, peace and patriotism that we, as all American's strive for!";;;#walkaway;"1013966608145047553";https://twitter.com/elisgaga65/status/1013966608145047553;0
SQLSupahStah;2018-07-02 21:59;32;114;"Bravo!!! Well done!! I #WalkAway a while back and am glad I did. The #WalkAwayCampaign has been like a breath of fresh air to my soul.";;;#WalkAway #WalkAwayCampaign;"1013965389687123968";https://twitter.com/SQLSupahStah/status/1013965389687123968;0
realJimRobinson;2018-07-02 21:54;41;56;"#WalkAway #MAGA #TrumpTrain #Trump2020 #Spygate #VoteRed #DrainTheSwamp #BuildTheWall #LockHerUp #ImpeachRosenstein #QAnon #1A #2A #NRA pic.twitter.com/cGH89YgEgW";;;#WalkAway #MAGA #TrumpTrain #Trump2020 #Spygate #VoteRed #DrainTheSwamp #BuildTheWall #LockHerUp #ImpeachRosenstein #QAnon #1A #2A #NRA;"1013964226639958016";https://twitter.com/realJimRobinson/status/1013964226639958016;0
ColumbiaBugle;2018-07-02 21:51;2713;4736;"#WalkAway Campaign Founder Brandon Straka ( @usminority ) spoke with @tuckercarlson tonight about his Exodus from the Left. Fascinating story. pic.twitter.com/PBLpM6eCiy";;@usminority @tuckercarlson;#WalkAway;"1013963382037229568";https://twitter.com/ColumbiaBugle/status/1013963382037229568;0
usmc_army;2018-07-02 21:51;44;80;"I dont know about this, patriots. They should let her rant. Every time she opens her mouth, the conservatives get another point and the Democratic Party looses another one to #WalkAway";;;#WalkAway;"1013963306443395072";https://twitter.com/usmc_army/status/1013963306443395072;0
