username;date;retweets;favorites;text;geo;mentions;hashtags;id;permalink;retweetornot
usminority;2018-07-03 19:57;1986;3229;"You asked for it!!! And here it is!!! The OFFICIAL #WalkAway store is here! More items 2come, but I am so excited 2get my own #WalkAway shirts &most importantly.... COFFEE MUG!! Get yours! And please Retweet! THE FIRST 250 get 10% off with code: PATRIOT https:// teespring.com/stores/officia l-walkaway-store …";;;#WalkAway #WalkAway;"1014297179006095360";https://twitter.com/usminority/status/1014297179006095360;0
Rockinon2;2018-07-03 19:57;80;240;"Do a search on youtube for #walkaway , There are some great videos from real people. The fake news can't complain that they are bots. Of course youtube will probably find some way to censor them like they are on twitter.";;;#walkaway;"1014297128573825026";https://twitter.com/Rockinon2/status/1014297128573825026;0
annvandersteel;2018-07-03 19:55;868;1807;"The mere FACT that Brandon Straka's #WalkAway video has over 5 million ORGANIC views should have the #Democrats very scared. This is YOUR BASE and they are DONE with your threats, vile language and bad policies. Put #AmericaFirst and support the #WalkAwayMovement @usminority";;@usminority;#WalkAway #Democrats #AmericaFirst #WalkAwayMovement;"1014296607016341504";https://twitter.com/annvandersteel/status/1014296607016341504;0
realPatriotDrew;2018-07-03 19:44;286;506;"#4thOfJuly ATTENTION To Every Democrat Congressmen, Councilman, Leader And Voter: If You Haven’t #WalkAway From Your Polical Party Which is Calling For... NO BORDERS NO NATIONS DON’T EVEN PRETEND TO CELEBRATE #4thofJuly2018 pic.twitter.com/TBbfOV255D";;;#4thOfJuly #WalkAway #4thofJuly2018;"1014293895834951680";https://twitter.com/realPatriotDrew/status/1014293895834951680;0
conspirator0;2018-07-03 19:44;325;547;"This chart shows the most frequently used hashtags in a random sample of 2277 #WalkAway accounts both before and after January 2018 (109K tweets from each time period were used.) Long story short, it doesn't look like these accounts were ever liberal. pic.twitter.com/h9puoTV5Cx";;;#WalkAway;"1014293818772840448";https://twitter.com/conspirator0/status/1014293818772840448;0
conspirator0;2018-07-03 19:44;60;166;"Are the #WalkAway tweets truly from Democrats who recently abandoned the party? To test this, let's compare the hashtags used in recent tweets from the #WalkAway accounts with their tweets from years past.";;;#WalkAway #WalkAway;"1014293758605606912";https://twitter.com/conspirator0/status/1014293758605606912;0
conspirator0;2018-07-03 19:43;63;182;"The 200K #WalkAway tweets in this sample came from 58475 accounts. Of these, 4440 (7.6%) use the default profile pic (somewhere in the neighborhood of 3% is average for datasets we examine). This doesn't mean all these accounts are bots, but does suggest bot activity.";;;#WalkAway;"1014293709557338113";https://twitter.com/conspirator0/status/1014293709557338113;0
thc1776;2018-07-03 19:41;199;386;"If you are new to #WalkAway let me fill you in on what you're going to deal with next. @realDonaldTrump @TomiLahren @DiamondandSilk @kimguilfoyle @charliekirk11 @RealCandaceO big shout out to @Henryhahadavis you are the one that inspired me to speak up for the Hispanic community pic.twitter.com/zbBCwDI2YM";;@realDonaldTrump @TomiLahren @DiamondandSilk @kimguilfoyle @charliekirk11 @RealCandaceO @Henryhahadavis;#WalkAway;"1014293103350411265";https://twitter.com/thc1776/status/1014293103350411265;0
RedNationRising;2018-07-03 19:40;243;303;"Brandon Straka spent years as a liberal, but now he says he's fed up with what the Left has become. He explains why he recently released a viral video encouraging other progressives to #WalkAway The Unsilent Minority @usminority pic.twitter.com/PsSCadHrK2";;@usminority;#WalkAway;"1014292954381504513";https://twitter.com/RedNationRising/status/1014292954381504513;0
imrayswife52;2018-07-03 19:40;116;169;"#LiberalismIsAMentalDisease #WalkAway #MAGA #RedWaveRising2018 #TuesdayThoughts #TRUMP #BoycottWalmart RedsMemes pic.twitter.com/khVEZM4eaD";;;#LiberalismIsAMentalDisease #WalkAway #MAGA #RedWaveRising2018 #TuesdayThoughts #TRUMP #BoycottWalmart;"1014292741080141824";https://twitter.com/imrayswife52/status/1014292741080141824;0
FarSight3;2018-07-03 19:39;1;0;"In den #USA ist den Mitberichtern durch den Hashtag #WalkAway erst so richtig bewußt geworden, was #Twitter da abzieht. In #Europa ist es in erster Linie der #QFD #Shadowban , welcher die offensichtliche Bevorzugung der #Internazis bloßstellt: http://www. trevorloudon.com/2018/06/is-twi tter-is-censoring-the-walkaway-hashtag/ …";;;#USA #WalkAway #Twitter #Europa #QFD #Shadowban #Internazis;"1014292587061174278";https://twitter.com/FarSight3/status/1014292587061174278;0
JohnnyOMAGA;2018-07-03 19:39;0;0;". #brooklyn Burger Bistro @AlecBaldwin #HungerStrike #WalkAway pic.twitter.com/JZjlX8h2ee";;@AlecBaldwin;#brooklyn #HungerStrike #WalkAway;"1014292466558742529";https://twitter.com/JohnnyOMAGA/status/1014292466558742529;0
jaimevargas;2018-07-03 19:38;130;377;"There was a time when I was a Democrat, but when it hit me I was supporting baby killers, flag burners and gangbangers, it was time to #WalkAway";;;#WalkAway;"1014292323226849286";https://twitter.com/jaimevargas/status/1014292323226849286;0
usminority;2018-07-03 19:37;262;758;"Catch me tonight at 7pm ET talking with the gorgeous and intelligent Traci Belmonte about the #WalkAway Campaign! https:// twitter.com/mitchellvii/st atus/1014237055382097921 …";;;#WalkAway;"1014292149049937921";https://twitter.com/usminority/status/1014292149049937921;1
RodStryker;2018-07-03 19:30;382;447;"Your story is truly horrifying what socialism is really like. Liberals have no idea how good they have it in America, with a constitution to protect them. Now they are protesting to dismantle the Bill of Rights, because they've been brainwashed to hate Trump & USA. #WalkAway pic.twitter.com/MuVvK2tPrU";;;#WalkAway;"1014290199579381761";https://twitter.com/RodStryker/status/1014290199579381761;0
MTReserved;2018-07-03 19:29;115;132;"Blue - Collar Wages rise in red hot #TrumpEconomy #MAGA #KAG #WalkAway pic.twitter.com/ljhow8WuoX";;;#TrumpEconomy #MAGA #KAG #WalkAway;"1014290091261464576";https://twitter.com/MTReserved/status/1014290091261464576;0
MTReserved;2018-07-03 19:25;444;549;"The #WalkAwayMovement is real and alive. Young Americans fleeing the Demoncrat party. #WalkAway #VoteRed #VoteDemsOut #2018Midterm #MAGA pic.twitter.com/JKDdWNjDPw";;;#WalkAwayMovement #WalkAway #VoteRed #VoteDemsOut #2018Midterm #MAGA;"1014288950515720193";https://twitter.com/MTReserved/status/1014288950515720193;0
Lrihendry;2018-07-03 19:23;213;539;"You may be a product of your past, but you don’t have to be a prisoner. #WALKAWAY";;;#WALKAWAY;"1014288449044668416";https://twitter.com/Lrihendry/status/1014288449044668416;0
PamB60;2018-07-03 19:19;144;209;"President @realDonaldTrump has strong, intelligent, accomplished women in his administration. They are such wonderful role models that they have inspired folks to #WalkAway from the party of no tolerance(Dems)! #Winning #MAGA #GodBlessAmerica #GirlPower pic.twitter.com/Yp7bsUHDe4";;@realDonaldTrump;#WalkAway #Winning #MAGA #GodBlessAmerica #GirlPower;"1014287560791732224";https://twitter.com/PamB60/status/1014287560791732224;0
mitchellvii;2018-07-03 19:08;727;1418;"#WalkAway . The Democrats are finished. https://www. pscp.tv/YourVoiceAmeri ca/1BRJjeOVkbjGw …";;;#WalkAway;"1014284682131800064";https://twitter.com/mitchellvii/status/1014284682131800064;0
FLEURIEKAMGA;2018-07-03 19:54;24;135;"Hey @RealCandaceO , this call is not genius, it is a fact. Thank you for starting something this big. Others will have to follow. #WalkAway . #trump2020 .";;@RealCandaceO;#WalkAway #trump2020;"1014296455606165507";https://twitter.com/FLEURIEKAMGA/status/1014296455606165507;0
bonniemurphy;2018-07-03 19:49;15;23;"I read something about an hour ago that the #WalkAway movement was bot-driven, I hardly think Candace Owens is a bot!! Why is it when people want to be #freethinkers they are attacked and assaulted? I thought #plantations were outlawed way before any of us existed on";;;#WalkAway #freethinkers #plantations;"1014295159859793920";https://twitter.com/bonniemurphy/status/1014295159859793920;0
SaraGonzalesTX;2018-07-03 19:48;11;38;"Socialism is the future of the Democratic Party. I mean, at least he’s honest. Vote wisely. #Vote2018 #WalkAway #2018Midterms https:// twitter.com/joshdcaplan/st atus/1014155356405207040 …";;;#Vote2018 #WalkAway #2018Midterms;"1014294855391080448";https://twitter.com/SaraGonzalesTX/status/1014294855391080448;1
DonnaWR8;2018-07-03 19:46;18;24;"#WalkAway #WalkAwayCampaign #WalkAwayFromDemocrats https:// twitter.com/donnawr8/statu s/1014181091798847488?s=21 …";;;#WalkAway #WalkAwayCampaign #WalkAwayFromDemocrats;"1014294444735070213";https://twitter.com/DonnaWR8/status/1014294444735070213;1
HarmonyRachell;2018-07-03 19:45;30;60;""Divide they try. Fail they will." Everything has meaning. Q #GreatAwakening #PatriotsFight #WWG1WGA @POTUS @realDonaldTrump #DOITQ #IGReport #Unredacted #FullDisclosure #QAngels #FakeNews #Yoda #Trump #TheStorm #GoodByeDemocrats #WalkAway #MAGA #MOAB #HRCVideo #8Chan pic.twitter.com/IIiYyGB0HT";;@POTUS @realDonaldTrump;#GreatAwakening #PatriotsFight #WWG1WGA #DOITQ #IGReport #Unredacted #FullDisclosure #QAngels #FakeNews #Yoda #Trump #TheStorm #GoodByeDemocrats #WalkAway #MAGA #MOAB #HRCVideo #8Chan;"1014294120007757824";https://twitter.com/HarmonyRachell/status/1014294120007757824;0
VickieFindley2;2018-07-03 19:45;39;86;"#WalkAway #WalkAwayFromDemocrats pic.twitter.com/6MeNsve4k1";;;#WalkAway #WalkAwayFromDemocrats;"1014294028500660224";https://twitter.com/VickieFindley2/status/1014294028500660224;0
_The_Watchers_;2018-07-03 19:42;11;25;"#QAnon #GreatAwakeningWorldwide #GoodbyeDeepState #WalkAway #SheepNoMore @POTUS @realDonaldTrump New Q post Qs pic (3rd pic here) is titled "WelcomeAboard" Pic #4 is pic #3 turned - showing that pic is a lamp on a table pic.twitter.com/8gTY6i6oqe";;@POTUS @realDonaldTrump;#QAnon #GreatAwakeningWorldwide #GoodbyeDeepState #WalkAway #SheepNoMore #4 #3;"1014293374642335744";https://twitter.com/_The_Watchers_/status/1014293374642335744;0
Junebeeforvetso;2018-07-03 19:38;28;31;"HMM ISENT THIS THE SAME THING THAT IS HAPPING IN OTHER COUNTRIES BY ILLEGALS? BUT HERE ITS THE DEMOCRATIC PARTY. JOIN THE #WalkAway MOVEMENT. AND LETS KEEP #MAGA @realDonaldTrump @FoxNews @ABCWorldNews pic.twitter.com/BDsljyfs6v";;@realDonaldTrump @FoxNews @ABCWorldNews;#WalkAway #MAGA;"1014292217869971456";https://twitter.com/Junebeeforvetso/status/1014292217869971456;0
JFNYC1;2018-07-03 19:37;13;35;"Blacks are waking up. Great news!!! #WalkAway pic.twitter.com/ZNwJ8U1nYG";;;#WalkAway;"1014292159607001088";https://twitter.com/JFNYC1/status/1014292159607001088;0
AnnInquirer;2018-07-03 19:34;76;89;"Should be attached to the #Left 's #Unhinged minds, which are in #Socialist #Progressive cages. #WalkAway from #Craziness #VoteRed pic.twitter.com/1wYTHPoGGv";;;#Left #Unhinged #Socialist #Progressive #WalkAway #Craziness #VoteRed;"1014291442779480065";https://twitter.com/AnnInquirer/status/1014291442779480065;0
knahcsca;2018-07-03 19:34;18;38;"My family was traditional Democrat, JFK was their hero, my #walkaway moment was in 1980 as I graduated college and realized the Democrats had messed with my future with #affirmativeAction , my friends and I voted for Reagan and have been Republican ever since";;;#walkaway #affirmativeAction;"1014291439742640128";https://twitter.com/knahcsca/status/1014291439742640128;0
scotlassie49;2018-07-03 19:32;41;54;"Yep. We see the truth! Lying libs #VoteRed2018 #WalkAway pic.twitter.com/mCuFhCVpCN";;;#VoteRed2018 #WalkAway;"1014290734285852672";https://twitter.com/scotlassie49/status/1014290734285852672;0
FranBarreraReal;2018-07-03 19:28;12;25;"I walked away from Dems and their failure during Ronald Reagan - never ever regretted my decision as I’ve seen Dems as a party completely and continuously degenerate over the decades #WalkAway";;;#WalkAway;"1014289767012487168";https://twitter.com/FranBarreraReal/status/1014289767012487168;0
4AllSoulKind;2018-07-03 19:27;14;29;"So Boss has lunch with Maddog today, then just happens to go here, TODAY...cuz PGA and stuff Happy Birthday @JulianAssange WELCOME HOME #WalkAway #WWG1WGA #MAGA #QAnon #IndependenceDay2018 #WakeUpAmerica cc @realDonaldTrump @GenFlynn @B75434425 @RobinHood0010 pic.twitter.com/HHkEKIMeF6";;@JulianAssange @realDonaldTrump @GenFlynn @B75434425 @RobinHood0010;#WalkAway #WWG1WGA #MAGA #QAnon #IndependenceDay2018 #WakeUpAmerica;"1014289534085992455";https://twitter.com/4AllSoulKind/status/1014289534085992455;0
staceydash;2018-07-03 19:24;36;149;"Yes. Period. Full stop. #WalkAway https:// twitter.com/foxandfriends/ status/1014287696624222208 …";;;#WalkAway;"1014288763265175553";https://twitter.com/staceydash/status/1014288763265175553;1
DonnaWR8;2018-07-03 19:17;42;95;"#WalkAway #DemExit pic.twitter.com/xsUvbrclPk";;;#WalkAway #DemExit;"1014286917062586368";https://twitter.com/DonnaWR8/status/1014286917062586368;0
JeremyLDoty;2018-07-03 19:14;51;46;"Data Dump from #MAGA Patriot George M. Nasif. Time to #WalkAway See More Screenshots at link Below https://www. facebook.com/george.nasif/p osts/10214729000313539 … pic.twitter.com/QoBcfxlnCM";;;#MAGA #WalkAway;"1014286355634049024";https://twitter.com/JeremyLDoty/status/1014286355634049024;0
RoberRenteria;2018-07-03 19:12;26;32;"I AM MEXICAN! AMERICAN FIRST! I AM NOT A VICTIM. @realDonaldTrump IS MY @POTUS ! I LOVE MY COUNTRY AND SUPPORT MY @POTUS #WalkAway #NotAVictim #ProudPatriot #BuildTheWall";;@realDonaldTrump @POTUS @POTUS;#WalkAway #NotAVictim #ProudPatriot #BuildTheWall;"1014285888472436736";https://twitter.com/RoberRenteria/status/1014285888472436736;0
Gil1710;2018-07-03 19:11;30;59;"Those screaming for socialism need to go to DPRK, or Cuba, or Venezuela. Can't afford the trip, or don't want the up-close-and-personal experience? Speak to ppl who fled the atrocious living conditions and then tell me how bad you want it. #kag #walkaway";;;#kag #walkaway;"1014285621827907584";https://twitter.com/Gil1710/status/1014285621827907584;0
thomesinc;2018-07-03 19:10;24;46;"Out #POTUS the great #Trump45 is holding the VA accountable for the treatment of our #Bravest who deserve the very best! #BackTheMilitary #winning is never getting old #WalkAway and enjoy the ride with us! #SaluteToService pic.twitter.com/1Xp7cwI3tc";;;#POTUS #Trump45 #Bravest #BackTheMilitary #winning #WalkAway #SaluteToService;"1014285248325136384";https://twitter.com/thomesinc/status/1014285248325136384;0
mitchellvii;2018-07-03 19:03;279;473;"The Democrats have dropped all pretense. They are now the Socialist Party. So be it. #WalkAway pic.twitter.com/z7dV2TsavT";;;#WalkAway;"1014283535329394688";https://twitter.com/mitchellvii/status/1014283535329394688;0
mitchellvii;2018-07-03 19:01;120;216;"#WALKAWAY INTERVIEW! YourVoice™ America (7/3) “Exclusive Interview: Brandon Straka!” https://www. yourvoiceamerica.tv/yva-7-3-18/";;;#WALKAWAY;"1014283114414297088";https://twitter.com/mitchellvii/status/1014283114414297088;0
bocavista2016;2018-07-03 19:00;1071;950;"#BREAKING Liberals protest and try to block #ICE from raiding a California residence suspected of HUMAN SEX TRAFFICKING OF JUVENILES #ThesePeopleAreDEPRAVED pic.twitter.com/yDAoZnP9in @realDonaldTrump #MAGA #Outnumbered #TheFive #Tucker #Hannity #IngrahamAngle #WalkAway";;@realDonaldTrump;#BREAKING #ICE #ThesePeopleAreDEPRAVED #MAGA #Outnumbered #TheFive #Tucker #Hannity #IngrahamAngle #WalkAway;"1014282806636240896";https://twitter.com/bocavista2016/status/1014282806636240896;0
trumptrain1111;2018-07-03 19:00;90;104;"It's starting! When people don't feel safe, then they don't want to come to your city. Plain & simple truth. #WalkAway #LiberalismIsAMentalDisorder #TrumpWorld #FBTS #WWG1WGA California Liberalism Just Cost San Francisco $40 Million https:// conservativedailypost.com/california-lib eralism-just-cost-san-francisco-40-million/ … via @ConDailyPost";;@ConDailyPost;#WalkAway #LiberalismIsAMentalDisorder #TrumpWorld #FBTS #WWG1WGA;"1014282652558483456";https://twitter.com/trumptrain1111/status/1014282652558483456;0
AnahuacYbarra;2018-07-03 18:58;159;488;"#WalkAwayMovement Because of Democrats arguments constructed on the premise of "I am right, the rest are wrong, How do you dare to dissent?" That is why I #WalkAway";;;#WalkAwayMovement #WalkAway;"1014282139544637440";https://twitter.com/AnahuacYbarra/status/1014282139544637440;0
SkyBot99;2018-07-03 18:56;113;383;"I walked away from the Democratic Party when they began to care more for their donors than the people who have supported them for decades or the democratic principles they claim to stand for. #walkaway";;;#walkaway;"1014281792721965057";https://twitter.com/SkyBot99/status/1014281792721965057;0
stevewesly;2018-07-03 18:56;191;613;"I’m a teacher and I have seeing this first hand. Black children have been set up to believe the false choice between a racist and whoever else is running. #WalkAway";;;#WalkAway;"1014281687017181184";https://twitter.com/stevewesly/status/1014281687017181184;0
kenjwilliams;2018-07-03 18:54;145;322;"I'm not a part of the #Walkaway movement since I'm a Conservative Libertarian who voted for our current President. I'm retweeting this because Mark's comments are EXACTLY the reason why I voted for our current President. https:// twitter.com/MarkMentzer/st atus/1014237885095129088 …";;;#Walkaway;"1014281338168528896";https://twitter.com/kenjwilliams/status/1014281338168528896;1
staceydash;2018-07-03 18:54;96;333;"Ah the Pretentious Unpretentious. #WalkAway https:// twitter.com/chet_cannon/st atus/1014161285745803266 …";;;#WalkAway;"1014281316160897024";https://twitter.com/staceydash/status/1014281316160897024;1
RealTrumpLady;2018-07-03 18:54;122;210;"DEMOCRATS R THE LOST SHEEP DEMOCRATS R THE LOST SHEEP DEMOCRATS R THE LOST SHEEP DEMOCRATS R THE LOST SHEEP DEMOCRATS RTHE LOST SHEEP DEMOCRATS R THE LOST SHEEP DEMOCRATS SHOULD #WalkAway";;;#WalkAway;"1014281210242129920";https://twitter.com/RealTrumpLady/status/1014281210242129920;0
dawg_lb;2018-07-03 18:53;79;120;"#MAGA #AmericaFirst #KAG #WalkAway @POTUS @VP @realDonaldTrump @FLOTUS @DonaldJTrumpJr pic.twitter.com/q8mP3qxqWr";;@POTUS @VP @realDonaldTrump @FLOTUS @DonaldJTrumpJr;#MAGA #AmericaFirst #KAG #WalkAway;"1014280982180982785";https://twitter.com/dawg_lb/status/1014280982180982785;0
ctcoff99;2018-07-03 18:53;67;231;"There are many lifelong Blue Blood, Patriotic Democrats who may hate Donald Trump, but are never going to go along with socialism. They know the real Democratic Party of FDR, Truman, the Kennedys, even Carter is long gone. Just a matter of time before they #WalkAway .";;;#WalkAway;"1014280901507866624";https://twitter.com/ctcoff99/status/1014280901507866624;0
staceydash;2018-07-03 18:41;201;649;"More people are becoming wise to you Democrats. Bring on the Mid term election! Be on the Right side of history. #WalkAway #WeThePeople #MAGA https://www. westernjournal.com/ct/watch-the-v ideo-convincing-dems-to-abandon-party-for-growing-walkaway-movement/ …";;;#WalkAway #WeThePeople #MAGA;"1014278045144899584";https://twitter.com/staceydash/status/1014278045144899584;0
WayneDupreeShow;2018-07-03 18:39;937;1707;"#WalkAway Movement Founder, Brandon Straka Finally Gets Time on @FoxNews ! This is the kind of person you want on your side when dealing with ignorant liberals. He’s well thought out, articulate with his words and was not rude or used separative speech. http:// ht.ly/AHDg30kN8Cg";;@FoxNews;#WalkAway;"1014277422315958272";https://twitter.com/WayneDupreeShow/status/1014277422315958272;0
jasonjacksonNE;2018-07-03 18:36;71;149;"Progressive fascism has come to Lincoln. The vandalism of the @NEGOP & @lcgopne HQ is the latest evidence that progressive fascism is on the rise. Moderates turned off by the violence and vulgarity of these liberal #profascist elements should #WalkAway . pic.twitter.com/vIE4j4dL01";;@NEGOP @lcgopne;#profascist #WalkAway;"1014276770743320576";https://twitter.com/jasonjacksonNE/status/1014276770743320576;0
LindaSuhler;2018-07-03 18:35;107;174;"The Dems tried to destroy Abraham Lincoln & are now trying to destroy President Trump. On Aug 3 with the release of “Death of a Nation,” @DineshDSouza exposes them like no one else could! #WalkAway from the tyranny, Dems! Official Theatrical Trailer https:// youtu.be/UXPhLXuJ90I pic.twitter.com/wbEt2e7czJ";;@DineshDSouza;#WalkAway;"1014276572889559040";https://twitter.com/LindaSuhler/status/1014276572889559040;0
RodStryker;2018-07-03 18:35;919;1190;""Lincoln saved America for the first time. Now it's up to us to save America a second time." - @DineshDSouza Democrats are the party of slavery, racism, & fascism, yet project onto @POTUS Trump what they are guilty of, while he saves America. #WalkAway pic.twitter.com/QeTFqtHn7V";;@DineshDSouza @POTUS;#WalkAway;"1014276487044845575";https://twitter.com/RodStryker/status/1014276487044845575;0
inittowinit007;2018-07-03 18:34;452;750;"INDEPENDENCE DAY 2018 GOD BLESS OUR USA CELEBRATE INDEPENDENCE OF: Leaving the UN Leaving bad trade deals Leaving Nuclear Threats Leaving the DEM PARTY #WALKAWAY to #WINNING . @realDonaldTrump pic.twitter.com/P4UoNw3iWi";;@realDonaldTrump;#WALKAWAY #WINNING;"1014276196408885248";https://twitter.com/inittowinit007/status/1014276196408885248;0
superyayadize;2018-07-03 18:32;243;381;"I’m in! Can MAGA raise the funds to build the wall & bypass obstructing Congress? #BuildTheWall #WalkAway https:// twitter.com/larryelder/sta tus/1014251468944097281 …";;;#BuildTheWall #WalkAway;"1014275736176340994";https://twitter.com/superyayadize/status/1014275736176340994;1
JustSayn2018KAG;2018-07-03 18:20;70;98;"Happy pre-4th Of July. May this #IndependenceDay be a day of YUGE reflection for Democrats that when you've been royally burned as much as U have by your own lunatic party, it's clearly time to just #WalkAway . I'm a Patriot, and I approve this message. #MAGA pic.twitter.com/VacPzIagfT";;;#IndependenceDay #WalkAway #MAGA;"1014272596412588032";https://twitter.com/JustSayn2018KAG/status/1014272596412588032;0
flybull1;2018-07-03 18:11;119;141;". That statement you make... ...when you realize your Democratic Party is... ...LITERALLY OUT OF IDEAS..!! #MAGA #WalkAway https:// twitter.com/ColumbiaBugle/ status/1014167719388692485 …";;;#MAGA #WalkAway;"1014270459666485258";https://twitter.com/flybull1/status/1014270459666485258;1
2runtherace;2018-07-03 18:08;36;61;"Anon Comments/Theories/Research/News/President Trump’s Tweets!! #WhoIsQ #QAnon #Q #WalkAway #LiberalLies @realDonaldTrump pic.twitter.com/pbox7hBVjW";;@realDonaldTrump;#WhoIsQ #QAnon #Q #WalkAway #LiberalLies;"1014269642867658757";https://twitter.com/2runtherace/status/1014269642867658757;0
r_little_finger;2018-07-03 18:04;38;90;"Dear Mother, False report on ‘Red Hens’, they refused to serve Press Sec just to send food for Pink Hats who couldn’t actually hold out for 24 hour food strike. Good news, met Brandon. He is inspiring millions to #WalkAway . We are winning. Stay MAGA #secondcivilwarletters";;;#WalkAway #secondcivilwarletters;"1014268746763046914";https://twitter.com/r_little_finger/status/1014268746763046914;0
Sniper64286433;2018-07-03 17:58;245;295;"Seattle bans plastic straws and utensils because it's bad for the environment? What a joke! #WalkAway pic.twitter.com/BEGxHBpeS1";;;#WalkAway;"1014267252827303936";https://twitter.com/Sniper64286433/status/1014267252827303936;0
JackPosobiec;2018-07-03 17:55;158;428;"#WalkAway https:// twitter.com/dcexaminer/sta tus/1014248935362367491 …";;;#WalkAway;"1014266457226665984";https://twitter.com/JackPosobiec/status/1014266457226665984;1
RodStryker;2018-07-03 17:55;301;445;""Even though we have much to celebrate in 2018, we must never lose sight of the fact that the battle for American freedom is an ongoing thing." -Wild Bill for America https:// youtu.be/GSuv3EUOnjY Nazis/Communists are the Democrat Party & hate America. #WalkAway 4 Independence. pic.twitter.com/OoS4f31Opp";;;#WalkAway;"1014266451082006529";https://twitter.com/RodStryker/status/1014266451082006529;0
TheGoldWaterUS;2018-07-03 17:53;208;196;"Imran Awan Cuts Deal w/ DOJ: The Chess Theory? #GreatAwakening #IMRANAWAN #DOJ #ClintonCabal #WalkAway #TuesdayThoughts #IGReport #COLENG #4thOfJuly2018 #4thOfJuly #WeThePeople #Trump2020 #Trump #MAGA #KAG #LockThemAllUp #VoteRed #RedPill #REALNews #news https:// thegoldwater.com/news/30325-Imr an-Awan-Cuts-Deal-with-DOJ-The-Chess-Theory …";;;#GreatAwakening #IMRANAWAN #DOJ #ClintonCabal #WalkAway #TuesdayThoughts #IGReport #COLENG #4thOfJuly2018 #4thOfJuly #WeThePeople #Trump2020 #Trump #MAGA #KAG #LockThemAllUp #VoteRed #RedPill #REALNews #news;"1014265896116916224";https://twitter.com/TheGoldWaterUS/status/1014265896116916224;0
RealJack;2018-07-03 17:51;866;1759;"Democrats have spent far more time fighting for illegal immigrants and rapists over the last two years than they have the American people. That is the simple explanation for why the midterms will be a GOP landslide as more and more people #WalkAway .";;;#WalkAway;"1014265370738388993";https://twitter.com/RealJack/status/1014265370738388993;0
EvOConnor15;2018-07-03 17:51;133;164;"I love hearing crap like this from liberals. They are burying themselves alive. It’s awesome. #KAG2020 #RedNationRising #SocialismSucks #WalkAway https:// twitter.com/nwsltrme/statu s/1014250197034196993 …";;;#KAG2020 #RedNationRising #SocialismSucks #WalkAway;"1014265325716729858";https://twitter.com/EvOConnor15/status/1014265325716729858;1
