username;date;retweets;favorites;text;geo;mentions;hashtags;id;permalink;retweetornot
TexaLonestar;2018-07-13 23:41;65;99;"Poor,Poor lost Libtard...you go ahead and continue living in La La Land!! and with this my fellow Patriots I bid you a good night...Sweet Dreams #LiberalismIsAMentalDisease #WalkAway https:// twitter.com/ToiletSeatBeck y/status/1017746335418679301 …";;;#LiberalismIsAMentalDisease #WalkAway;"1017977302452461568";https://twitter.com/TexaLonestar/status/1017977302452461568;1
gopoundsand1234;2018-07-13 23:25;82;116;"FEINING SELECTIVE OUTRAGE FROM THE LEFT OBAMA KNEW ABOUT RUSSIAN MEDDLING AND DID NOTHING SCREW YOURSELF LIBTARD!!!! THIS STABLE GENIUS TRUMP IS CLEANING UP THE MESS OBUMMER LEFT BEHIND!!! #RESIST THE LEFT #WalkAway from #libtards #BuildTheWall #MAGA https:// twitter.com/DaShanneStokes /status/1017842364939988997 …";;;#RESIST #WalkAway #libtards #BuildTheWall #MAGA;"1017973233113583616";https://twitter.com/gopoundsand1234/status/1017973233113583616;1
robjh1;2018-07-13 23:24;266;329;"These are Americans who were refused a service by #UBER simply because they had a MAGA cap. Where is #BLM it Maxine Waters with calling for a boycott of #UBER ? #WalkAway black folks from the Slavs plantation of the Democratic Party. pic.twitter.com/MaQqpSUYqM";;;#UBER #BLM #UBER #WalkAway;"1017973076057878529";https://twitter.com/robjh1/status/1017973076057878529;0
izzieadams1;2018-07-13 23:23;129;92;"IMPORTANT PLS RETWEET RETWEET RETWEET Mark Cuckerberg & Eric Sch*t worked w/GOOGLE & FB both in ‘08 & 2016 Elections. OB used Pol War Rm. Utilized Template to Win under egis of US Digital Srvc w/a RUSSIAN friend, used DEMS AGAINST REPUBLICANS! #walkaway pic.twitter.com/GJ24GfuIEe";;;#walkaway;"1017972925427847168";https://twitter.com/izzieadams1/status/1017972925427847168;0
robbinsracing29;2018-07-13 23:18;51;73;"1955: Buses were segregated. A bus driver wanted to move Rosa Parks to the back of the bus. -Montgomery, Alabama 2018: @Uber driver won't even let you in if you are black and wearing a #MAGA hat. -Washington D.C. #IngrahamAngle #TheFive #Gutfeld #WalkAway";;@Uber;#MAGA #IngrahamAngle #TheFive #Gutfeld #WalkAway;"1017971516728922112";https://twitter.com/robbinsracing29/status/1017971516728922112;0
MagaApplePie;2018-07-13 23:10;38;63;"#WalkAway from hypocrisy https:// twitter.com/hodgetwins/sta tus/1017861731404734467 …";;;#WalkAway;"1017969537801744384";https://twitter.com/MagaApplePie/status/1017969537801744384;1
robjh1;2018-07-13 23:10;130;172;"Mark my word and retweet my tweet the liberal MSM aka #FakeNewsMedia will not report this story and if they do they will window dress it and move on. BLM, Al Sharpton and other fake black leaders who love to protest will not even call for a boycott of #UBER . #WalkAway";;;#FakeNewsMedia #UBER #WalkAway;"1017969454322462720";https://twitter.com/robjh1/status/1017969454322462720;0
AIpatriotIZ;2018-07-13 23:09;71;114;"@realDonaldTrump trying to put pressure on Russia but Germany is paying them Billions! How much of that $$$ does Russia spend on #RussianHacking #PutinSummit #WalkAway https:// twitter.com/realDonaldTrum p/status/1017093020783710209 …";;@realDonaldTrump;#RussianHacking #PutinSummit #WalkAway;"1017969296369020928";https://twitter.com/AIpatriotIZ/status/1017969296369020928;1
robjh1;2018-07-13 23:07;136;246;"Liberal MSM is more concerned about illegal aliens being refused services than taxpaying black citizens being denied services. This is horrible. #WalkAway";;;#WalkAway;"1017968887688843269";https://twitter.com/robjh1/status/1017968887688843269;0
robjh1;2018-07-13 23:03;156;293;"I guess this isn't part of the narrative #FakenewsMedia wants to cover. Time for black folks to #WalkAway . Any discrimination on any level is wrong and must be addressed. Don't let this story die. #WalkAway";;;#FakenewsMedia #WalkAway #WalkAway;"1017967769416077313";https://twitter.com/robjh1/status/1017967769416077313;0
Braveheart_USA;2018-07-13 23:01;20;60;"His account actually blocked you? He can dish is out, alienate every Purple Heart recipient in America, but can’t handle criticism? His Democrat is showing! #WalkAway";;;#WalkAway;"1017967257769537536";https://twitter.com/Braveheart_USA/status/1017967257769537536;0
Love_The_Donald;2018-07-13 22:57;38;113;"Welcome....are you new to the Republican party? I just saw this tweet from James Woods—another reason to #walkaway from the Democrat party: https:// twitter.com/realjameswoods /status/1017713078564093952?s=21 …";;;#walkaway;"1017966172384387072";https://twitter.com/Love_The_Donald/status/1017966172384387072;1
thomesinc;2018-07-13 22:44;20;33;"Reason number 394 to #WalkAway You really want to be part of this pic.twitter.com/A5GA0lVUHY";;;#WalkAway;"1017963122496335872";https://twitter.com/thomesinc/status/1017963122496335872;0
HernandoDeSot11;2018-07-13 22:43;41;73;"And the #left wants us to believe them? You believe it if you want, But you really should unplug that #LieBox #Walkaway #fakenews #wakeup #MAGA #KAG . pic.twitter.com/8arLFGREq7";;;#left #LieBox #Walkaway #fakenews #wakeup #MAGA #KAG;"1017962715451678720";https://twitter.com/HernandoDeSot11/status/1017962715451678720;0
yigsstarhouse;2018-07-13 22:42;18;18;"Judicial Watch: FBI Begins Releasing Strzok-Page Communications, DOJ Objects to Preservation Order. #QAnon #WalkAway https://www. judicialwatch.org/press-room/pre ss-releases/judicial-watch-fbi-begins-releasing-strzok-page-communications-doj-objects-to-preservation-order/ … pic.twitter.com/w218XZTB6D";;;#QAnon #WalkAway;"1017962577635180544";https://twitter.com/yigsstarhouse/status/1017962577635180544;0
Jali_Cat;2018-07-13 22:40;716;869;". @DNC @FBI are hypocrites. . @DNC @FBI are hypocrites. . @DNC @FBI are hypocrites. No one seemed to care about Russia when Barry tells them ‘I’ll have more flexibility aftr the election’...now Russia is front and center. #WalkAway from the deep state fools & corruption! https:// twitter.com/carrieksada/st atus/1017561118313668608 …";;@DNC @FBI @DNC @FBI @DNC @FBI;#WalkAway;"1017962051673739265";https://twitter.com/Jali_Cat/status/1017962051673739265;1
DJTsavesAmerica;2018-07-13 22:36;48;49;"We don’t want these people in office #Socialist #California #Cali #NewYork #Massachusetts #WalkAway #WalkAwayCampaign https:// twitter.com/usahotlips/sta tus/1017923599146024960?s=12 …";;;#Socialist #California #Cali #NewYork #Massachusetts #WalkAway #WalkAwayCampaign;"1017960968058429441";https://twitter.com/DJTsavesAmerica/status/1017960968058429441;0
DJTsavesAmerica;2018-07-13 22:33;42;45;"That’s right! We don’t need no dang #Socialist in our Government https:// twitter.com/usahotlips/sta tus/1017923599146024960?s=12 … #WalkAway #WalkAwayCampaign";;;#Socialist #WalkAway #WalkAwayCampaign;"1017960284072210433";https://twitter.com/DJTsavesAmerica/status/1017960284072210433;0
ErikaMcdougall;2018-07-13 22:32;240;355;"@FoxNews @TuckerCarlson @realDonaldTrump “LIBERAL DEMS UNVEIL BILL TO ABOLISH ICE..” PROTESTS & [stupid] CHANTS to ABOLISH ICE continue around the country I’ve got a “CHANT” for ya... ”SAY IT LOUD, SAY IT CLEAR... ILLEGALS & A**HOLES ARE NEVER WELCOME HERE #WalkAway pic.twitter.com/PGwP3s3lq8";;@FoxNews @TuckerCarlson @realDonaldTrump;#WalkAway;"1017959962524336128";https://twitter.com/ErikaMcdougall/status/1017959962524336128;0
hfinch61;2018-07-13 22:19;41;112;"*FORMER* Al. Say it: *FORMER*. You're not a US Senator any more @SenFranken because YOU WERE FORCED TO RESIGN, for SEXUALLY ASSAULTING MULTIPLE WOMEN. Is that clear enough????? #WalkAway #WalkAwayFromDemocrats";;@SenFranken;#WalkAway #WalkAwayFromDemocrats;"1017956742741798912";https://twitter.com/hfinch61/status/1017956742741798912;0
Jali_Cat;2018-07-13 22:18;787;1177;"“How I went from a Trump critic to a Trump supporter. I admit that I was wrong about Trump.” ~ @varvel #WeThePeople are very proud of @realDonaldTrump and all of his accomplishments as @POTUS . Amazing to watch! #PromisesKept #KeepAmericaGreat #WalkAway https://www. indystar.com/story/opinion/ columnists/varvel/2018/07/11/varvel-how-went-trump-critic-trump-supporter/770573002 …";;@varvel @realDonaldTrump @POTUS;#WeThePeople #PromisesKept #KeepAmericaGreat #WalkAway;"1017956594968072193";https://twitter.com/Jali_Cat/status/1017956594968072193;0
Mab754;2018-07-13 22:17;33;95;"I predict that black Americans will leave the Democratic Party in droves as liberalism has done nothing to empower our communities. #walkaway";;;#walkaway;"1017956330609565696";https://twitter.com/Mab754/status/1017956330609565696;0
awaken_to_maga;2018-07-13 22:16;182;191;"Democrats: owners of slaves. Republicans: literally founded to stop slavery. Read more. Tweet less. I haven't seen you Leftists this upset since the Right took away your slaves. #WalkAway pic.twitter.com/kQpjFnTfKh";;;#WalkAway;"1017955978271129602";https://twitter.com/awaken_to_maga/status/1017955978271129602;0
IWillRedPillU;2018-07-13 22:10;76;136;"Wow we have some AMAZING candidates in the Republican Party running for office in 2018! Highly intelligent, patriotic, proud and strong Republicans WHO SUPPORT TRUMP! #RedWaveRising is a reality, we MUST get to the polls and elect these people. #VoteDemsOut #WalkAway #KAG";;;#RedWaveRising #VoteDemsOut #WalkAway #KAG;"1017954510776528897";https://twitter.com/IWillRedPillU/status/1017954510776528897;0
awaken_to_maga;2018-07-13 22:06;372;579;"With every outburst & public display of "outrage" by the Left, #WeThePeople are exposed to their true beliefs & feelings. The Left is showing us all how they despise America & Americans. #Midterms2018 #GreatAwakening #WalkAway #RedWaveRising2018 #AwakenToMAGA #KAG #FridayFeeling pic.twitter.com/JGA0Z9lapj";;;#WeThePeople #Midterms2018 #GreatAwakening #WalkAway #RedWaveRising2018 #AwakenToMAGA #KAG #FridayFeeling;"1017953359490404352";https://twitter.com/awaken_to_maga/status/1017953359490404352;0
RealBamaCowboy;2018-07-13 21:52;106;184;"Have you ever wondered why there aren’t anyone paying people to protest Democrats/Liberals? True Americans protest attacks on our freedom for free. We know the price our patriots paid and we defend that because that fee has already been paid! #WalkAway #MAGA pic.twitter.com/BjSaSUTdIQ";;;#WalkAway #MAGA;"1017949826716241920";https://twitter.com/RealBamaCowboy/status/1017949826716241920;0
westmassgenius;2018-07-13 21:50;13;19;"As a veteran and a recipient of the Purple Heart it is an insult to all of us who were WIA or KIA. To equate the Order of the Purple Heart to the disgusting testimony of a crooked and scurrilous FBI agent is disgraceful and unforgivable! #WalkAway #LiberalismIsAMentalDisorder https:// twitter.com/poconomtn/stat us/1017933979335340033 …";;;#WalkAway #LiberalismIsAMentalDisorder;"1017949528882843648";https://twitter.com/westmassgenius/status/1017949528882843648;1
CBuch64;2018-07-13 21:48;11;46;"Democrats often show a lack of true gratitude for our service members and veterans. Your poor "choice of words" proves a lack of knowledge of the sacrifices these heroes make. You chose to elevate Peter Strzok, a man who lacks morals and good judgement. That's why many #WalkAway";;;#WalkAway;"1017948813045223424";https://twitter.com/CBuch64/status/1017948813045223424;0
steveavonloor;2018-07-13 21:47;16;25;"Awesome We just hit 7500 followers. I only need about 150,000 votes to get elected, so please continue to RT my posts to everyone! THANK YOU for Following! Let’s #RetirePrice and win in November6th. #Prolife #Pro2A #ProVeterans We are together in this fight #WalkAway";;;#RetirePrice #Prolife #Pro2A #ProVeterans #WalkAway;"1017948608061157376";https://twitter.com/steveavonloor/status/1017948608061157376;0
BobbiKi88765183;2018-07-13 21:45;24;116;"#TrumpTrain #WalkAway pic.twitter.com/L1zS7PqWIb";;;#TrumpTrain #WalkAway;"1017948108985073664";https://twitter.com/BobbiKi88765183/status/1017948108985073664;0
mutts4me_sherri;2018-07-13 21:38;14;12;"Yes, and it also, again, says NO AMERICANS, therefore, #WitchHunt is correct as #Democrats and #MSM continue to claim Trump/Putin “collusion” @POTUS right again! #WWG1WGA #MAGA #WalkAway https:// twitter.com/ChadPergram/st atus/1017827605708500992 …";;@POTUS;#WitchHunt #Democrats #MSM #WWG1WGA #MAGA #WalkAway;"1017946365203132416";https://twitter.com/mutts4me_sherri/status/1017946365203132416;1
brannon_debbie;2018-07-13 21:36;15;55;"Absolutely great. #walkaway https:// twitter.com/gayrepublicswa g/status/1017919942488977408 …";;;#walkaway;"1017945983936811008";https://twitter.com/brannon_debbie/status/1017945983936811008;1
AnnaApp91838450;2018-07-13 21:36;473;896;"Good Night Patriots Post Kick A$$ Great/President Trump1St Lady Shined Around The World Best Military Blue/Twitter Is Trying To Shut Us Down Never Give Up United We Stand Divided We Fall!Luv/Respect\ Luv My Followers/God / USA #MAGA #WalkAway #TRUMPSSUPERELITES pic.twitter.com/WkrpHL0jl8";;;#MAGA #WalkAway #TRUMPSSUPERELITES;"1017945970196217856";https://twitter.com/AnnaApp91838450/status/1017945970196217856;0
Jali_Cat;2018-07-13 21:29;418;801;"What would life be like with HONEST AND UNBIASED NEWS NETWORKS?? FAIR! @CNN @CNNPolitics @Acosta @DanaBashCNN @donlemon took GIFTS from deep state & sneaks questions to @DNC candidates! The gig is up. We SEES you. We can SEE the lies & spin! #WalkAway";;@CNN @CNNPolitics @Acosta @DanaBashCNN @donlemon @DNC;#WalkAway;"1017944105308098562";https://twitter.com/Jali_Cat/status/1017944105308098562;0
LVRunnerGirl;2018-07-13 21:18;17;35;"What @RepCohen said yesterday was disgusting and is NOT forgettable! Patriots need to support Charlotte Bergmann for Congress! #PurpleHeartsR4Heroes #WalkAway #RunAway #Veterans #Truth";;@RepCohen;#PurpleHeartsR4Heroes #WalkAway #RunAway #Veterans #Truth;"1017941480155934720";https://twitter.com/LVRunnerGirl/status/1017941480155934720;0
Just_a_Texan;2018-07-13 21:14;8;22;"#WalkAway from this loser party pic.twitter.com/hhqXm2ExK7";;;#WalkAway;"1017940302127095808";https://twitter.com/Just_a_Texan/status/1017940302127095808;0
wmmII88;2018-07-13 21:14;9;24;"Who's glad that this Kenyan is no longer sitting in the Whitehouse? #WalkAway #KAG pic.twitter.com/5whagSo3sb";;;#WalkAway #KAG;"1017940257118019586";https://twitter.com/wmmII88/status/1017940257118019586;0
LWilsonDarlene;2018-07-13 21:13;12;20;"#WalkAwayFromDemocrats #VoteRed #SaveAmerica #2A #1A #BoycottDemocrats2018 #VETS #JOBS #ResignDemocrats #WalkAway";;;#WalkAwayFromDemocrats #VoteRed #SaveAmerica #2A #1A #BoycottDemocrats2018 #VETS #JOBS #ResignDemocrats #WalkAway;"1017940229402124289";https://twitter.com/LWilsonDarlene/status/1017940229402124289;0
Judekarma909;2018-07-13 21:12;28;48;"You can do it! #WalkAway pic.twitter.com/R1Hipe1DFc";;;#WalkAway;"1017939909158604800";https://twitter.com/Judekarma909/status/1017939909158604800;0
flyer1618;2018-07-13 21:08;11;22;"Now that Twitter has purged its ranks of fake accounts and Russian bots. It must be absolutely terrifying for the liberals to see how many of us Patriots there actually are! #maga #qanon #FridayThoughts #WalkAwayFromDemocrats #ccot #qarmy #TheGreatAwakening #walkaway pic.twitter.com/lGOGo1uR4B";;;#maga #qanon #FridayThoughts #WalkAwayFromDemocrats #ccot #qarmy #TheGreatAwakening #walkaway;"1017938944997122048";https://twitter.com/flyer1618/status/1017938944997122048;0
CynthiaRunnels1;2018-07-13 21:06;25;76;"Not only a poor choice of words, A hysterical improper thought that led to them Typical of Democrats these days You shouldn't be so quick w/lunacy Your to old to behave like a teen fanatic over @HillaryClinton Your going to be on the wrong side of history #WalkAway #Trump2020 pic.twitter.com/OpocXS1bxF";;@HillaryClinton;#WalkAway #Trump2020;"1017938356230152192";https://twitter.com/CynthiaRunnels1/status/1017938356230152192;0
IWillRedPillU;2018-07-13 21:04;20;41;"California--Convicted Child Molester Beaten to Death at Wasco State Prison Great news is nice for a change. #PedoGate #GreatAwakening #GreatNews #WalkAway #KAG https://www. austin360.com/news/national/ child-molester-beaten-death-days-after-prison-arrival-authorities-say/6B27csqdbXNrPpLOI37SJN/ …";;;#PedoGate #GreatAwakening #GreatNews #WalkAway #KAG;"1017937944668262406";https://twitter.com/IWillRedPillU/status/1017937944668262406;0
melissa5215;2018-07-13 20:47;58;71;"She’s nothing but a porn star who loves the attention. She has no morals and her day is fast approaching, #karma @MagniFieri @IngrahamAngle @realDonaldTrump @FoxNews @CNN @maddow @MSNBC @JoyVBehar #MAGA #WalkAway https:// twitter.com/education4libs /status/1017546694458773504 …";;@MagniFieri @IngrahamAngle @realDonaldTrump @FoxNews @CNN @maddow @MSNBC @JoyVBehar;#karma #MAGA #WalkAway;"1017933461326163968";https://twitter.com/melissa5215/status/1017933461326163968;1
USATrump45;2018-07-13 20:38;60;87;"This is what the typical Anti-Trumper looks like. #WalkAway pic.twitter.com/CLP8UMtVs4";;;#WalkAway;"1017931198922936322";https://twitter.com/USATrump45/status/1017931198922936322;0
Sta1tOfLiberty1;2018-07-13 20:31;15;18;"Oh like Candace Owens @RealCandaceO & Brandon Straka @usminority ? Sorry bub. @TheDemocrats #cultLEFT enslavement through self elected victimhood has been breeched & the #WalkAwayMovement is dimsmantling the lefts oppressively masked racism & bigotry too. You lose. #WalkAway";;@RealCandaceO @usminority @TheDemocrats;#cultLEFT #WalkAwayMovement #WalkAway;"1017929647693225984";https://twitter.com/Sta1tOfLiberty1/status/1017929647693225984;0
Tombx7M;2018-07-13 20:29;23;32;"The biggest threats to America #RussianHacking #Tucker #Hannity #WalkAway #QAnon #MAGA #KAG #Trump pic.twitter.com/pB24VsJeT9";;;#RussianHacking #Tucker #Hannity #WalkAway #QAnon #MAGA #KAG #Trump;"1017928973278482434";https://twitter.com/Tombx7M/status/1017928973278482434;0
Joe92418617;2018-07-13 20:25;3;28;"Wow what a powerful message she has! #MAGA with viewing this video I watched tons of other @TheDemocrats videos that #walkaway all very powerful/inspirational. you sir @usminority have started a huge movement.";;@TheDemocrats @usminority;#MAGA #walkaway;"1017928134136664065";https://twitter.com/Joe92418617/status/1017928134136664065;0
USATrump45;2018-07-13 20:24;8;15;"#WalkAway from the Democratic Party! pic.twitter.com/jvBIlSwGEw";;;#WalkAway;"1017927739716890624";https://twitter.com/USATrump45/status/1017927739716890624;0
RavenHUWolf;2018-07-13 20:23;9;15;"Are you really this stupid? Or you just looking for attention. Turn the fake news off and #WalkAway . London has FEWER visits -- their tourism is way down, falling, .... and in 2017, it flat-lined. Thanks to the islamist sympathizer, Mayor Of London. #shithole https:// twitter.com/AlishaFruits/s tatus/1017810258268446722 …";;;#WalkAway #shithole;"1017927517687119872";https://twitter.com/RavenHUWolf/status/1017927517687119872;1
Donnalee222;2018-07-13 20:22;4;16;"I am in awe how quickly #walkaway is moving. Thank you for having the courage.";;;#walkaway;"1017927381854670848";https://twitter.com/Donnalee222/status/1017927381854670848;0
MissyWatusi;2018-07-13 20:18;8;48;"Another celebrity preaching to the peasants…They are out of touch with American voters. Ask the #WalkAway";;;#WalkAway;"1017926219277459456";https://twitter.com/MissyWatusi/status/1017926219277459456;0
AnnaApp91838450;2018-07-13 20:17;459;482;"https://www. breitbart.com/big-journalism /2018/07/13/wapo-christopher-ingraham-spreads-fake-news-mueller-indictments/amp/?__twitter_impression=true … Corrupt Lying Fake Media This So Called Journalist With His Corrupt Behavior Should Be Fired ASAP #MAGA #WalkAway #VoteDemsOut #Americafirst #AnnaLovesTrump #TrumpsSuperElites";;;#MAGA #WalkAway #VoteDemsOut #Americafirst #AnnaLovesTrump #TrumpsSuperElites;"1017926131905941504";https://twitter.com/AnnaApp91838450/status/1017926131905941504;0
PolitixGal;2018-07-13 20:16;11;12;"This November, Millions of Voters will #WalkAway from the Democrat Party and #VoteDemsOUT . #VoteSteveCohenOUT in TN. https:// twitter.com/BeckysTidePods /status/1017874422860902400 …";;;#WalkAway #VoteDemsOUT #VoteSteveCohenOUT;"1017925817702051840";https://twitter.com/PolitixGal/status/1017925817702051840;1
fornow_nameless;2018-07-13 20:16;6;8;"Thanks for the RTs people. They move the message. Otherwise, it would still be silent without you. - #DrainTheSwamp #WalkAway #Winning TY @POTUS @Teresacregan2 @Justice4Kennedy @jigglett @rgething @JKyncayde @PatriotHope @hmmngbrd508 @rgething @mrskennystabler @Melissa1opinion pic.twitter.com/upa3ERvZrI";;@POTUS @Teresacregan2 @Justice4Kennedy @jigglett @rgething @JKyncayde @PatriotHope @hmmngbrd508 @rgething @mrskennystabler @Melissa1opinion;#DrainTheSwamp #WalkAway #Winning;"1017925698223255552";https://twitter.com/fornow_nameless/status/1017925698223255552;0
occulturalism;2018-07-13 20:16;4;11;"illuminasty. #godisawoman #walkaway #occult #qanon https:// twitter.com/hh_lovecraft/s tatus/1017909125597065216 …";;;#godisawoman #walkaway #occult #qanon;"1017925643223232512";https://twitter.com/occulturalism/status/1017925643223232512;1
caseyreynolds73;2018-07-13 20:15;4;15;"I have been informed that @RepCohen has tweeted out an apology. His apology must not have been intended for me. I can’t see his apology tweet due to him blocking me because I shamed him for insulting Veterans #CowardCohen #WalkAway #MAGA";;@RepCohen;#CowardCohen #WalkAway #MAGA;"1017925397453967360";https://twitter.com/caseyreynolds73/status/1017925397453967360;0
218_2675;2018-07-13 20:12;3;13;"I have 3767 following and am following almost 4500. Twitter won’t let me follow more than 5000. How do I get around that so I can follow more Patriots? I love following and retweeting the Trump Train tweets but now I’m limited. Help! @realDonaldTrump #KAG #WALKAWAY";;@realDonaldTrump;#KAG #WALKAWAY;"1017924809760563200";https://twitter.com/218_2675/status/1017924809760563200;0
thedevman1;2018-07-13 20:12;4;6;"My friends on #BlackTwitter LISTEN! I know many of you are waking up, but do it with facts. They’re out there for you. #Freedom is waiting. #WalkAway https:// twitter.com/thomassowell/s tatus/1017816800296361984 …";;;#BlackTwitter #Freedom #WalkAway;"1017924686628483073";https://twitter.com/thedevman1/status/1017924686628483073;1
my2gr8girls;2018-07-13 20:12;13;14;"#WalkAway A young girl's story of leaving the Democratic Party. https:// twitter.com/GayRepublicSwa g/status/1017578248224505858 …";;;#WalkAway;"1017924681062592512";https://twitter.com/my2gr8girls/status/1017924681062592512;1
baldeguy56;2018-07-13 20:11;2;22;"Who cares? Have you checked out the #WalkAway hashtag? Many, many great ppl have walked away from that political cesspool called the Dem Party. Check it out.";;;#WalkAway;"1017924573172502529";https://twitter.com/baldeguy56/status/1017924573172502529;0
FilmmataFilms;2018-07-13 20:11;3;16;"I liked a @YouTube video http:// youtu.be/M_CEtAcJosg?a The #WalkAway Movement Is Huge! The Real Walk Away Story Being Underreported.";;@YouTube;#WalkAway;"1017924524875055104";https://twitter.com/FilmmataFilms/status/1017924524875055104;0
joey_beavers;2018-07-13 20:11;166;230;"Ok my MAGA family @_PA_KAG_girl is new to twitter. Let's welcome her to the team and overwhelm her with new followers and friends. Let's help her get her message out. #MAGA #KAG #WalkAway pic.twitter.com/8Q3MI4L3Hi";;@_PA_KAG_girl;#MAGA #KAG #WalkAway;"1017924473989758976";https://twitter.com/joey_beavers/status/1017924473989758976;0
TexasTrumpGirl;2018-07-13 20:10;12;21;"You are a prime example of why the Democratic Party is fading away. Wait till November, the party will become extinct. What are you afraid of Trump learning about the Democratic party from Putin? It's coming out and we can't wait. #RIPDemocraticParty #WalkAway";;;#RIPDemocraticParty #WalkAway;"1017924375717216256";https://twitter.com/TexasTrumpGirl/status/1017924375717216256;0
bj_bjshaven;2018-07-13 20:09;10;63;"Thank you so much for taking the time to make this video for all of us. I hope and pray the rest of your life is full of happiness and wonderful memories. #WalkAway but never give up on anything.";;;#WalkAway;"1017924018320691200";https://twitter.com/bj_bjshaven/status/1017924018320691200;0
Don_Vito_08;2018-07-13 20:06;4;5;"U.S. economy grew at a 3 percent rate, a win for Trump #Winning #MAGA #WalkAway http:// wapo.st/2zLokvP?tid=ss _tw-amp …";;;#Winning #MAGA #WalkAway;"1017923163756335104";https://twitter.com/Don_Vito_08/status/1017923163756335104;0
Jeffmyers0011;2018-07-13 20:05;1;11;"Whatever! #WalkAway";;;#WalkAway;"1017923115932966913";https://twitter.com/Jeffmyers0011/status/1017923115932966913;0
Static_Waste;2018-07-13 20:05;4;2;"There has been many countries that have tried to influence the American elections. It's called propaganda. Been used since WWII. Nazis tried it, Communist tried it during '50s. So what's new? #MAGA #KAG #NRA #NoAmnesty #2A #AmericaFirst #SupportOurTroops #BuildTheWall #WalkAway";;;#MAGA #KAG #NRA #NoAmnesty #2A #AmericaFirst #SupportOurTroops #BuildTheWall #WalkAway;"1017923057283928065";https://twitter.com/Static_Waste/status/1017923057283928065;0
ANGELACHARPENT1;2018-07-13 20:05;5;3;"RIP #RedWaveRising2018 #SpyGate #MAGA #NRA #QAnon #BackTheBlue #SupportOurTroops #FreeTommyRobinson #WalkAway https:// twitter.com/IsraelUSAforev r/status/1017584180631306240 …";;;#RedWaveRising2018 #SpyGate #MAGA #NRA #QAnon #BackTheBlue #SupportOurTroops #FreeTommyRobinson #WalkAway;"1017922990921658368";https://twitter.com/ANGELACHARPENT1/status/1017922990921658368;1
