username;date;retweets;favorites;text;geo;mentions;hashtags;id;permalink;retweetornot
realPolitiDiva;2018-06-30 11:02;261;518;"Just a note to all those that choose to #WalkAway . We are #MAGA . We don’t care what color you are, who you choose to love, or about your religion. We care about restoring glory and honor to our beautiful country. If you are #AmericaFirst , we welcome you with open arms";;;#WalkAway #MAGA #AmericaFirst;"1013075219798425600";https://twitter.com/realPolitiDiva/status/1013075219798425600;0
330Conservative;2018-06-30 10:58;128;274;"Leaving California was the biggest eye opener for me! So happy I got my family out of that place. My fellow Latinos...you DO NOT have to be Democrats. They want to keep you down! #WALKAWAY #LatinosForTrump #MAGA";;;#WALKAWAY #LatinosForTrump #MAGA;"1013074211009679366";https://twitter.com/330Conservative/status/1013074211009679366;0
RJGatorEsq;2018-06-30 10:58;81;212;"I was once a liberal. I based my politics on emotion, as liberals do now. Then, philosophically, I became a Continental Rationalist. I began basing my politics on logical reasoning, not emotion. Democrats offered nothing but emotion, mostly hate. I decided to #WalkAway .";;;#WalkAway;"1013074183637602304";https://twitter.com/RJGatorEsq/status/1013074183637602304;0
IamDeplorable4;2018-06-30 10:57;44;65;"Because I love my country I have no choice but to #WalkAway from the Radical Democratic Terrorizing Left. pic.twitter.com/27Ufaq6rQD";;;#WalkAway;"1013073954372751360";https://twitter.com/IamDeplorable4/status/1013073954372751360;0
Pismo_B;2018-06-30 10:56;57;86;"#WalkAway from Gop / Dem / Green Party to #MAGA #WalkAway If you are Black, White or Brown to #MAGA #MakeAmericaGreatAgain #KeepAmericaGreat pic.twitter.com/XBhgI1R9Aa";;;#WalkAway #MAGA #WalkAway #MAGA #MakeAmericaGreatAgain #KeepAmericaGreat;"1013073912471511041";https://twitter.com/Pismo_B/status/1013073912471511041;0
UnitedWeStandDT;2018-06-30 10:52;64;108;"In my state we don’t have to declare a party I have never been affiliated with one but have voted for both my entire life. After the BS hate violence and Anti American ways of the Left I am choosing to #WalkAway I am now and will forever be registered Republican pic.twitter.com/vcV11rbFUc";;;#WalkAway;"1013072896531533825";https://twitter.com/UnitedWeStandDT/status/1013072896531533825;0
mariaelisasmith;2018-06-30 10:46;2503;5953;"Communism kills in order to gain power and then proceeds to starve everyone else to death. Socialists are sneakier. They play the victim-savior game and use "democracy" to get to power, and though the process is slower, the outcome is the same: poverty for everyone. #WalkAway";;;#WalkAway;"1013071299315425280";https://twitter.com/mariaelisasmith/status/1013071299315425280;0
pecunia55;2018-06-30 10:42;46;85;"#SaturdayMorning #FamiliesBelongTogetherMarch #WalkAway Where were you people when Obozo did the same? pic.twitter.com/QnqSfmk8AZ";;;#SaturdayMorning #FamiliesBelongTogetherMarch #WalkAway;"1013070393484238848";https://twitter.com/pecunia55/status/1013070393484238848;0
Mak1177;2018-06-30 10:41;22;77;"It’s time to leave a party that has no message for its people. Those that do have a message of policy are communists! #WalkAway #MAGA";;;#WalkAway #MAGA;"1013070109898928128";https://twitter.com/Mak1177/status/1013070109898928128;0
LindaLbutler;2018-06-30 10:33;35;123;"#walkaway Welcome home, we left the light on.";;;#walkaway;"1013068055352610816";https://twitter.com/LindaLbutler/status/1013068055352610816;0
Boltschik22;2018-06-30 10:27;53;192;"#WalkAway I did before it was cool and hip. After 30 years, on Sept. 11, 2001, I woke up. When I realized that everything I took for granted about America was on the line I opened my eyes and started paying attention. I became an Independent and have never looked back.";;;#WalkAway;"1013066463262007297";https://twitter.com/Boltschik22/status/1013066463262007297;0
sofinique1;2018-06-30 10:24;859;1061;"Hey #Liberals Show me who your friends are, and I will tell you what you are #WalkAway https:// twitter.com/_makada_/statu s/1012711080236404736 …";;;#Liberals #WalkAway;"1013065773068189696";https://twitter.com/sofinique1/status/1013065773068189696;1
2runtherace;2018-06-30 10:24;51;69;"Today is a good day to re_read this previous Q drop! Patriots are selfless!! #WhoIsQ #WalkAway #Together #GreatAwakening #QAnon #TheTruthIsOutThere #WWG1WGA @realDonaldTrump @GenFlynn pic.twitter.com/cspznOnGq5";;@realDonaldTrump @GenFlynn;#WhoIsQ #WalkAway #Together #GreatAwakening #QAnon #TheTruthIsOutThere #WWG1WGA;"1013065619183464448";https://twitter.com/2runtherace/status/1013065619183464448;0
Nunnistrunz;2018-06-30 10:21;88;121;"#MAGA BABY!!! #Trump2020 #RedWaveRising #WWG1WGA #WalkAway #Qanon pic.twitter.com/IZ2eo4IP8f";;;#MAGA #Trump2020 #RedWaveRising #WWG1WGA #WalkAway #Qanon;"1013065104919842816";https://twitter.com/Nunnistrunz/status/1013065104919842816;0
sunanabatra;2018-06-30 10:15;508;1015;"I asked a dear friend in LA why she chose to #WalkAway and her response is brutally honest. I know she’s not alone. Btw she’s referring to a savage killing of a kid in LA that’s getting absolutely no national coverage, because, narrative. Must never divert from the mothership. pic.twitter.com/T9aAcSWrp4";;;#WalkAway;"1013063387528347649";https://twitter.com/sunanabatra/status/1013063387528347649;0
steph93065;2018-06-30 10:13;45;72;"Democrats want to abolish the law enforcement agency that does this good work. Stunning #AbolishICE #AbolishDemocrats #walkaway https:// twitter.com/icegov/status/ 1009844246252343307 …";;;#AbolishICE #AbolishDemocrats #walkaway;"1013063036146335744";https://twitter.com/steph93065/status/1013063036146335744;1
musser_benson;2018-06-30 10:13;28;64;"I grew up in California. I decided to #WalkAway A few weeks ago while discussing immigration with a friend and was called a Nazi sympathizer for stating facts. I'm hispanic and my parents immigrated to the US from Mexico. How did this happen? YOU SAW THE FACTS";;;#WalkAway;"1013062955380994050";https://twitter.com/musser_benson/status/1013062955380994050;0
steph93065;2018-06-30 10:11;38;52;"The Democrats want to abolish @ICEgov #AbolishICE #AbolishDemocrats #WalkAwayCampaign #walkaway https:// twitter.com/icegov/status/ 1012004394525589504 …";;@ICEgov;#AbolishICE #AbolishDemocrats #WalkAwayCampaign #walkaway;"1013062487065784320";https://twitter.com/steph93065/status/1013062487065784320;1
BooBooNyc;2018-06-30 10:10;16;59;"Hey liberals, ICE doesn’t separate children from their families at the border. What they actually do is save children from human traffickers. Enjoy being on the wrong side of history during your #FamiliesBelongTogetherMarch . #WalkAway";;;#FamiliesBelongTogetherMarch #WalkAway;"1013062323362295808";https://twitter.com/BooBooNyc/status/1013062323362295808;0
MrsKHuie;2018-06-30 10:06;22;30;"I lost a group of friends because I was 'on the fence' about a 'Muslim ban'. Within mere minutes I was ostracized and called a bigot, racist and xenophobic. Nevermind that I was dating someone at the time who was an immigrant and his father was Muslim. #WalkAway https:// twitter.com/DeepTweetedOne /status/1012915174544510976 …";;;#WalkAway;"1013061192409964544";https://twitter.com/MrsKHuie/status/1013061192409964544;1
HaynusPaynus;2018-06-30 09:58;100;329;"I used to be a pretty strong liberal because I thought they were the progressive ones that would lead to a better future... until racism towards whites, sexism towards men, violence, lies, misinformation, and so much more happened. #WalkAway";;;#WalkAway;"1013059166330671105";https://twitter.com/HaynusPaynus/status/1013059166330671105;0
Libertyiolar;2018-06-30 09:57;85;322;"I voted for Obama. I wanted to see our politics change, I wanted more than we had. Twice, I made a mistake. Then I was offered Hillary. No! She offended me long ago by taking her husband’s infidelity and blaming the girl. I am another #walkaway";;;#walkaway;"1013058973178703872";https://twitter.com/Libertyiolar/status/1013058973178703872;0
Real_JimmyLee;2018-06-30 09:55;30;40;"#WalkAway #Democrats are walking away, because the party of #JFK does not exist anymore. That party has slide so far to the extreme left it is unrecognizable. Being an #independent is growing #fast & more are joining the @GOP We welcome you all. Because its about #America pic.twitter.com/qybFvMo4Ww";;@GOP;#WalkAway #Democrats #JFK #independent #fast #America;"1013058325280444417";https://twitter.com/Real_JimmyLee/status/1013058325280444417;0
1Romans58;2018-06-30 09:52;72;61;"Threats, intimidation, violence... This is the Left, this has ALWAYS been the Left. The mask is off for all to see. #WALKAWAY WaPo‘s Rubin: Threaten Maine‘s LL Bean If Susan Collins Doesn‘t Vote Against Trump‘s SCOTUS Pick | Breitbart http:// bit.ly/2IDQxbS via @BreitbartNews";;@BreitbartNews;#WALKAWAY;"1013057753668112384";https://twitter.com/1Romans58/status/1013057753668112384;0
mzkillakim1;2018-06-30 09:44;29;79;"#walkaway I walked away cause I paid attention to the Obama Presidency voted 4 him 2 Times I seen how he treated Hillary then hired Hillary then Bernie got Burned by DNC! #DemExit then I witnessed the hate 2 the right& discovered they hate truth cause they always tell lies!";;;#walkaway #DemExit;"1013055599871864832";https://twitter.com/mzkillakim1/status/1013055599871864832;0
antoniaiadi;2018-06-30 09:41;64;339;"IT'S NOT LIE THEY WORK FOR CASH PAY NO TAXES AND LIVE ON WELFARE I CAN GIVE YOU NAME AND ADDRESSES OF PEOLE WHO HAVE BEEN HERE 10 YRS ON WELFARE STILL ILLEGAL NO LATINA NANNY CLEANING PERSON OR HANDY MAN WILL ACCEPT A CHECK ONLY CASH WHY DO YOU THINK???? #WALKAWAY FROM SOCIALISM";;;#WALKAWAY;"1013054818598998016";https://twitter.com/antoniaiadi/status/1013054818598998016;0
grindingdude;2018-06-30 09:40;24;43;"Things that make you go hmmm. #WalkAway pic.twitter.com/LcQ7h6kQSY";;;#WalkAway;"1013054571353133056";https://twitter.com/grindingdude/status/1013054571353133056;0
SilenceSpoken;2018-06-30 09:33;48;172;"I never voted until 2016, when I heard an outsider really talking TO ME, a middle-class conservative, and about things that made our country a proud and respected place. I voted because I finally felt hope things could get better. Bravo to all who #WalkAway";;;#WalkAway;"1013052832663195654";https://twitter.com/SilenceSpoken/status/1013052832663195654;0
KMGGaryde;2018-06-30 09:32;50;116;"It's time Jim Acosta....Walk Away. You are acting like a fool. You are not a journalist, just a third rate activist. Check your press credentials at the door on you your way out. #WalkAway #SaturdayMorning";;;#WalkAway #SaturdayMorning;"1013052539993018368";https://twitter.com/KMGGaryde/status/1013052539993018368;0
warrenramiscal;2018-06-30 09:28;161;375;"After reading so many #WalkAway stories, it truly amazes me how many people from all walks of life are abandoning the #DemocratsPartyOfHate . Stay woke. #QAnon pic.twitter.com/PwEd6DDJMw";;;#WalkAway #DemocratsPartyOfHate #QAnon;"1013051575147909120";https://twitter.com/warrenramiscal/status/1013051575147909120;0
chicagodevguy;2018-06-30 09:27;51;200;"How much longer will Twitter keep #WalkAway off the trending list?";;;#WalkAway;"1013051391839961089";https://twitter.com/chicagodevguy/status/1013051391839961089;0
GaryCMeleJr;2018-06-30 09:22;35;107;"Interesting how every third or fourth Tweet in my feed is a #WalkAway Tweet yet it’s not trending.";;;#WalkAway;"1013050218949029888";https://twitter.com/GaryCMeleJr/status/1013050218949029888;0
monkdds4;2018-06-30 09:11;6629;16177;"#WalkAway . I was a Bernie supporter. The Dems colluded against him and us with rigged primaries. Bernie laid down. The Clinton criminals corrupted the Dems and the Bushes corrupted the Repubs. They are all part of the same evil system. Drain the swamp! long live Donald Trump!";;;#WalkAway;"1013047382957875201";https://twitter.com/monkdds4/status/1013047382957875201;0
itzBarloz;2018-06-30 09:05;70;144;"I chose to #walkaway because being brown doesn't make me a victim. The true oppressors are the left. I can think for myself and will no longer feed off of lies. Tired of this hysteria that supposedly leads with tolerance and love, when in fact they lead with hate. #MAGA";;;#walkaway #MAGA;"1013045886371295232";https://twitter.com/itzBarloz/status/1013045886371295232;0
HalfFull07;2018-06-30 09:05;78;163;"#WalkAway #WalkAway Save your Crazy for another Day #WalkAway #WalkAway We want ICE so its here to STAY #WalkAway #WalkAway Trump Supporters are WINNING Hurray! #WalkAway #WalkAway Democrats have NOTHING to say #FamiliesBelongTogetherMarch pic.twitter.com/fIxQG196PM";;;#WalkAway #WalkAway #WalkAway #WalkAway #WalkAway #WalkAway #WalkAway #WalkAway #FamiliesBelongTogetherMarch;"1013045842893246465";https://twitter.com/HalfFull07/status/1013045842893246465;0
superyayadize;2018-06-30 08:57;131;159;"Reread the writs of roe v wade. The constitutionality of the decision is sketchy, possibly even absent #WalkAway #EndBlackGenocide #DefundPlannedParenthood Abortion procedures cause women great physical & mental health harm. Encouraging abortion as BC caused societal harm https:// twitter.com/kamalaharris/s tatus/1012789301539635202 …";;;#WalkAway #EndBlackGenocide #DefundPlannedParenthood;"1013043801429078016";https://twitter.com/superyayadize/status/1013043801429078016;1
DropTha_Mic25;2018-06-30 08:56;371;825;"I just read thru 100s of #WalkAway tweets & comments. I gotta tell ya, it's the most uplifting, loving, warm, welcoming, honest, hopeful, brave, patriotic hashtag in a very long time. Its awesome to see so many people of all different backgrounds come together as Americans! #MAGA";;;#WalkAway #MAGA;"1013043723620503552";https://twitter.com/DropTha_Mic25/status/1013043723620503552;0
IloveGOB;2018-06-30 08:56;290;940;"I drank the commie kool-aid when I went to college, since then I've done some thinking and realized it's all about taking people's rights away. #walkaway";;;#walkaway;"1013043526123380736";https://twitter.com/IloveGOB/status/1013043526123380736;0
peterpox;2018-06-30 08:53;186;770;"As a dark-skinned immigrant atheist (Christian now) I’d have been the perfect poster boy for the Democratic Party, but for one thing: there’s nothing I hate more than a defeatist victim mentality #WalkAway";;;#WalkAway;"1013042930351828992";https://twitter.com/peterpox/status/1013042930351828992;0
_Jess_The_Mess;2018-06-30 08:52;83;239;"I decided to #walkaway many years ago after living in the UK as a citizen and experiencing their socialist society. It opened my eyes to how exceptional America really is and I've been warning my liberal friends ever since. Wake up America, before it's too late!!";;;#walkaway;"1013042516139151360";https://twitter.com/_Jess_The_Mess/status/1013042516139151360;0
RepublicChic76;2018-06-30 08:51;4689;14410;"2015-2017 bullied on Facebook and Instagram because of my support for President Trump. My Gma died and my family managed to blame 45 . I have decided to stop fighting ignorance and just #Walkaway because for every “friend/family” I lost I have gained #maga supporters";;;#Walkaway #maga;"1013042303747936256";https://twitter.com/RepublicChic76/status/1013042303747936256;0
JackPosobiec;2018-06-30 08:48;700;1160;"#WalkAway pic.twitter.com/nCPXWSVVea";;;#WalkAway;"1013041612719607808";https://twitter.com/JackPosobiec/status/1013041612719607808;0
sapphire_407;2018-06-30 08:47;517;1362;"Leaving the Democratic party is like leaving a religious cult. Friends and family will make you feel guilty, shame you then shun you. Still just #Walkaway #WalkawayCampaign";;;#Walkaway #WalkawayCampaign;"1013041335882993665";https://twitter.com/sapphire_407/status/1013041335882993665;0
Charley_Carroll;2018-06-30 08:44;59;200;"Told a former lib boss I support @realDonaldTrump . Several years of working together & subsequent friendship counted for nothing as I’m now horrid & despicable. Apparently I ruined his day. Yeah, buddy, and my ideology is poison. #tolerancefail #walkaway #walkawaycampaign";;@realDonaldTrump;#tolerancefail #walkaway #walkawaycampaign;"1013040622654181376";https://twitter.com/Charley_Carroll/status/1013040622654181376;0
stl_ar15;2018-06-30 08:43;175;574;"#WalkAway unbelievable that the hashtag isn’t trending. Typical silencing by the left. Welcome to those that have chosen to walk away from what they want you to believe. Keep it going!";;;#WalkAway;"1013040353216262144";https://twitter.com/stl_ar15/status/1013040353216262144;0
Chickeneddy;2018-06-30 08:39;58;247;"The response to my #walkaway tweet is amazing! Thanks for the support. It’s crazy to me to think that just a short time ago Bill Clinton and the things he said as a D would today be considered far right! Unreal how much the part has dove left. Scary really.";;;#walkaway;"1013039255730507776";https://twitter.com/Chickeneddy/status/1013039255730507776;0
Meme_Junkie_;2018-06-30 08:09;136;409;"As a lifetime liberal, my #WalkAway moment was when I was threatened with doxxing by radical leftists while debating nuclear power when I said you cant just ban all coal power, you need to wind down dependencies on them. The left hates economics as much as they hate biology.";;;#WalkAway;"1013031770361552896";https://twitter.com/Meme_Junkie_/status/1013031770361552896;0
treniatoday;2018-06-30 08:08;4109;10595;"After being trained and taught to vote Democrat I had no knowledge what I was voting for because I Was Told who to vote for. I voted for Obama two terms then woke up to the corruption of HIS Administration. Hillary corrupt campaign left me no other choice but to #WalkAway .";;;#WalkAway;"1013031595375190016";https://twitter.com/treniatoday/status/1013031595375190016;0
RKJ65;2018-06-30 08:08;71;395;"Apparently, MAGA morons have started a #WalkAway #WalkAwayCampaign hashtag about walking away from liberals/Dems. Yes--please do walk away, far far away.";;;#WalkAway #WalkAwayCampaign;"1013031484163330048";https://twitter.com/RKJ65/status/1013031484163330048;0
John3_and_16;2018-06-30 08:07;33;64;"Unskilled black CITIZENS are the most impacted by lower job availability b/c of competition with illegals. Our tax dollars (millions $$) spent to accommodate illegals: welfare, healthcare, education. Should be spent in our black USA CITIZENS' neighborhoods. #WalkAway pic.twitter.com/9CcT0bnGE3";;;#WalkAway;"1013031294278643714";https://twitter.com/John3_and_16/status/1013031294278643714;0
JoseMer0909;2018-06-30 08:01;34;134;"My #walkaway was in 1987, while in Army War Exercise, Reforger, in Germany, I saw a tall blonde blue eyed man, jump into a dumpster to collect MRE's that we were throwing away. Democrats, there is NO white privilege. Europe is not better. DNC masters of deception.";;;#walkaway;"1013029802985574400";https://twitter.com/JoseMer0909/status/1013029802985574400;0
Eduardo32068246;2018-06-30 08:00;829;1604;"AFTER 60 YEARS DEMOCRATS IN VIRGINIA ARE ONCE AGAIN TELLING CERTAIN PEOPLE "WE DON'T SERVE YOUR KIND IN OUR ESTABLISHMENT." #WalkAway pic.twitter.com/fAUUZLOzbY";;;#WalkAway;"1013029521950420992";https://twitter.com/Eduardo32068246/status/1013029521950420992;0
RadioInfluence;2018-06-30 08:00;41;81;"On this week's Dark To Light With @PoliticalOrgy & @tracybeanz , the #MainstreamMedia is a hot topic. Why does it seem that they jump the gun of politicizing everything? Check out what Frank & Beanz think about that and the #WalkAway Movement now! http:// ow.ly/47XO30kJCsI pic.twitter.com/aCtUASfU7z";;@PoliticalOrgy @tracybeanz;#MainstreamMedia #WalkAway;"1013029419995234306";https://twitter.com/RadioInfluence/status/1013029419995234306;0
AMErikaNGIRLBOT;2018-06-30 08:00;1158;1150;"Kamala Harris Refused To Help Disabled Iraq War Vet After Illegal Immigrants Ruined His Life #Libs put Illegals over Americans #Walkaway from this AntiAmerican Socialist Party!! #SaturdayMorning https://www. westernjournal.com/ct/kamala-harr is-refused-to-help-disabled-iraq-war-vet-after-illegal-immigrants-ruined-his-life/?utm_source=Twitter&utm_medium=MobileFloatingSharingButtons&utm_content=2018-06-26&utm_campaign=websitesharingbuttons …";;;#Libs #Walkaway #SaturdayMorning;"1013029390752669697";https://twitter.com/AMErikaNGIRLBOT/status/1013029390752669697;0
Krypdoe;2018-06-30 07:54;105;379;"was a huge bernie sanders supporter. but after he campaigned for HRC. I decided to #WalkAway . hes "fighting the establishment" but joins the establishment? the hypocrisy of the left is astounding.";;;#WalkAway;"1013028091407622144";https://twitter.com/Krypdoe/status/1013028091407622144;0
Truthseeker126;2018-06-30 07:42;664;1254;"Thank you @realDonaldTrump for always putting #AmericaFirst ! Most folks think logically and do not want lawlessness in We know you will continue to fight for us! #KAG #MAGA #RedWaveRising #WalkAway #SaturdayMorning https:// twitter.com/realdonaldtrum p/status/1013019990340046849 …";;@realDonaldTrump;#AmericaFirst #KAG #MAGA #RedWaveRising #WalkAway #SaturdayMorning;"1013024865618710528";https://twitter.com/Truthseeker126/status/1013024865618710528;1
masterghostdog;2018-06-30 07:36;154;643;"My best friend is gay. When he said he was going independent many of his friends said he was part of the problem. He became GOP and made sense so I followed. #WalkAway";;;#WalkAway;"1013023561173237762";https://twitter.com/masterghostdog/status/1013023561173237762;0
realMattCarrier;2018-06-30 07:34;91;160;"As a Conservative white Male I respect all cultures An people we have to stop looking at each other as enemies An stand together An unite as Americans. #WalkAWay";;;#WalkAWay;"1013022936482107393";https://twitter.com/realMattCarrier/status/1013022936482107393;0
trulyfakenewz;2018-06-30 07:19;39;160;"I know many are just now realizing it, but Conservatives have, at least since Reagan, been the party of equality and opportunity for everyone. Proud to see people being #woke to this reality. When you are ready to #walkaway - we are here for you.";;;#woke #walkaway;"1013019217548005376";https://twitter.com/trulyfakenewz/status/1013019217548005376;0
crickafer00;2018-06-30 07:03;283;301;"“Abolish ICE” Leftists NEED the illegal vote to maintain their power. They will sacrifice the safety of US citizens to keep it. They would rather see ICE eliminated then keep America safe. They are selling your freedom for their votes. #WalkAway https://www. westernjournal.com/abolish-ice-is -new-call-on-the-democrats-left-flank/ …";;;#WalkAway;"1013015164675862528";https://twitter.com/crickafer00/status/1013015164675862528;0
HeshmatAlavi;2018-06-30 07:01;409;481;"If you're wondering why over 50 million people in #Iran are living in poverty & where the $150bn & $1.7bn in cash that Obama sent to Tehran's mullahs went, here's a glimpse: Relatives of regime officials are purchasing such vehicles with that money. #WalkAway #QAnon pic.twitter.com/ktFYtY1RBt";;;#Iran #WalkAway #QAnon;"1013014648696631296";https://twitter.com/HeshmatAlavi/status/1013014648696631296;0
gr8tjude;2018-06-30 06:51;152;220;"Yep the more the left threatens- the more #walkaway Trump is President and a great one at that! No one in their right mind wants the Obama era back.... https:// twitter.com/foxnews/status /1013009161720942595 …";;;#walkaway;"1013012200989122560";https://twitter.com/gr8tjude/status/1013012200989122560;1
sarahtfchaudhry;2018-06-30 06:18;153;491;"I chose to #WalkAway from the hypocrisy that preaches “diversity” but has the media to demonize anyone who disagrees with them.";;;#WalkAway;"1013003774502170624";https://twitter.com/sarahtfchaudhry/status/1013003774502170624;0
sarahtfchaudhry;2018-06-30 06:12;61;231;"I am Asian-American woman; my parents were both legal immigrants. This doesn’t define my opinion. #WalkAway";;;#WalkAway;"1013002348296204288";https://twitter.com/sarahtfchaudhry/status/1013002348296204288;0
Jayne720;2018-06-30 05:51;173;249;"Viral ‘Walk Away’ Videos Highlight Growing Movement of Democrats Leaving the Party “These are the reasons why I became a liberal. And these are the same reasons why I am now walking away. I reject hate.” -Brandon Straka #walkaway #SaturdayMorning #AMjoy https:// m.theepochtimes.com/viral-walk-awa y-videos-highlight-growing-movement-of-democrats-leaving-the-party_2578446.html …";;;#walkaway #SaturdayMorning #AMjoy;"1012997018028072961";https://twitter.com/Jayne720/status/1012997018028072961;0
JMarkTroyer;2018-06-30 05:38;157;542;"This is so cool. I love seeing people walk away from the hate and vitriol of the Democrat Party. We conservatives welcome you to our diverse community with open arms and minds. #WalkAway";;;#WalkAway;"1012993834693914624";https://twitter.com/JMarkTroyer/status/1012993834693914624;0
PhilMcCrackin44;2018-06-30 05:18;302;631;"#ProblemsIDidntHave20YearsAgo Misguided Liberals who wake-up each day searching for a new reason to be offended. #WalkAway #TheDashRiprock pic.twitter.com/C1LHrN88La";;;#ProblemsIDidntHave20YearsAgo #WalkAway #TheDashRiprock;"1012988613569798144";https://twitter.com/PhilMcCrackin44/status/1012988613569798144;0
RodStryker;2018-06-30 05:17;986;1262;"Democrats have turned the once Golden State of California into a state of disaster. Cost of living & high taxes make it almost impossible to thrive there, unless you're an ILLEGAL migrant bleeding the system or overpaid Hollywierd CelebriTard towing the Democrat line. #WalkAway pic.twitter.com/QtDrHZOxUK";;;#WalkAway;"1012988433755762688";https://twitter.com/RodStryker/status/1012988433755762688;0
mitchellvii;2018-06-30 05:12;468;972;"#WalkAway is the new #MAGA for 2018. 2016 was for the Monster Vote. 2018 will be for the Moderate Democrat Vote abandoning their #AmericaLast Party for #MAGA . Trust me on this. This is how it will go down.";;;#WalkAway #MAGA #AmericaLast #MAGA;"1012987303118163968";https://twitter.com/mitchellvii/status/1012987303118163968;0
