username;date;retweets;favorites;text;geo;mentions;hashtags;id;permalink;retweetornot
Glipto;2018-07-03 09:35;69;200;"Will the last person leaving the Democrats turn out the lights? Thank you. #walkaway .";;;#walkaway;"1014140550637813760";https://twitter.com/Glipto/status/1014140550637813760;0
LATiffani1;2018-07-03 09:35;332;352;"This is why #WalkAway isn’t trending on Twitter. Corp support for lib hate & civil unrest dominates hence the shadow banning of Conservative voices & Free Thinkers. Their refusal to suspend Peter Fonda, Rosie O’Donnell, Chelsea Handler, Linda Sarsour etc. speaks volumes. pic.twitter.com/9tBcnDVDqD";;;#WalkAway;"1014140470522363905";https://twitter.com/LATiffani1/status/1014140470522363905;0
DebAlwaystrump;2018-07-03 09:34;29;28;"Breaking News Democrats announced their new name Democrat Socialists of America #WalkAway #DemExit run away as fast as you can and VOTE RED or end up eating out of garbage starving like Cuba & Venezuala which used 2B one of the richest countries in the World pic.twitter.com/HouiLwonSB";;;#WalkAway #DemExit;"1014140368273707008";https://twitter.com/DebAlwaystrump/status/1014140368273707008;0
zhane_gallardo;2018-07-03 09:34;48;52;"another Liar Democrat liberals are so easy to fool! #walkaway F#<king less people. https:// twitter.com/smartassy4ever /status/1014083818666553346 …";;;#walkaway #;"1014140294286094336";https://twitter.com/zhane_gallardo/status/1014140294286094336;1
ArchKennedy;2018-07-03 09:28;167;252;"Media Fail: Trump’s Approval Rating Improved During Manufactured Border Outrage #WalkAway #TuesdayThoughts #MAGA #KAG2020 http:// bit.ly/2lPOWH6";;;#WalkAway #TuesdayThoughts #MAGA #KAG2020;"1014138912938348545";https://twitter.com/ArchKennedy/status/1014138912938348545;0
Feisty_FL;2018-07-03 09:28;72;93;"Remember it was a Democratic Socialist who worked on Bernie Sanders campaign who tried to commit mass murder of Republican Congressmen on a baseball field 1 year ago. #WalkAway #TuesdayThoughts https:// twitter.com/lsferguson/sta tus/1014136925551316992 …";;;#WalkAway #TuesdayThoughts;"1014138762815856645";https://twitter.com/Feisty_FL/status/1014138762815856645;1
LadyRedWave;2018-07-03 09:22;72;69;"Good We need EVERYONE to #WalkAway WakeUp Peeps the #Dems will do NOTHING to help TRUE #American citizens they have thrown their support behind #MS13 , #IllegalAliens , raising your taxes & DIVISION & ANARCHY! https:// twitter.com/FoxBusiness/st atus/1014127696601808896 …";;;#WalkAway #Dems #American #MS13 #IllegalAliens;"1014137218141569024";https://twitter.com/LadyRedWave/status/1014137218141569024;1
AnnaApp91838450;2018-07-03 09:20;773;642;"https://www. cbsnews.com/amp/news/calif ornia-prosecutor-son-of-watergate-figure-arrested-on-child-porn-charges/?__twitter_impression=true … Patriots You Will Never Hear Lying Fake Media Talk About This Democrat AG Criminal In California People Wake Up Democrats Are Destroying Your State All They Are Focused On Are The ILLEGALS That Are Draing Your Budget Dry #MAGA #WalkAway";;;#MAGA #WalkAway;"1014136808354041856";https://twitter.com/AnnaApp91838450/status/1014136808354041856;0
Feisty_FL;2018-07-03 09:17;46;68;"Democrats don’t think, they do what their masters tell them to do. The woman who went after Scott Pruitt was reading from a piece of paper. #WalkAway https:// twitter.com/nyltak2015/sta tus/1014132214018158593 …";;;#WalkAway;"1014136021267738625";https://twitter.com/Feisty_FL/status/1014136021267738625;1
ArchKennedy;2018-07-03 09:15;114;123;"ICYMI: #WalkAway Campaign- WHY I LEFT LIBERALISM & THE DEMOCRATIC PARTY #TuesdayThoughts https:// youtu.be/4Pjs7uoOkag";;;#WalkAway #TuesdayThoughts;"1014135666576412672";https://twitter.com/ArchKennedy/status/1014135666576412672;0
JakeHighwell;2018-07-03 09:12;178;325;"“Woman Might Save America Yet” They already did . @nytimes in 2016 by voting for . @realDonaldTrump And they will do so again in 2020! Your forced trended propaganda pieces are not working! Ladies! #WalkAway";;@nytimes @realDonaldTrump;#WalkAway;"1014134861328773120";https://twitter.com/JakeHighwell/status/1014134861328773120;0
XBeach_LivingX;2018-07-03 09:10;50;77;"Obama played his "Race" Card Hillary Played her "Sexist" Card Americans Played their "Trump" Card BOOM #MAGA #KAG #Trump2020 #TuesdayThoughts #MorningJoe #WalkAway pic.twitter.com/asFUqWhiRC";;;#MAGA #KAG #Trump2020 #TuesdayThoughts #MorningJoe #WalkAway;"1014134299690455040";https://twitter.com/XBeach_LivingX/status/1014134299690455040;0
chfortrump;2018-07-03 09:08;286;230;"This Dominican gang is called the Trinitarios .. @POTUS @realDonaldTrump please add this gang to your list too. #MS13 are not the only gang out there. Attention @ICEgov ! ( Ps stop defending & protecting these animals @NancyPelosi @KamalaHarris @SenSchumer @NYCMayor #Walkaway https:// twitter.com/madisongesiott o/status/1010512935620399104 …";;@POTUS @realDonaldTrump @ICEgov @NancyPelosi @KamalaHarris @SenSchumer @NYCMayor;#MS13 #Walkaway;"1014133690778181632";https://twitter.com/chfortrump/status/1014133690778181632;1
Patriot_Mom_17;2018-07-03 09:06;80;128;"Good Morning Patriots! Emancipate yourselves from mental slavery, none but ourselves can free our minds! - Marcus Garvey #WalkAway pic.twitter.com/MXZFCo9NBQ";;;#WalkAway;"1014133279732260866";https://twitter.com/Patriot_Mom_17/status/1014133279732260866;0
mitchellvii;2018-07-03 09:05;533;1326;"DEAR DEMOCRATS: If you call everyone you don't agree with a #Nazi , it kind of loses its punch, you know? #WalkAway";;;#Nazi #WalkAway;"1014133107459526657";https://twitter.com/mitchellvii/status/1014133107459526657;0
Lisa1White;2018-07-03 09:04;165;495;"Registered Democrat, votes for Obama, twice. Left when questions about the parties belief system didn't get answered, only got me labeled a racist, homophobic, bigot. I can no longer be a part of that crazy. #WalkAway #WalkAwayCampaign";;;#WalkAway #WalkAwayCampaign;"1014132794338041857";https://twitter.com/Lisa1White/status/1014132794338041857;0
CLK54321;2018-07-03 09:04;38;64;"Shame on all of you white people demeaning an intellectually superior black man. Clarence Thomas has more intelligence in his pinky finger than all of you put together. He’s also more powerful. Democrats hate powerful black men. #WalkAway";;;#WalkAway;"1014132701203521537";https://twitter.com/CLK54321/status/1014132701203521537;0
TranslateRealDT;2018-07-03 09:04;765;1020;"Trump is trying hard to promote the lie that millions of Democrats are choosing to #WalkAway from their party. Based on observable bot activity this hashtag is either an alt-right troll amplified by Russian bots or a Russian disinformation campaign adopted by the alt-right. Sad! pic.twitter.com/MwLcScpmnv";;;#WalkAway;"1014132685466456064";https://twitter.com/TranslateRealDT/status/1014132685466456064;0
LaylaAlisha11;2018-07-03 09:03;111;129;"Democrats: For one week, get some alternative news other than #MSNBC / #CNN . After 1 week, you will see that the Dem party has not only Left you, they are Lying to you. Look at facts & do research. If you don’t do it for yourselves, do it for your children. #WalkAway #NoJudgement";;;#MSNBC #CNN #WalkAway #NoJudgement;"1014132503538479104";https://twitter.com/LaylaAlisha11/status/1014132503538479104;0
realbhejana;2018-07-03 08:59;402;1088;"A truly socialist society means you own nothing, govt owns everything. You own no cars, no cellphone, no house etc, unless if the govt leases it to you. You worship the govt too. Socialism in America will be the biggest heist in human history, evil unseen before. #Walkaway";;;#Walkaway;"1014131528933216256";https://twitter.com/realbhejana/status/1014131528933216256;0
superyayadize;2018-07-03 08:58;110;92;"UK healthcare ‘professional’ arrested DT neonatal deaths - suspected of murder Post-birth abortions? Y’all they’re killing babies! #WalkAway https://www. cheshire.police.uk/news-and-appea ls/news/woman-arrested-in-connection-to-ongoing-investigation-into-the-neonatal-unit-at-the-countess-of-chester-hospital/ …";;;#WalkAway;"1014131340177002498";https://twitter.com/superyayadize/status/1014131340177002498;0
THEEricaDay;2018-07-03 08:55;90;316;"I think the FIRST thing folk need to understand is that it is not necessary to belong to ANY political party. To #WalkAway from Dems does NOT mean becoming a Repub. It's about #FreeThinking . #CRITICALThinking";;;#WalkAway #FreeThinking #CRITICALThinking;"1014130586984898560";https://twitter.com/THEEricaDay/status/1014130586984898560;0
mahsti25metana1;2018-07-03 08:48;64;71;"Head of #Iran regime Passive Defense Organization. claims #Israel & #US are responsible for #Iran 's water crisis by means of de-fertilizing clouds! #WalkAway #FreeIran2018 #WaterCrisis pic.twitter.com/lVaKHzJoMa";;;#Iran #Israel #US #Iran #WalkAway #FreeIran2018 #WaterCrisis;"1014128624281243648";https://twitter.com/mahsti25metana1/status/1014128624281243648;0
2runtherace;2018-07-03 08:45;37;49;"!!NEW Q!! 01:26 Q posts a search of ‘Trump lawyer family first’ that brings up articles from multiple news sources and says, “[4am] What will tomorrow be? Coordinated! What happened to Stormy? Fake news!” #QAnon #WhoIsQ #WalkAway #Q #FakeNews #LiberalLies @realDonaldTrump pic.twitter.com/SilN8w2tSh";;@realDonaldTrump;#QAnon #WhoIsQ #WalkAway #Q #FakeNews #LiberalLies;"1014128107626860544";https://twitter.com/2runtherace/status/1014128107626860544;0
2runtherace;2018-07-03 08:45;25;37;"!!NEW Q!! 00:58 Q posts last two drops and includes a previous Q drop from 05/10 re. Five Eyes with this part highlighted: U.S. [in] NZ = No Logs/No Records!! Is this why HRC was in NZ? #QAnon #WhoIsQ #WalkAway #LiberalLies @realDonaldTrump pic.twitter.com/bAFQfS8TA0";;@realDonaldTrump;#QAnon #WhoIsQ #WalkAway #LiberalLies;"1014128088677003265";https://twitter.com/2runtherace/status/1014128088677003265;0
McDucky333;2018-07-03 08:43;27;74;"This is how our president @realDonaldTrump starts his day! #MAGA #MAGA2020 #WalkAway @DiamondandSilk pic.twitter.com/1eFmSICs4H";;@realDonaldTrump @DiamondandSilk;#MAGA #MAGA2020 #WalkAway;"1014127564397404166";https://twitter.com/McDucky333/status/1014127564397404166;0
Kinakouture;2018-07-03 08:41;54;197;"Don't want socialism, I choose freedom #WalkAway";;;#WalkAway;"1014127048447668225";https://twitter.com/Kinakouture/status/1014127048447668225;0
President1Trump;2018-07-03 08:40;458;741;"“I think it’s a sad day in America when Democrats only message is to attack people who support this president and support this country”! @PressSec #WalkAway pic.twitter.com/lxmt9PXAbF";;@PressSec;#WalkAway;"1014126740002754560";https://twitter.com/President1Trump/status/1014126740002754560;0
President1Trump;2018-07-03 08:35;23;46;".⁦ @RepMaxineWaters ⁩ doesn’t have the capacity to play nice because she’s an uncivilized witch! She’s the definition of uncivilized=> Not at a stage of social, cultural or moral development. As displayed by her rudeness and bad manners! #WalkAway http:// thehill.com/homenews/house /395250-maxine-waters-is-done-with-nice-guy-politics …";;@RepMaxineWaters;#WalkAway;"1014125456805847042";https://twitter.com/President1Trump/status/1014125456805847042;0
ThePatriot293;2018-07-03 08:34;27;57;"Why is twitter shadowbanning me? Simple, they deem me a threat to their propaganda. #PuertoRicansForTrump #WalkAway #TuesdayThoughts pic.twitter.com/Vysmz05D12";;;#PuertoRicansForTrump #WalkAway #TuesdayThoughts;"1014125349892968450";https://twitter.com/ThePatriot293/status/1014125349892968450;0
ConservativeTht;2018-07-03 08:34;20;29;"Many of us have been deeply moved by the powerful Brandon Straka @usminority video where he eloquently explains why he left the Democrat Party. What you may not be aware of are the many Facebook testimonies of OTHERS who have joined his #WalkAway movement. http:// bit.ly/2tPnfCz";;@usminority;#WalkAway;"1014125122368794624";https://twitter.com/ConservativeTht/status/1014125122368794624;0
RedPillBlackMan;2018-07-03 08:33;25;38;"#walkaway movement gathers motivation from liberals motto of' everyone's first, America last.'";;;#walkaway;"1014125053598785537";https://twitter.com/RedPillBlackMan/status/1014125053598785537;0
RedPillBlackMan;2018-07-03 08:28;50;91;"An average black family has an absent dad because he is in jail and when kids grow up they end up being members of neighborhood gangs. All these, thanks to liberalism and sanctuary City laws. #walkaway";;;#walkaway;"1014123723836669952";https://twitter.com/RedPillBlackMan/status/1014123723836669952;0
Megggusta;2018-07-03 08:27;95;365;"I started questioning the drone strikes and the mess that Hillary left. When I saw the corruption in the DNC, I decided to #WalkAway . I still drive a Prius, eat vegetarian and advocate for animal rights... but we need common sense, not free stuff.";;;#WalkAway;"1014123411054972928";https://twitter.com/Megggusta/status/1014123411054972928;0
LVNancy;2018-07-03 08:24;1444;1259;"Obama Promised #ImmigrationReform but didn't deliver- And Democrats applauded: Strong #BorderSecurity Boots on southern border #ICE Establish responsible pathway to Citizenship Learn English Merit Based #Immigration #TuesdayThoughts #Trump #AmericaFirst #MAGA #WalkAway pic.twitter.com/x28nTopiaX";;;#ImmigrationReform #BorderSecurity #ICE #Immigration #TuesdayThoughts #Trump #AmericaFirst #MAGA #WalkAway;"1014122815354646528";https://twitter.com/LVNancy/status/1014122815354646528;0
Redisright1;2018-07-03 08:23;24;32;"Team trump respects all people from any and all walks of life. Contrary to the lefts beliefs. Not sure how making America great is in any form racist. #MAGA #WalkAway #DemocratsHateAmerica pic.twitter.com/UDs88KmLjb";;;#MAGA #WalkAway #DemocratsHateAmerica;"1014122446285352966";https://twitter.com/Redisright1/status/1014122446285352966;0
RebeccaDowns7;2018-07-03 08:22;34;103;"Millienials are going from 2 or 3 part-time jobs to full time employment with good benefits. Actually being offered employer matched 401k's. Seeing what happens with a good economy is turning heads and the young #WalkAway They are enjoying the "CRUMBS" and want MORE "CRUMBS"!";;;#WalkAway;"1014122323035738112";https://twitter.com/RebeccaDowns7/status/1014122323035738112;0
Shar_n_Shar;2018-07-03 08:20;88;84;"#Walmart selling Impeach 45 t-shirts is a disgraceful slap in the face to ALL #Americans As for me...I'll be #Boycott #Walmart #WalkAway @SamsClub @Target @Costco @Kohls @marshalls @jcpenney pic.twitter.com/l2y6Cwz4Wr";;@SamsClub @Target @Costco @Kohls @marshalls @jcpenney;#Walmart #Americans #Boycott #Walmart #WalkAway;"1014121815717892096";https://twitter.com/Shar_n_Shar/status/1014121815717892096;0
Dogman1013;2018-07-03 08:19;364;457;"Tell me, who cares more about children at the border. Dumb Dems can fool their own dumb kind, but true Patriots know and understand the truth. THIS is why they want ICE abolished. They WANT child traffickers. #NoPedos #WalkAway #NoCommies #PartyOfHate pic.twitter.com/NWM7ITPy70";;;#NoPedos #WalkAway #NoCommies #PartyOfHate;"1014121367854305284";https://twitter.com/Dogman1013/status/1014121367854305284;0
AndyHortin18;2018-07-03 08:17;57;57;"Check out the full #WalkAway video and details about the #WalkAway Campaign by @usminority here: http:// facebook.com/usminority/vid … (plz retweet ) pic.twitter.com/i2OTkxtFlE";;@usminority;#WalkAway #WalkAway;"1014121050265866241";https://twitter.com/AndyHortin18/status/1014121050265866241;0
AnnaApp91838450;2018-07-03 08:13;1189;1344;"http://www. foxnews.com/politics/2018/ 07/03/nunes-slams-schiff-over-threat-to-hold-gop-accountable-for-probing-alleged-surveillance-trump-campaign.amp.html?__twitter_impression=true … Between Courrpt DOJ/FBI Lying Criminal Leaker Schiff We The People Have Had It! Patriots Stand Up RT In Support For Devin Nunes That Has Fought His A$$ Against Corrupt Democrats #MAGA #JUSTICENOW #WalkAway #AnnaLovesTrump #TrumpsSuperElites";;;#MAGA #JUSTICENOW #WalkAway #AnnaLovesTrump #TrumpsSuperElites;"1014120020656435202";https://twitter.com/AnnaApp91838450/status/1014120020656435202;0
CamoGirl2U;2018-07-03 07:58;58;193;"This #WalkAway movement is so inspiring. It makes me so proud to be a Republican. I walked away 11 years ago.";;;#WalkAway;"1014116135497797632";https://twitter.com/CamoGirl2U/status/1014116135497797632;0
DoingRight1;2018-07-03 07:54;96;140;"Why isn’t there talk about Debbie Wasserman Schultz. This can be the key to all the corruption. Republicans do not stay quiet and forget about this issue. #Trump #Trump2020 #MAGA #WalkAway #Right #Conservative #independent pic.twitter.com/efrSMygESX";;;#Trump #Trump2020 #MAGA #WalkAway #Right #Conservative #independent;"1014115205163470848";https://twitter.com/DoingRight1/status/1014115205163470848;0
pob1966;2018-07-03 07:51;50;135;"Of course, Twitter will not allow #WalkAway to trend, so we’ll have to spread the word the old fashioned way. Keep the momentum going! #MAGA #WalkAway";;;#WalkAway #MAGA #WalkAway;"1014114422342725633";https://twitter.com/pob1966/status/1014114422342725633;0
AnonymousInfo3;2018-07-03 07:47;25;26;"That is WHY #Potus & #QArmy FIGHT They FIGHT to SAVE the WORLD You should LISTEN THEM ! THEY LOVE YOU ! ITS A FIGHT GOOD VS EVILS PLEASE PLEASE #WakeUpAmerica #WalkAway AND WAKE OTHER UP ITS #Endgame NOW ! PRAY ! PRAY ! pic.twitter.com/ExAkZlXGTA";;;#Potus #QArmy #WakeUpAmerica #WalkAway #Endgame;"1014113304984408064";https://twitter.com/AnonymousInfo3/status/1014113304984408064;0
Feisty_FL;2018-07-03 07:47;41;74;"More Fake News. 66% of Trump supporters are minorities, female and college educated. (I am all three) The more you lie, the more we win. #WalkAway https:// twitter.com/zecherjanie/st atus/1014108615857393664 …";;;#WalkAway;"1014113274697256960";https://twitter.com/Feisty_FL/status/1014113274697256960;1
covfefeartist;2018-07-03 07:45;71;84;"Time to #WalkAway from Walmart for selling baby clothes with this .. https://www. walmart.com/ip/Impeach-45- 45th-President-Donald-Trump-Soft-Baby-One-Piece/791952219 …";;;#WalkAway;"1014113013589336065";https://twitter.com/covfefeartist/status/1014113013589336065;0
bowhunter_va;2018-07-03 07:44;62;67;"Libturds care more about animal lives in Africa, than they do HUMAN LIVES in the United States! #LiberalismIsAMentalDisease #MAGA #WalkAway #BowHunt711 https:// twitter.com/bowhunter_va/s tatus/1013837894367305729?s=19 … pic.twitter.com/L5tIfdgAEc";;;#LiberalismIsAMentalDisease #MAGA #WalkAway #BowHunt711;"1014112726036172801";https://twitter.com/bowhunter_va/status/1014112726036172801;0
bizcochico;2018-07-03 07:44;552;1698;"I’m a #gay #Jew , but some of my favorite people are straight white #Christian men. The #AltLeft says these people are my enemy, so I #WalkAway . I can pick my own friends, thank you. #WalkAwayMovement";;;#gay #Jew #Christian #AltLeft #WalkAway #WalkAwayMovement;"1014112718238945280";https://twitter.com/bizcochico/status/1014112718238945280;0
CitizensMandate;2018-07-03 07:44;52;73;"Thank you President @realDonaldTrump for showing the world who the Democrats really are! #MAGA #WalkAway pic.twitter.com/j3779mrF55";;@realDonaldTrump;#MAGA #WalkAway;"1014112524310990849";https://twitter.com/CitizensMandate/status/1014112524310990849;0
Feisty_FL;2018-07-03 07:38;76;72;"Scott Pruitt was verbally assaulted by a woman holding a toddler while he was having dinner at a restaurant. The insane Democrats are following their leader #MadMaxine #WalkAway #TuesdayThoughts #MorningJoe pic.twitter.com/T3lg9Q2d6Y";;;#MadMaxine #WalkAway #TuesdayThoughts #MorningJoe;"1014111170620477440";https://twitter.com/Feisty_FL/status/1014111170620477440;0
MaryGioiaGrace;2018-07-03 07:36;23;723;"Oh good Lord just stop it already. #WalkAway";;;#WalkAway;"1014110694533484546";https://twitter.com/MaryGioiaGrace/status/1014110694533484546;0
aceinnice;2018-07-03 07:34;171;888;"I grew up on the east coast in the 80s. I remember the admiration, I remember the impression he made. I never understood all the hype against him in 2016 (even worse overseas) and couldn't bring myself to vote for him. That's changed.... #WalkAway";;;#WalkAway;"1014110192777220098";https://twitter.com/aceinnice/status/1014110192777220098;0
Feisty_FL;2018-07-03 07:34;81;107;"Has anyone else noticed that the Democrats, visciously attack women in the Trump administration. Remember how they attacked Gina Haspel who was well qualified to be CIA Director. Now they are after Amy Coney Barrett. They fear conservative women. #TuesdayThoughts #WalkAway pic.twitter.com/eXR4q8eh4H";;;#TuesdayThoughts #WalkAway;"1014110131431313408";https://twitter.com/Feisty_FL/status/1014110131431313408;0
Aikens_Josh;2018-07-03 07:32;40;51;"So did they children go to prison with their parents? Or did you just never win a case? This is Pander 101 & American Citizens of all walks of life are Fodder for this political power game you Dems are playing. #LoveLibsHate #WalkAway #DemsAgainstCitizens https:// twitter.com/kamalaharris/s tatus/1013894581207912452 …";;;#LoveLibsHate #WalkAway #DemsAgainstCitizens;"1014109705319407616";https://twitter.com/Aikens_Josh/status/1014109705319407616;1
annvandersteel;2018-07-03 07:32;151;174;"It is all about #humantrafficking and #ChildPornography for the DEMS. This is their platform. This is their legacy. This is why they are going to #WalkAway https:// twitter.com/JacobAWohl/sta tus/1013933900362498049 …";;;#humantrafficking #ChildPornography #WalkAway;"1014109637237510145";https://twitter.com/annvandersteel/status/1014109637237510145;1
awaken_to_maga;2018-07-03 07:22;83;87;"https:// youtu.be/q6N4zKM2cZs The Duke knew. #UnitedWeMAGA #GreatAwakening #WalkAway #MAGA #KAG #Midterms2018 #TuesdayThoughts #AwakenToMAGA";;;#UnitedWeMAGA #GreatAwakening #WalkAway #MAGA #KAG #Midterms2018 #TuesdayThoughts #AwakenToMAGA;"1014107186354704385";https://twitter.com/awaken_to_maga/status/1014107186354704385;0
CJPatruno;2018-07-03 07:22;47;101;"No, liberals aren’t converting to the right wing in droves. The #WalkAway meme is what happens when everything is viral and nothing matters. https://www. washingtonpost.com/news/the-inter sect/wp/2018/07/02/the-walkaway-meme-is-what-happens-when-everything-is-viral-and-nothing-matters/ … pic.twitter.com/7BxaFfZKTL";;;#WalkAway;"1014107071862771717";https://twitter.com/CJPatruno/status/1014107071862771717;0
wsredneck;2018-07-03 07:19;107;368;"That’s why #walkaway is growing stronger. People are seeing the truth and the truth is setting them free.";;;#walkaway;"1014106458118639616";https://twitter.com/wsredneck/status/1014106458118639616;0
amos_coates;2018-07-03 07:16;406;1083;"I choose to #WalkAway when I realized that white liberals are the most racist and patronizing folks on the planet. Look at what their policies have done to the inner city.";;;#WalkAway;"1014105567936344065";https://twitter.com/amos_coates/status/1014105567936344065;0
Blackdi51264299;2018-07-03 07:10;47;64;"Alan Dershowitz slams Martha's Vineyard liberals for 'shunning' him over Trump defense via the @FoxNews App #WalkAway http://www. foxnews.com/politics/2018/ 07/03/alan-dershowitz-slams-marthas-vineyard-liberals-for-shunning-him-over-trump-defense.html …";;@FoxNews;#WalkAway;"1014104021743915008";https://twitter.com/Blackdi51264299/status/1014104021743915008;0
mahsti25metana1;2018-07-03 07:09;74;73;"Watch farmers in Khuzestan province, one of the richest province in #Iran . #WaterCrisis , Iran has no water #WalkAway #IranRegimeChange pic.twitter.com/lFkQMx1Y4M";;;#Iran #WaterCrisis #WalkAway #IranRegimeChange;"1014103764322668544";https://twitter.com/mahsti25metana1/status/1014103764322668544;0
President1Trump;2018-07-03 07:05;29;60;"President @realDonaldTrump has a message for people against @ICEgov ! “People will be Voting Republican in November”! #RedWave2018 #WalkAway pic.twitter.com/s070OHuyTQ";;@realDonaldTrump @ICEgov;#RedWave2018 #WalkAway;"1014102714572255232";https://twitter.com/President1Trump/status/1014102714572255232;0
DJTsavesAmerica;2018-07-03 06:57;90;87;"What L.A. Residents Really Think of L.A. as a Sanctuary City - Town Hall https:// youtu.be/gSi3S3T8GEw via @YouTube #WalkAway #FamiiesBelongTogether #BreakingNews #BuildThatWall #BuildTheWall";;@YouTube;#WalkAway #FamiiesBelongTogether #BreakingNews #BuildThatWall #BuildTheWall;"1014100762467504129";https://twitter.com/DJTsavesAmerica/status/1014100762467504129;0
HeshmatAlavi;2018-07-03 06:55;74;78;"Hassan Rouhani: "An American said we will take measures to prevent #Iran from exporting oil... Not allowing Iran export its oil means the entire region's oil won't be exported." Reminder: Tehran has threatened to close the Strait of Hormuz many times. #QAnon #WalkAway pic.twitter.com/8tkTP3N085";;;#Iran #QAnon #WalkAway;"1014100430635143174";https://twitter.com/HeshmatAlavi/status/1014100430635143174;0
AndyHortin18;2018-07-03 06:55;257;314;". @robsmithonline : As a black man, Dems want me to be a victim. They call me Uncle Tom for talking about problems in the black community. They want me to find empowerment in victimhood, but as a veteran, I was NEVER a victim. It was time for me to #WalkAway pic.twitter.com/d77yXqdMJM";;@robsmithonline;#WalkAway;"1014100331909664768";https://twitter.com/AndyHortin18/status/1014100331909664768;0
DahSwitch;2018-07-03 06:54;99;307;"I chose to #WalkAway a long time ago after seeing how my Democrat friends ganged up on ppl with different thoughts, and who asked simple questions.";;;#WalkAway;"1014100065852493824";https://twitter.com/DahSwitch/status/1014100065852493824;0
